id,tweet,time,description
1291096970409512963,"Amazing article @AlexInAir

Why Aviation Sectors Must Confront COVID19, Not Hide From It • AVIATION ANALYST… https://t.co/9Y8vZ1BmcF",2020-08-05 19:41:19,"Welcome to @aviaforaviators, we are an aviation page that serves, benefits and entertains aviation's enthusiasts through social media networking platforms ✈️"
1291097226014597125,RT @dangelno: being in this pandemic is like being in a group project with several million people who refuse to do the work,2020-08-05 19:42:20,Music lover in general & JAMC aficionada specifically. History geek. Seeker of exotic jams and preserves. Observer of absurdity.
1291096921034174470,"RT @GAFollowers: A second grader in Cherokee County tested positive for coronavirus after attending the first day of school.

(READ HERE) h…",2020-08-05 19:41:08,ATL | Michigan State Alumna💚 Fashion designer Clothing line IG: @SaintOndres & @SaintOndresTour
1291097185745096704,"RT @CP24: Premier Doug Ford says he 'won't hesitate' to close schools if COVID-19 cases surge during a second wave.
https://t.co/3iKcZ2tzXp…",2020-08-05 19:42:11,"Win the crowd. This we dedicate, to the one and only, never be another...he was my brother, Kobe Bean..."
1291096971529400321,"Remote learning is not a vacation. It's hard. Teachers would love to be back in school, but they want their student… https://t.co/0Te4rXMurS",2020-08-05 19:41:20,"Future Music Educator and Aspiring Composer

Tech Enthusiast | Cat Lover | Proud Conservative 🇺🇸 | ΤΒΣ | TLU'20"
1291096726913392642,RT @Maryam_Rajavi: Increasing the price of gasoline and bread for workers amid the #coronavirus crisis is the other side of the 30 billion…,2020-08-05 19:40:21,Humanrights activist. I am fighting for a free Iran
1291097000352440320,"RT @Jonathan_K_Cook: Wonderful to see someone I had always dismissed as a pampered, brainless corporate journalist offering to sacrifice he…",2020-08-05 19:41:26,"Lapsed novelist on the fall of empires; (col)lapsed researcher of collapse, and what it might teach, if we listened.
Novel website: https://t.co/ZzFwjvjRjb"
1291096652128727045,"Were it not for Covid impacting theme parks, resorts and movie productions, Disney would have been on track to beco… https://t.co/eiZuiYZ5FF",2020-08-05 19:40:03,"Head of GTM & BD @Remitly. Alumni @Cartainc, @Amazon, @CommonBond, @YIDeveloper, Investor @Blendlabsinc, @GitLab, @Auth0, @Cohesity, @Rubrikinc, @Cartainc"
1291097167084625920,"RT @jackiembouvier: We are frogs in a pan of water slowly getting hotter. Protesters are shot, wages freeze, evictions continue, we are for…",2020-08-05 19:42:06,"chase lizards, bark at donkeys #DEFUNDTHEPOLICE"
1291096946724098048,"RT @rocktop15: @ElonBachman Lockdowns don’t work?  NBA, MLS, NHL having virtually no cases in their bubbles. Masks and social distancing wo…",2020-08-05 19:41:14,Anti-theistic Atheist. Reality is binary either True or False..we have got no other choices. RTs are meant for triggering purposes only! 😂@IncIndia
1291096794647191553,"RT @drsimonegold: Hydroxychloroquine has been safely prescribed hundreds of millions of times since the FDA approved it 65 years ago. 

CDC…",2020-08-05 19:40:37,Proud American Family Man.
1291097184696500225,RT @grantstern: We're six months into a deadly #coronavirus pandemic which has become an American epidemic and Trump STILL doesn't have a n…,2020-08-05 19:42:10,"Wife to my soulmate of over 40 years, Grandmother of nine beautiful kiddos. Peace and always Blue💙."
1291097056438697984,RT @mikecwright: Spurs coach Gregg Popovich on the league’s announcement today of no positive cases for COVID-19: https://t.co/ZhKuw6sIzb,2020-08-05 19:41:40,Head Coach of the USA Water Polo Women's National Team
1291097081076039680,"RT @ritasfenty: Please, one pandemic at a time.",2020-08-05 19:41:46,"It's about to be a year later and we're still in a pandemic... Still.

#BLM ✊🏿
❤💜💙💚💛🧡🏳️‍🌈"
1291097032539566081,"No Shame whatsoever, Ozil is the reason they aren’t getting paid when they’re all employees?!😂 https://t.co/haWv6mzpVk",2020-08-05 19:41:34,Confidence is not a guarantee of success but a pattern of thinking that will improve your likelihood of success. I can plan your thoughts.
1291096609271488513,RT @lcsmchat: #LCSM Chat discussed #COVID_19 &amp; lung cancer on 4/2. Much has changed in 4 months! The USA had ~4.5 million COVID-19 cases &amp;…,2020-08-05 19:39:53,"Founder of Nonprofit yEAHbestlife, Wife, Mother, Pilot, Living with Stage IV Lung Cancer, ALK positive, Patient Advocate"
1291097029414998018,"RT @SJosephBurns: 26,160 U.S restaurants have closed from March to July due to the pandemic, 16,000 have failed permanently: @Yelp",2020-08-05 19:41:33,
1291096584805998592,RT @ruthmkb: 😠WTH??? Saskatchewan Schools Cutting Back On Cleaning Staff As Students Head Back to Class During a Pandemic. #ScottMoe #covid…,2020-08-05 19:39:47,"Your friendly HR peep. A great life needs smooth waves, hygge living, giggles and food with friends, rugby, good gin, and monsters 🦇 She/her"
1291096673024909314,"RT @MarkWarner: I can't stress enough how crucial this is.

If Missouri can approve Medicaid expansion, I don't see why the Senate can't pa…",2020-08-05 19:40:08,Views=100% mine.
1291096580964126720,RT @RussianEmbassy: First #EMERCOM🇷🇺 plane with Russian #humanitarian assistance to #Lebanon lands in #Beirut with more to come. Teams of e…,2020-08-05 19:39:46,#cybersecurity #infosec #cryptography #python #Wikileaks #FreeJulianAssange
1291096997236109313,"RT @ForeignWelfare: In The Fight Against Covid19 please consider our  request , so that 50k more doctors can serve our country in this pand…",2020-08-05 19:41:26,doctor #letfmgserve #indianeedsfmgdoctors
1291096920543203329,"RT @nypost: Coronavirus vaccine likely won't be as effective in obese people, experts say https://t.co/APkFLxoC3G https://t.co/3dPL2hK58F",2020-08-05 19:41:07,The Body Electric.  Il Corpo Elettrico.  Art history major.  I admire artists.   ;-)  Italy rocks.  I follow Italians.
1291096741891121153,"RT @adoraIbe: a country that depends on imports to survive has officially lost its main sea port mid famine, covid-19, and an economic coll…",2020-08-05 19:40:25,🧶
1291096787030355969,"RT @tomaskenn: Trump said Ron Desantis and Rick Scott have been great Florida governors.

Rick Scott oversaw the largest Medicare fraud in…",2020-08-05 19:40:36,"Opinionated Sistah, views are my own."
1291096550530220038,RT @JoyAnnReid: This is awful. What kind of people would attack an epidemiologist for trying to help battle a pandemic??? This country is a…,2020-08-05 19:39:39,"Defender of the defenseless, champion of truth & honor, seeker of justice for those whose voices goes unheard..."
1291097017884782593,RT @infectio01: 22 frontline physicians dead in Venezuela for lack of PPE. #MaduroRegime #Dictator #narcoregime #SOSVenezuela,2020-08-05 19:41:31,
1291097151930540032,"RT @HuguenotHouse: Relatives in USA. Cousin is pediatric nurse. Just diagnosed with Covid.
Other cousin died, husband and son in hospital.…",2020-08-05 19:42:03,Citizen of the world. Antifascist. 🇧🇦🇷🇸🇭🇷🇧🇼🇿🇦🇺🇸🇬🇧🇪🇸🇪🇺
1291097700478443521,"RT @simon_orgill: Wtf man why would the City do this, people are struggling. Is this really the problems that our police need to do be deal…",2020-08-05 19:44:13,W.A.Y.S. ♋
1291097405883023362,This is literally the most soul-crushing headline possible... https://t.co/oX6BXxIglj,2020-08-05 19:43:03,"🚨WARNING🚨 May Contain 🏀/⚾, Nerdery, Sarcasm, Leftist Politics, and griping about the cold.
Kyle Lowry Over Everything.
He/Him"
1291097963759108097,"RT @CarolineLucas: Truly shocking insights into devastating impacts of Long Covid - previously fit people now using wheelchairs, people tol…",2020-08-05 19:45:16,"Wrong does not become right, lies do not become truth, and evil does not become good just because a majority supports it. #PersistAndPrevail #LeaveALightOn"
1291097843378335744,A vote for Nash is a vote for the good guys. https://t.co/jhb9i1IuDl,2020-08-05 19:44:47,
1291097809731694592,RT @RTDNEWS: Virginia officials on Wednesday launched a smartphone app that uses Bluetooth technology to alert people when they have come i…,2020-08-05 19:44:39,"20+yrs Social Work, Children/Adult Services (Citizen)"
1291097915117596672,"RT @DefNotDorothy: I’ve had one of those days. 
But if you get any kind of takeout, or delivery, or have your groceries delivered during th…",2020-08-05 19:45:05,"Lover of Baseball, Scrabble and adorable furry friends. She/Her. 🏳️‍🌈 #khive 💛💛💛❤💛💛💛😍😎"
1291097437268897792,RT @JamesKosur: This should be a bigger story.,2020-08-05 19:43:11,"Benjamin Franklin’s plucky, middle-aged widow has roused herself from decades of slumber to join the leagues of nasty women in resistance to tyranny."
1291097980741677056,RT @YahooSports: There were no positive COVID-19 cases in the latest round of testing in the NBA bubble. https://t.co/3Bq99YbsS1,2020-08-05 19:45:20,
1291097361809211392,"RT @EricaJoy: i freaking knew it. we cut out commuting time and packed that time with meetings.
https://t.co/vcKokBFK3B",2020-08-05 19:42:53,“We make a living by what we get. We make a life by what we give.” - Winston Churchill
1291097830061481985,"RT @LDNFootbalI: Roman Abramovich during this pandemic:

Guaranteed full pay for all Chelsea’s employees with NO furloughed or redundant wo…",2020-08-05 19:44:44,God answers.
1291097298253099011,"RT @drsimonegold: Hydroxychloroquine has been safely prescribed hundreds of millions of times since the FDA approved it 65 years ago. 

CDC…",2020-08-05 19:42:37,"retired Pharmacist
Destroying statues and monuments, attacking the White House and Capital .  It's all wrong. 
STOP the violence ."
1291097393715437568,RT @polscotcontrol: Please do not call 101 for advice on #COVID19 and remember 999 is for emergencies. You can find the latest #coronavirus…,2020-08-05 19:43:00,#back BLUE# protect BLUE #   BLUE lives  matter no trolls you be blocked🚫no Dm for Leo's only
1291097360798494720,RT @JonJonesSnr: Covid has proved such a golden opportunity for stealing from the public purse.,2020-08-05 19:42:52,"Brexit was the stupidest thing any country had ever done.
But Johnson's ""Taking it on the chin"" is even stupider.
#FBPE #RejoinEU"
1291097724910284801,Biden to accept Democratic Presidential nomination from his basement brings  question about mental health not COVID… https://t.co/tDrPoNwFhJ,2020-08-05 19:44:19,"⭐️Welcome to the Bee News Daily Twitter to obtain raw news and breaking news. Follow us for news and updates on our https://t.co/CXRwDL4Nhj  website, and Facebook."
1291097812961296384,How do you like that taxpayers? https://t.co/sUjVfRhbKN,2020-08-05 19:44:40,"I don't think there are any Russians 
And there ain't no Yanks
Just corporate criminals playin' with tanks. (M. Been)"
1291097592089075713,RT @GovInslee: WATCH: I’m giving an update on our state’s response to COVID-19 at 3 PM. I’ll be joined by @waOSPI Superintendent Chris Reyk…,2020-08-05 19:43:48,Visionary. Patriot. Data wrangler/aspiring Data Scientist. Animal Lover. Antifascist. He/him. Views expressed should be everyone's.
1291097716307701762,"RT @MarkWarner: I can't stress enough how crucial this is.

If Missouri can approve Medicaid expansion, I don't see why the Senate can't pa…",2020-08-05 19:44:17,"“The ultimate rulers of our democracy are not a President & senators & congressmen & government officials, but the voters of this country.” FDR"
1291097747211407360,RT @SHAPE_America: We Must Invest in Teachers to Prevent COVID-19 from Exacerbating the Racial Educational Divide https://t.co/Mb2gh1PIc0,2020-08-05 19:44:25,MS #HealthEd #PhysEd teacher & Fuel Up to Play 60 program advisor. Indiana SHAPE Advocacy Chair. Midwest SHAPE Health TOY 2018. Mom of two active boys.
1291097436308480000,@Jason Recognizing opportunities + hard work + luck can lead to success. You're school idea is a good example. Does… https://t.co/zXM6vGkhSX,2020-08-05 19:43:10,"Investigator in Los Angeles, California                                    
Amateur Radio: 
ARES, SKYWARN, NTS, LAECT"
1291097851083149312,RT @lakechelannow: It appears likely that students at Chelan Schools will not return to the classroom when school begins next month. Superi…,2020-08-05 19:44:49,"Serving the Chelan, WA community with quality and excellence in education."
1291097688939859968,RT @LegendaryEnergy: Obesity is a bigger epidemic than police brutality or coronavirus. But the TV sponsors it so you don't care.,2020-08-05 19:44:11,"I love everybody, until I don’t. My God, my husband, my kids, and my family are my priorities ~ your opinion doesn’t make the list."
1291098024056365056,@wsteaks @AmoneyResists No matter how much this jack ass wants to pretend the pandemic isn’t there; ITS STILL THERE… https://t.co/Zp3nPfHeIV,2020-08-05 19:45:31,"Father, husband, lover of tea and wine, Supply Chain Manager, in that order."
1291097504969351168,RT @LilNasX: corona is that nigga who already graduated but won’t stop coming up to the school,2020-08-05 19:43:27,
1291097850630348800,RT @HollyGShore: I don’t mind masks they hide my acne and make getting ready to pop to Asda 10 times quicker 🤷🏼‍♀️ I also LOVE social dista…,2020-08-05 19:44:49,
1291097563068850176,Today I wrote to #HouseLeadership urging them to prioritize minority-owned businesses in the next relief bill. The… https://t.co/JTRaTKiIXn,2020-08-05 19:43:41,"Memphis | Chairman of Judiciary Subcommittee on the Constitution, Civil Rights & Civil Liberties | Transportation Committee | Leader in Effort to #ImpeachTrump"
1291097986286706689,"RT @Jumpshot8: Nothing in regards to controlling Covid 19 is perfect, but if sports leagues are not following Adam Silver, well should I sa…",2020-08-05 19:45:22,"Probation Officer, KHSAA 1st Region Kentucky Baseball Official, Shawnee College Assistant Basketball Coach, UK Basketball , STL Cards, & Oakland Raiders"
1291097617640849408,"RT @JsnWakes: @Breaking911 United Arab Emirates, Lebanon, Wuhan... What's going on here?
https://t.co/QXGaffkUXO",2020-08-05 19:43:54,من يملك جناحين في روحه لا يسقط أبدآ #art #painting
1291097326346362880,"RT @BernieSanders: How surreal it is to have a president who supports conspiracy nuts, rejects science and attacks epidemiologists like Dr.…",2020-08-05 19:42:44,
1291097636905385985,311 youths in the juvenile-justice system and 253 workers have tested positive for COVID. Those numbers keep rising… https://t.co/B87dHptqjD,2020-08-05 19:43:58,We tell the stories of South Florida. Our host is Luis Hernandez. Listen to us Monday- Thursday at 1 p.m. on @WLRN sundial@wlrnnews.org
1291097653615435776,"Hosted by @vmochama, the @nolittlepodcast from @alliance2030ca explores the #SDGs through topics like digital ageis… https://t.co/PxwB8yJGcw",2020-08-05 19:44:02,"WGSI is winding down. Thank you to all our collaborators, co-conspirators and partners for 10 fabulous years!"
1291097428083564548,"RT @prageru: The good news: We are back on @Twitter 😎

The bad news: Big tech is still censoring conservatives 🤐 

Here's the latest exampl…",2020-08-05 19:43:08,"Catholic. Knight, Husband, Father - Poking the bear with the Truth 🔥"
1291097290027958273,"RT @Gobite: ""Lady Johan Summoning the Gatekeeper""
My contribution to Alexis Bacci's akasake 3, The eroguro risoprinted almanach. Despite a…",2020-08-05 19:42:36,"This is a Horny account, you have been warned."
1291097355534704642,Thanks bud. Now can y’all legalize pot? Thanks. https://t.co/DecvRsGv03,2020-08-05 19:42:51,https://t.co/TIwQLYJaVH ∗ #ADHD
1291097535923261442,"Ok...EVERYONE WHO SUPPORTS RETURNING TO NORMAL

ABANDON ALL SHOPPING from the 10th. 

Make the malls and shops utte… https://t.co/ciVhJqJc82",2020-08-05 19:43:34,ARE YOU SUFFERING GROUPTHINK? https://t.co/JQiteVirqz “We have nothing to fear but fear itself”. EVIDENCE BASED SCIENCE & DEBATE
1291097616885796865,"RT @nypost: New York coronavirus policy is harming disabled youth, parents say https://t.co/4tF4y7cIsu https://t.co/dcVlnzslxa",2020-08-05 19:43:53,英語学習コーチ。保守とリバタリアンをミックスして、リベラルを少しふりかけたような。是々非々。スワローズファン歴43年。
1291097465110835200,"RT @TorontoStar: “I’d run my fingers through my hair and I’d pull out a whole bunch,” 26-year-old Heather Colton said after getting sick wi…",2020-08-05 19:43:17,Hindustani~Enjoyneer~MBA~MUFC~PS4~Foodie~EDMGeneration~Deep~Tech~Trance~Uplifting~Psy~TranceFamilyIndia~Nadal~F1~Cricket~TeamMystic~TL40~Movies~Influencer~RTer
1291097574250893313,Kind reminder: don’t make out with strangers at parties during a pandemic. Cool? Cool 🥰 - @bklyndrdgr https://t.co/dapwieP8JU,2020-08-05 19:43:43,📻Vancouver's #1 Hit Music Station
1291097549793886208,@AggreyKthe7th @RixDSam Bambi lesson you shud leave nearvyr galfrnd even covid taught us that,2020-08-05 19:43:37,
1291097303558885377,"RT @FeedINsHungry: National Association of State Departments of #Agriculture CEO Barb Glenn says, “This relief package falls short of meeti…",2020-08-05 19:42:39,"Hunger relief organization providing food for low-income individuals in Blackford, Delaware, Grant, Henry, Jay, Madison, Randolph, & Wabash counties in Indiana."
1291097643058442241,How a church-based resource center works with local institutions to help immigrants build new lives in rural North… https://t.co/NFpOJ3REdF,2020-08-05 19:44:00,An online magazine that strengthens Christian leadership. Published by Leadership Education @DukeDivinity. Our newsletters: https://t.co/Pj4v5TEywL
1291097550204760065,RT @mcsole: I hope new forms of underground live music culture emerges from the pandemic.  Cuz playing in AmeriKKKan venues has always been…,2020-08-05 19:43:38,"He/Him.  Math/Science, Film, Music, Politics, Twitch, etc.  Fuck racism!"
1291097621365497857,Trump's gross mishandling of the coronavirus pandemic led to the nation's economic collapse: As the coronavirus con… https://t.co/jwq4PfUcUZ,2020-08-05 19:43:55,
1291097574624157696,"RT @adoraIbe: a country that depends on imports to survive has officially lost its main sea port mid famine, covid-19, and an economic coll…",2020-08-05 19:43:43,CSU
1291097982599864320,RT @CNBC: Dr. Fauci agrees the U.S. has the worst coronvirus outbreak in the world: 'The numbers don't lie' https://t.co/Ivtk0UkINI,2020-08-05 19:45:21,"New democrat, advocate of environmental & global peace, Episcopalian. #BLM #Nevertrump. American Ally🚴🏽‍♀️🏊🏽‍♀️🗽🍷🇨🇱🌊📚🏞 🇺🇸 NO DMs"
1291097796309704704,The more you know... https://t.co/hv9mPgdAyn,2020-08-05 19:44:36,"Think outside the factory that makes the box
#Greek #American=Avatar 
Lead by Example
Freedom Fighter 
Constitution Defender  
MAGAPatriot17"
1291097712545472513,RT @bybrianbyrne: Social distancing  👀 @BTS_twt,2020-08-05 19:44:16,I just wanted to know their names. Fan account.💜🇺🇸🇬🇭  (23)
1291097658254340098,"RT @JillZora: @BBNaija Neo the drip king
Oracle of the bbnaija lock down",2020-08-05 19:44:03,"Titan, NeoTribe, WizkidFC , Outsider❤️"
1291097591904493568,RT @sydneyeclark: Really enjoyed this session with @PatriceHarrisMD and @GeoffRBennett about health disparities during the COVID era. “Poli…,2020-08-05 19:43:48,"Executive Director of @NAHJ, founding publisher @palabranahj. by NAHJ, Founder @Honor41org , MTC Google fellow, Accelerator coach, He/His/Him tweets are my own."
1291097939264319489,RT @susan_raciti: So soon! This is a deadly situation. It all is. Please visit https://t.co/eZb7ouXMcF to find out the Whole Story.,2020-08-05 19:45:10,"Pray the 15 DECADES. Visit: https://t.co/08o9kVCsc1 ☩ ☘️⛲️=🤞🏻🌊=🐑🏝=🕊(De Christo, Book II, Ch.27)- St. Robert B., on relations in the Trinity."
1291097914157207553,RT @LukeMor19529310: South Korea? South Korea was one of the first countries to implement Hydroxychloroquine in their treatment protocol fr…,2020-08-05 19:45:04,"Cute, tiny and mischievous calico kitty. I love cats! I post cute, Catholic and funny things. NO LISTS. List = block."
1291097579715997697,"RT @NYDailyNews: A senior WHO expert is urging young people to rethink their partying habits to help control the spread of coronavirus.
htt…",2020-08-05 19:43:45,ૐ  🧘🏽‍♀️🐚🐆I came into the world with a breath of the jungle in my memory🐾🍇🌿🦋
1291097827855212544,"RT @TeaPainUSA: Let. This. Sink. In.

This mornin' the ""President"" of the United States declared ""children are immune"" to COVID-19.

Trump…",2020-08-05 19:44:44,Amateur Wildlife photographer
1291097901779890185,RT @EricTopol: The heart and #COVID19 by MRI: Now a 2nd study documents significant abnormalities in 15/28 (58%) of patients https://t.co/X…,2020-08-05 19:45:01,Lepidopterophobic Adult Human Female
1291097994943594496,i hate that practically anything is considered a corona virus symptom bc now i’m over here thinking i have it,2020-08-05 19:45:24,rocketman (2019)
1291098828225929216,@nytimes They are all corrupt! Helping China and blowing putting on a show for american people while selling them o… https://t.co/Sqr1BlUdUv,2020-08-05 19:48:42,"Not White, Not Black, Not Brown, Not Yellow, Just an Earthling."
1291098400033853444,"RT @roccogalatilaw: 21,000 small businesses put out of business by Covid-measures in the Province of British Columbia ALONE.

https://t.co/…",2020-08-05 19:47:00,Photographer. Writer. Beer tester. Action hero.
1291098341707636736,RT @JoyAnnReid: This is awful. What kind of people would attack an epidemiologist for trying to help battle a pandemic??? This country is a…,2020-08-05 19:46:46,dance like Elaine on Seinfeld/we're all in this together
1291098295574523904,"@jstuart__ Lucky. Make sure not to protest in AZ. 
Well since i played D-line once upon a time.  Yes i know the dif… https://t.co/wvuVSiCRiO",2020-08-05 19:46:35,"Utah Utes, Utah Jazz. Detroit Lions..."
1291098216394625024,Get the guillotines. https://t.co/kIMDPOTKcQ,2020-08-05 19:46:16,World Citizen. Ideas should be simple+profound. Tweets should be fire. Follow at your own risk.
1291098615746711552,RT @Leerose1985: HOW MUCH LONGER YOU GOING TO KEEP THIS GOING YOU PIECE OF SHIT,2020-08-05 19:47:52,
1291098325278699520,RT @Thomas1774Paine: Ron Paul: Europeans Are Waking Up To Government COVID Tyranny. Why Are Americans Still Asleep? https://t.co/Pn7zAmmCwj,2020-08-05 19:46:42,
1291098216923111424,RT @Aspiringt_: This pandemic has made me question damn near everything about life,2020-08-05 19:46:17,Sleazy gang 12/27‼️😎 04/21💜🤞🏼21 ♒️🏳️‍🌈🐝SC:honeybands18 Just tryna be great ⚜️. YouTube: Honeybands
1291098058487476224,"RT @mmpadellan: trump is using the Postmaster General to HIJACK our votes during a deadly pandemic.

Raise your hand and reply with the has…",2020-08-05 19:45:39,no! not going to!!
1291098354676641792,COVID-19 cases will increase when kids congregate in school buildings. Pleas keep your kids at home if you can.… https://t.co/TLxFMRmHn9,2020-08-05 19:46:49,We are 100% volunteer run. Join our Facebook group on Facebook for updates on events. 🌊
1291098410716549120,New England Division Convention Canceled Due to COVID-19 https://t.co/UId6hZtJI4,2020-08-05 19:47:03,"Amateur Radio News , Solar Weather,ARRL,Eham,QRZ,Handiham,TWIAR,IARU news feeds,Propagation daily Top 10 and much more !!!"
1291098829337632769,"RT @BernieSanders: How surreal it is to have a president who supports conspiracy nuts, rejects science and attacks epidemiologists like Dr.…",2020-08-05 19:48:43,🇸🇻 (he/him) BLM
1291098674995564545,We’re now only accepting wine for corona packages... @samarutie @Wamziey and Kami got the memo https://t.co/7k9rFVS6Gm,2020-08-05 19:48:06,
1291098405469589505,"RT @NYGovCuomo: We must resolve this virus together. Unless we defeat Covid everywhere, we won’t defeat Covid anywhere.",2020-08-05 19:47:01,"Perfection is Key | UOT. | Football, Music | #CFC | Cashion Fashion House."
1291098791970582528,Students at school touted by Pence for reopening must quarantine due to COVID-19 - ABC News via @ABC - https://t.co/7OT1kWuyaV,2020-08-05 19:48:34,Solve for global by going local.
1291098204549918725,"Scientists Uncover Biological Signatures of the Worst Covid-19 Cases

Studies of patients with severe cases of Covi… https://t.co/Cbv3pfwVeU",2020-08-05 19:46:14,"Miami born but Georgia heart, minus the racism*I BLOCK STUPID, RACIST, TRAITOROUS PEOPLE*Retired Forensic Accountant*Good at Critical Thinking*No DMs*2A"
1291098187504132096,"@JasonCKTham Thank you, thank you, thank you.  Your kind and thoughtful series of COVID-19 related principles are a… https://t.co/RFOWdUFvmk",2020-08-05 19:46:10,
1291098539708227584,Is Reopening Worth the Risk to People's Lives During COVID-19? https://t.co/bOmKRZgWUW https://t.co/U39VjSdMbA,2020-08-05 19:47:33,"Ortopedia, Ortopedia Infantil y Ortopedia PreFitness  
Eugenio Sue 355 consultorio 503-504
Horarios de atención: lunes a domingo de 11 am a 2 pm y de 4 pm 8 pm"
1291098846353936385,I honestly think he is the only reason I stayed sane through lockdown,2020-08-05 19:48:47,23
1291098247143075841,"Funny, I must have imagined that me and my wife had both worked 12 hour day+ while responding to the hectic demands… https://t.co/5RH8GFqHZm",2020-08-05 19:46:24,"Award winning social media outfluencer providing premium, standard (including sub) content to my subscribers, The 129"
