id,tweet,time,description
1277618613017509889,RT @ShelbyTNHealth: The daily Shelby County case count will not be available today because of technical difficulties with Tennessee's state…,2020-06-29 15:03:09,"Mother, Lawyer, Proud LGBTQ, EBay Seller, Animal Lover, Science Over Spin, Vote to Live! 🌈🌊❄🇺🇸"
1277618513163608064,"RT @mmpadellan: President Joe will wear a mask.
President Joe won't be golfing.
President Joe WILL save lives.
President Joe won't slow tes…",2020-06-29 15:02:45,"retired professor of English, Media, Film"
1277618692105388032,"RT @SDISBEAUTIFUL1: Drs are stressing the need to wear masks, avoid crowds, avoid dine-in restaurants on all media except Fox and other rig…",2020-06-29 15:03:27,"~Official Trump Hater~ Bothered by stupid. No auto follow-backs. Cats. Respect. Love is love. FUCK THE GOP. #RACISTPRESIDENT #LGBTQ #RESISTANCE #BLM 
🛇LISTS."
1277617856658751489,RT @willcarling: Suicide figures are up 200% since lockdown. Could 2 friends please copy and re-post this tweet? We’re trying to demonstrat…,2020-06-29 15:00:08,select * from bseg.
1277618258489868288,Honestly https://t.co/L0MNYQ22D4,2020-06-29 15:01:44,Blessed and highly favoured👑
1277618477789036546,"For anyone in Northern Kentucky: the testing site will be returning to Summit View Academy. Testing is free, so, ta… https://t.co/dMqIdMXTHS",2020-06-29 15:02:36,Democratic nominee for Congress #KY4•Single mother of 2• Nurse practitioner•healthcare•infrastructure•education #owensby4congress Donate: https://t.co/ewcqsmgxne
1277617979086090240,"RT @tburages: Besides killing our Democracy, three new research studies strongly suggest Fox News misinformation may be responsible for the…",2020-06-29 15:00:37,
1277617874509672451,Stocks rose Monday after last week's selloff as investors weighed a resurgence in coronavirus cases and the possibi… https://t.co/2S77g71uM1,2020-06-29 15:00:12,"Latest news about financial markets, the economy, business, corporations, and personal finance, from USA TODAY."
1277618248025018368,RT @willcarling: Suicide figures are up 200% since lockdown. Could 2 friends please copy and re-post this tweet? We’re trying to demonstrat…,2020-06-29 15:01:41,
1277618620718370816,RT @BarbaraRedgate: These Disgusting Angry Do Nothing Socialist Dems are mandating masks and another lockdown while at the same time instig…,2020-06-29 15:03:10,Never expected to live in a time such as today. So many things finishing up and many more being launched.
1277617911180529666,Suicide figures are up 200% since lockdown. Could 2 friends please copy and re-post this tweet? We’re trying to dem… https://t.co/d1DK1W9VMk,2020-06-29 15:00:21,oh hi mark
1277618763215581191,Suicide figures are up 200% since lockdown. Could 2 friends please copy and re-post this tweet? We’re trying to dem… https://t.co/8AbZI9hipu,2020-06-29 15:03:44,Thoughts about anything from asset management and politics to beauty products and cats. Founder member of the Women's Equality Party. Tweets are all mine.
1277618546856603653,"pentagon really said social distancing

#펜타곤이_만들어낸_왕관_바스키아
#PTG_Basquiat_is_here #PENTAGON #펜타곤  #바스키아 #Basquiat… https://t.co/CJAZltBLoB",2020-06-29 15:02:53,#KINO: 5 + 5 = 9
1277618045893128193,"RT @HoustonTX: #BeSomeone who stays 6 ft away from everyone else! #SocialDistancing the #Houston way 😆 #HoustonWeCanDoThis 

Practice #Phys…",2020-06-29 15:00:53,"The mission of The Ensemble Theatre is to preserve African American artistic expression and enlighten, entertain and enrich a diverse community."
1277618163148980224,"RT @mmpadellan: @realDonaldTrump The ""scary stories"" you tell your base are lame.

HERE'S ONE: A ""president"" is briefed on COVID-19 in Dec.…",2020-06-29 15:01:21,"If you don’t stand for something, you’ll fall for Anything! Here to #RESIST! Not looking for love! if you are,may I suggest a puppy! #BLM, #VoteJoe 🌈🌊🌊🌊🌊"
1277618506037473280,"RT @BloodDonorsIn: #Delhi
Need #Blood Type :  B-positive
At : Max Saket 
Blood Component : Need Plasma B+ve from #COVID19 recovered patient…",2020-06-29 15:02:43,"simple, swt, shy, calm, tardy, tedious, nocturnal, laughs a lot, olways smiling, small joys means a lot to me... retwts a lot :D"
1277618314278318080,"Sucking blood from their victims are what vampires do best...
https://t.co/kZ2OY6lkDO",2020-06-29 15:01:57,"Runner, Boxer, Cross trainer, Progressive Climate Warrior. Anti-Racist #BLM  #PrisonForTrump This is not normal."
1277618709746585601,"Having a real down day, 3 kids in a 2 bed flat this whole lock down, I don’t drive, single mum, feeling rubbish.. t… https://t.co/okO58nfCIW",2020-06-29 15:03:32,"My boys, my world. 💛"
1277617815994990593,"RT @GermanEmbassySA: Today @BMW_SA, German @BMZ_Bund &amp; @GautengProvince signed MoU for setup of a field hospital in Soshanguve 
➡️900+ beds…",2020-06-29 14:59:58,Tweets are personal. RT does not mean endorsement.
1277618184686895104,"As we enter day 100 of lockdown, I have developed an unsettling unconscious tick whereby I answer every question or… https://t.co/BxkjBGkZ4q",2020-06-29 15:01:26,26 year old sufferer of itchy legs post-shower | Freelance writer 🖌 | Instagram: fruitcake.ktchn
1277617915433549825,"RT @BBCNews: Leicester residents and businesses react to lockdown extension plans 

https://t.co/Y7LsyauRoM",2020-06-29 15:00:22,BBC Westminster
1277618151690244098,"As we move through the re-opening phases, our #SullivanCatskills website is a great resource for all information yo… https://t.co/vzKQZOSEHB",2020-06-29 15:01:19,#SullivanCatskills - a NY vacation destination with a celebrated past. Ignite your wanderlust and explore all our countryside has to offer.
1277618097265000448,"RT @LifeNewsHQ: Yesterday the worldwide coronavirus death toll passed 500,000.

By comparison, 20,996,535 babies have been killed worldwide…",2020-06-29 15:01:06,NO KING BUT JESUS!!!
1277617920110211072,RT @FinancialMail: Private doctors are not earning enough to make ends meet since Covid-19 has led to a reduction in regular patient number…,2020-06-29 15:00:23,always tell it like it is
1277618506234765313,@LastGreatAct @joshtpm @TPM About a quarter of the ICU beds are now COVID-19 patients.  They have stoped elective s… https://t.co/HMnjPzpXEs,2020-06-29 15:02:43,
1277617915483824130,RT @MellowMike501: Of course they did this. This is all part of his campaign promise to provide you the BEST health insurance. It will be v…,2020-06-29 15:00:22,
1277618219029721089,RT @priyagupta999: In case you need inspiration to wear a mask... https://t.co/0YtNztdBXY,2020-06-29 15:01:35,S A N G E E T  S A D H A K
1277618508243714048,RT @Krish_TNIE: #StayHome is introducing boredom,2020-06-29 15:02:44,"Sports editor, @NewIndianXpress (the new indian express). Wanderer & a dreamer. Travel freak.. RT not endorsement"
1277618679350468609,RT @Iloveautumn2: @leesomerset @emilyhewertson Brexit has already cost us more than we paid in total to the EU and we are losing benefits a…,2020-06-29 15:03:24,"Brexit was the stupidest thing any country has ever done.
But Johnson's ""Taking it on the chin"" is even stupider.
#FBPE #SardinesUK #RejoinEU"
1277618088326787075,RT @Navuu10: The servants of @derasachasauda collect food at the food bank from where they serve food to families who are unable to arrange…,2020-06-29 15:01:03,Housewife..
1277618304685936644,"RT @NASAWatch: COVID-19 Cases Soar in Texas, California &amp; Florida - But @NASA Field Center Status Remains Unchanged https://t.co/6lpsTO4KTt…",2020-06-29 15:01:55,Commercial space is the next business frontier. A service from @SpaceRef.
1277618230517829638,RT @DFF_Dynasty: @WillieBeamanDFF looks at what impacts COVID-19 could have on the NFL and how they may affect your leagues. #fantasyfootba…,2020-06-29 15:01:37,Editor in Chief for @DFF_Dynasty #DynastyFootball #FantasyFootball
1277618674942087168,"RT @selvasuha: #Tamilnadu govt declares total #lockdown 6.0, with certain relaxation’s in districts, with the status-quo (same restrictions…",2020-06-29 15:03:23,Assistant Editor-Crime at Times of India #Writer #Director #Blogger #Artist #Novelist http://t.co/SFJnJivaIc
1277618114306338817,✊🏻 fight the power Eugene https://t.co/VDIsUEthiK,2020-06-29 15:01:10,"non-recovering ex-evangelical hellraiser #Hamont #VictoriaBC, McMaster Divinity Grad, ER Registered Nurse, future @UVIC NP, proud lefty. love my soccer and 40k"
1277618163862196225,"The Airline Industry Blocked Disclosure of Trade Data, Helping Conceal the Airlift of N95 Masks From the U.S. to Ch… https://t.co/axVrUVgzfs",2020-06-29 15:01:21,"Yellow dog Liberal, TS ELLIOT & animal lover, ACLU, former journalist, science believer. #politics #archaeology #impeachtrumpnow #resist NO DM’s"
1277618222427144192,"RT @atrupar: Dan Crenshaw and Brian Kilmeade blame Texas coronavirus spike on #BlackLivesMatter protesters, not the state reopening busines…",2020-06-29 15:01:35,
1277617978842980352,RT @ProgPro: These COVID spikes are crazy it’s almost like every scientist in the world predicted it would happen but nobody listened to th…,2020-06-29 15:00:37,temple yew
1277617869719777280,Navigating the Next Normal: 5 Marketing Trends Fueled by COVID-19 Crisis [feat @textoptimizer @WalkMeInc]… https://t.co/lIqx4bNIFV,2020-06-29 15:00:11,"Ann is the productivity and self improvement blogger, passionate writer and free tool junkie"
1277618058811641856,"RT @MahilaCongress: Watch: If BJP and CM of Assam can hold programmes, why can't Congress party hold protests, following all norms of socia…",2020-06-29 15:00:56,#StartupMentor #DigitalMedia #APPLE #Sports #Books #FOODIE #IN #SANE #HUMAN #SOFARSOGOOD #INCSUPPORTER
1277618421249773574,@WhtVictoriaRead @Harriet_Rosie_ Your post has been retweeted and shared. Don't you know how twitter works? Also if… https://t.co/2tgZk8mdhz,2020-06-29 15:02:23,New account. #Ifollowback corona sceptic. #Coronabollocks I try and follow back within 24hrs.
1277617903114817537,#COVID19 search query on Europe PMC now returns more results https://t.co/GYYSoqtzmt. Thanks to the additional sear… https://t.co/qE0IO98xqr,2020-06-29 15:00:19,"Free, global, biomedical information resource. We develop #openaccess tools for research discovery, data integration, and text mining."
1277617849834573826,"@14kyleb @ReadyHarris If a mask can trap your germs, it can trap COVID.  Think about your argument.",2020-06-29 15:00:07,"Safety Professional, Father, Husband, Christian, 6th generation Texan #vaccineswork"
1277618230090240000,"Leicester Lockdown?

Post the data, if you have it,
from your pitiful Test &amp; Trace",2020-06-29 15:01:37,"Physician, GIM Hospitalist & Cardiologist. Retired until COVID, a truly horrible disease appeared."
1277618067850305537,"RT @apexpaola: My boyfriend was diagnosed with COVID 19 yesterday, I asked if he needed anything and he deadass asked for a booty pic to mo…",2020-06-29 15:00:59,#BTS_Dynamite: the spring day of the billboard charts
1277617928121323520,"RT @JamesTodaroMD: A tale of two drugs...

Remdesivir &amp; HCQ both show promise for COVID-19

HCQ is discredited w/ fraudulent data, FDA warn…",2020-06-29 15:00:25,"Daughter of an Army/USAF Vet who served his country during WWII, Korea & Vietnam.  #ClearFlynnNow #IStandWithGeneralFlynn  #DrainTheSwamp"
1277617887285522434,RT @korndiddy: It’s fitting that the airline called American is choosing the absolute stupidest coronavirus policy.,2020-06-29 15:00:15,🌟21🌟she/they🌟cosplayer and artist🌟AST main on Ultros🌟This is a healer appreciation zone🌟icon: https://t.co/4cqJxfULEh
1277618416271200259,"RT @DexHinton: Dan Crenshaw is lying. He’s not uninformed about the data. He’s just lying. 

Dan Crenshaw wants you to believe Black people…",2020-06-29 15:02:22,"Commercial Real Estate Broker & Baylor Baseball Alum, used to get slightly paid for the baseball. i play too much golf."
1277618367650623488,RT @rameshlaus: #BREAKING : #Lockdown extended in #Chennai and surrounding Districts till July 5th from June 30th..,2020-06-29 15:02:10,I am a diehard THALAIVAR RAJNIKANTH and SURIYA fan.I have a passion for photography too.. enjoying the present moment of life.. :)
1277617908580069376,"RT @SuzeQKnits: On my way home finally!
I've been a nurse for more then 25 years and I'm telling you I've never ever in my life been throug…",2020-06-29 15:00:21,"Embittered writer and grumpy political surveyor, desperately trying to avoid, embrace & afford alcoholism. Stricken with left leaning political inclinations."
1277619040563998720,RT @mrjamesob: Deleted the Samaritans tweet after it was pointed out that the suspect statistic may have been anti-lockdown propaganda. The…,2020-06-29 15:04:50,"100% FOREIGN! #notmovingonuntildomisgone
Brexiteers: You won, so own it & don't come bleating to me when shit hits the fan!"
1277619207946022912,Band's pandemic diversion leads to daily park gig - https://t.co/YGujsz9Sg6,2020-06-29 15:05:30,All Latest News From USA - No Ads
1277619379308552194,RT @SidneyPowell1: You pathetic elitists who encourage rioters &amp; the #MarxistBLM are the ones responsible for the spikes--with all the crim…,2020-06-29 15:06:11,Joined twitter just to see what it's all about! Rescuer of cats and dogs alike. 🐾🐾#AmericaFirst! 🇺🇸 #2A #MAGA
1277618922662084614,RT @Frank_Schaeffer: The USA has less 5% of the world’s population. We have over 25% of the world’s coronavirus deaths. Why? Because we hav…,2020-06-29 15:04:22,Liberal and progressive; bring your frontal cortex and leave your amygdala at the door. #exvangelical
1277618814574669826,"RT @h_gulipalli: #PromoteDNBtheorypassCandidates Students from MP Chhattisgarh are given Delhi,Pune and Bangalore centers for DNB final exa…",2020-06-29 15:03:57,"MD General Medicine, DNB Neurology | Neurophysician  | Consultant at @chdefforts | Development sector |
Music and art lover."
1277619434992132096,"The outlook for the Global and Italian Economy, GDP losses in terms of levels and growth, the shape of the recovery… https://t.co/8XZvFGqS5u",2020-06-29 15:06:24,
1277619506454704130,"Gilead prices coronavirus drug remdesivir at $2,340 for rich countries https://t.co/WL8hoLM8L9",2020-06-29 15:06:42,Breaking news and current events from around the globe. Subscribe: https://t.co/uFZ2QPERDC
1277618902663598081,RT @kadajoza: 🚨The #RockefellerFoundation published a report in May 2010 in cooperation with the Global Business Network of futurologist Pe…,2020-06-29 15:04:18,"International and national news of the ongoing destruction of Western Civilization.
Topics include economics, politics, religion and whatnot."
1277619480382902272,"RT @leahjdouglas: Groups including @NRDC, @Earthjustice, and @livablefuture say USDA should stop supporting certain environmentally risky m…",2020-06-29 15:06:35,The Johns Hopkins Center for a Livable Future investigates the intersection of #foodsystems and #publichealth.
1277618994141442050,"RT @uiowa: Meet the Hawkeye who launched a business to help health care providers transfer more easily between hospital systems, all while…",2020-06-29 15:04:39,"Official Twitter of the University of Iowa Carver College of Medicine, part of @uihealthcare. View our social media policy at https://t.co/Zw8CXk2MOu."
1277618771029422080,"RT @RexChapman: Dallas, Texas: 

Lovely young Karen throwing a fit over being asked to wear a mask...  https://t.co/CnxRFMvMqf",2020-06-29 15:03:46,go beavs
1277619001980379139,RT @OrdinaryGamers: @NetHistorian Bro i installed Covid-20? Where is your God now.,2020-06-29 15:04:41,"""YA FUCKIN' LOSER! NO MAN WOULD BOW DOWN SO EASILY! Die like the dog you are!"""
1277619364116738055,RT @1776Stonewall: In 2016 the Democrats used Russian disinformation to try and defeat Donald Trump. This year they are using a Chinese vir…,2020-06-29 15:06:08,"Christian, Widow, Judicial Assistant who believes in the Rule of Law, Patriotic Conservative, and a proud supporter of President Donald Trump."
1277619018757820419,"RT @PughTillerPR: ""D3i Expands Marketing Efforts, Promotes Targeted Services During Pandemic."" Read the latest from the Pugh &amp; Tiller PR bl…",2020-06-29 15:04:45,"Partner at @PughTillerPR, drummer, dad of boys, football and lax coach, 410 rep."
1277619023325220864,Me trying to cook during this shit pandemic https://t.co/9Sv233jCw3,2020-06-29 15:04:46,achievement : pernah mimpi meninggal terus hidup lagi 😎
1277619140879138822,"RT @duponpa: @childp_child ‘Energy &amp; energy transition are central parts of recovery plan through #EUGreenDeal and #HorizonEU"" https://t.co…",2020-06-29 15:05:14,@EU_Commission Deputy Director General for Research & Innovation @EUScienceInnov EU representative of the Mission Innovation Steering Committee @MICleanEnergyRD
1277618864927453184,"RT @Public_Citizen: Imagine watching billionaires get $584,000,000,000 richer during the pandemic and thinking the problem is someone steal…",2020-06-29 15:04:09,🇬🇳🇫🇷🇳🇬🇺🇸| International Relations
1277618923643551746,RT @FirstTryKai: The US hit a record for most COVID cases in a day at 47k. I can’t believe wearing masks became political. Americans are so…,2020-06-29 15:04:23,Hawaiian Ⓥ Polynesian
1277619564210270212,@wdwmagic Please people just wear a mask....not rocket science.,2020-06-29 15:06:55,
1277619594744737792,"RT @CheshireLiveMac: Boris says coronavirus has been 'a disaster' and 'a nightmare'
https://t.co/CqwQDVACiu",2020-06-29 15:07:03,"Anti-Trump, pro-EU. Oboe, cats 🔸"
1277619485156028416,"RT @apexpaola: My boyfriend was diagnosed with COVID 19 yesterday, I asked if he needed anything and he deadass asked for a booty pic to mo…",2020-06-29 15:06:36,.Hot mess express. Chaotic Bisexual. 20. She/her.
1277619346425155584,"RT @OVWJustice: It's important for service providers to practice self-care, especially now. Here are some resources: https://t.co/MSoIP5pot…",2020-06-29 15:06:03,"Reading, the beach, the moon, and my family... that’s me"
1277619563811790850,RT @bvaz711: @MightyKeef @ProperArtist This cancel culture is worse than covid-19... its spreading everywhere and it won't stop!,2020-06-29 15:06:55,
1277619543960141825,If like me you were missing the Daily bulletin and slides. They have moved to here: https://t.co/3j0Omko2vq,2020-06-29 15:06:50,I am me. Real Ale - WatfordFC 505/516 top division games.
1277619380277383168,RT @ConnieSchultz: Democratic Rep. Clyburn wears a mask to protect the life of his Republican colleague Scalise. Scalise refuses to wear a…,2020-06-29 15:06:11,
1277619396366798850,"RT @apexpaola: My boyfriend was diagnosed with COVID 19 yesterday, I asked if he needed anything and he deadass asked for a booty pic to mo…",2020-06-29 15:06:15,
1277619022780157954,I just cannot understand who raised these fucking people https://t.co/cxDYgkT0lc,2020-06-29 15:04:46,
1277619182369202176,"RT @ElPasoTXGov: One additional death and 131 new COVID-19 cases are being reported for a cumulative total of 5,745 cases and 128 deaths. A…",2020-06-29 15:05:24,
1277618812842631170,"RT @apexpaola: My boyfriend was diagnosed with COVID 19 yesterday, I asked if he needed anything and he deadass asked for a booty pic to mo…",2020-06-29 15:03:56,
1277619577510195201,RT @MikeLevin: Today is another great day to wear a mask. #MaskUp https://t.co/m9MzrnNrVS,2020-06-29 15:06:58,"GenX, poet, flower farmer, Episcopal, Democrat #FamilesBelongTogether #KHive #Biden 💛 💛 💛"
1277619568068919298,How the government failed to deliver on at-home learning during Nova Scotia’s pandemic lockdown https://t.co/qQbkVXQ2Nb,2020-06-29 15:06:56,Father | Settler | Lawyer working for Indigenous Peoples | Award-winning beard grower | ”wokest man in Dartmouth” | Tweets are not legal advice
1277619186219593729,RT @KamalaHarris: Wear a mask.,2020-06-29 15:05:25,"Phil 4:13 🇳🇬 |You are exactly where you need to be, to learn.| check out my IG⤵️"
1277618997689802753,"‘A recipe for disaster,’ U.S. health official says of Americans ignoring coronavirus advice https://t.co/nj3OAJp41s",2020-06-29 15:04:40,Global Business and Financial News
1277619635806846979,"RT @RKRadhakrishn: Yet another knee-jerk reaction: lockdown extended in Chennai, districts. As I've told on several TV shows, @EPSTamilNadu…",2020-06-29 15:07:12,Mechanical Engineer & Born Agriculturer.
1277619237888995328,@dgardner Probably not a coincidence that there has just been a huge outbreak in Kingston.,2020-06-29 15:05:37,Likely Internet Crank. I was a hermit before it was popular.
1277619392885342209,RT @rhodofansie: The campaign of Lenny Kravitz they said FW20 but the Rosie's one is just Fall 20 bc usually the men collection is summed u…,2020-06-29 15:06:14,BLACKPINK ROSÉ 블랙핑크 로제 #ROSÉ #로제 ROSÉ
1277619358513201152,RT @monniehope: hold awn.... tr*mp made his followers sign waivers for his tulsa rally that said if they got covid there they couldn’t sue…,2020-06-29 15:06:06,a disappointment || she/her
1277619145442562048,"RT @LeahR77: This new “spike” in Covid is the Swamp’s cancellation of our INDEPENDENCE Day Celebrations.

Don’t Give Them The Satisfaction!",2020-06-29 15:05:15,"Still clinging to my God and Guns. No list please ,No#notmyspeaker. MCSE, CEDS, Computer Forensics, Glock Guy ,KAG, Love my M1 Garand WWG1WGA , I took the oath"
1277619049514635274,"Spurt in Covid-19 Cases Worries Agra Administration, Pool Sampling Begins in 12 Containment Zones https://t.co/EjwXTHIigh",2020-06-29 15:04:53,We are fully homegrown Dil Se Indian. We started with a single goal to provide quality education to everyone in India.
1277619476377169920,"RT @chloedontsurf: heartbreaking signs held up inside of bradley county jail today. inmates are being denied proper PPE (masks, cleaning su…",2020-06-29 15:06:34,SC: sandraaahhhhhhh | ♏️
1277619324841267201,"RT @TPRNews: San Antonio saw its 10,000th case of COVID-19 yesterday. There are now over 800 people hospitalized, and local hospitals are u…",2020-06-29 15:05:58,"@TPRNews Biosci-Med Reporter | Host of Petrie Dish podcast petriedish@tpr.org | Mom to my fav person | NNY border town native, longtime Texan, stops in MKE & LA"
1277619145085984768,"RT @TwitterMoments: ✅ Elaborate staging
✅ Cinematography
✅ Social distancing

Megan @theestallion brought her A game to the #BETAwards. htt…",2020-06-29 15:05:15,"STREAM #OBSESSION by EXO, I promise you it’s a bop 🌝 Also, stan my ult Kai and OT9 #EXO @weareoneEXO, please and thanks 🌚"
1277619375374241792,"RT @MelissaAFrancis: (Unless it’s too late because @NYGovCuomo sent your loved one back into a nursing home after testing positive, and the…",2020-06-29 15:06:10,"Married, two children. Son, retired 21 year Air Force veteran. Daughter a nurse. Conservative, full on outdoors guy, and great love for the 2and Amendment."
1277619380235513857,"RT @CNBC: Gilead's coronavirus treatment remdesivir to cost $3,120 per U.S. patient with private insurance https://t.co/eSTgu90H2X",2020-06-29 15:06:11,"Health care professional, music & book lover, Pittsburgh Pirates & Penguins fan"
1277619433880514560,RT @MissFameNYC: Science is cool! Wear a mask,2020-06-29 15:06:24,"Biologist by day. Doxie dad by night. And a nerd, race chaser, mystic at heart. he/him #BLACKLIVESMATTER"
1277618934456487937,Covid debt to come with a sick-note attached? https://t.co/Pi5qPjufdD,2020-06-29 15:04:25,Bloomberg. Other stuff sometimes. Terrible at writing bios.
1277618771910430721,RT @defeat_gop: Anti-Trump Republican group's new ad slams President over coronavirus deaths hitting the 'Greatest Generation' #SmartNews…,2020-06-29 15:03:46,Updating Americans on the latest Trump and White House news stories by a team of journalists and investigative reporters. We stand together for human rights.
1277618868769488898,$DVAX Dynavax (DVAX) gains as WHO includes the company in draft landscape of COVID-19 candidate vaccines,2020-06-29 15:04:09,"Real-time stock & option trading headlines, breaking news, rumors and strategy. Nothing we post constitutes investment advice; we may have positions in markets"
1277618832740360195,RT @PeterStefanovi2: And here we are again. For a month @DHSCgovuk has said it has absolutely no idea how many people are being tested for…,2020-06-29 15:04:01,Grime  Fan | Social Democrat
1277619216812834817,RT @MichaelSteele: Can we stop with the “Freedom” crutch to explain away bad choices and piss poor behavior. We don’t have the freedom to r…,2020-06-29 15:05:32,
1277619393078292480,"RT @yamunajiye: #DraftEIA2020 must not be rushed during d pandemic. @moefcc @PrakashJavdekar @Jairam_Ramesh 
Incorporation of #rural voices…",2020-06-29 15:06:14,
1277619182633271296,"RT @HotKeever: Seriously people of @CityofStAlbert be better - In Sobeys tonight ,not one other customer had a mask on - in fact many stare…",2020-06-29 15:05:24,"Great grandfather, proudly married to my beautiful Jean for 61 years, two first nations grand children, RCAF CD 28 years, Squadron Leader, (11 Mil types)NO DMS"
1277619309536133120,"RT @aboIishice: “wealth is not the fruit of labor, but the result of organized, protected robbery” frantz fanon (1961)",2020-06-29 15:05:55,
1277618821302489088,"RT @SpeakerPelosi: For 45 days, the Senate has refused to act on the House-passed #HeroesAct. As states across the country confront surging…",2020-06-29 15:03:58,
1277619246416244737,"RT @sarahkliff: A maker of a coronavirus treatment will charge American insurers more than other developed countries because how ""the U.S.…",2020-06-29 15:05:40,
1277619133627224065,Bro people would really look at you crazy lmao https://t.co/0BYI6YLA77,2020-06-29 15:05:13,"And yet, you kept going."
