id,tweet,time,description
1244697565993582593,"RT @JDeleon1012: BREAKING: @HCSOSheriff Chad Chronister announces he has obtained an arrest warrant for Rodney Howard-Browne, the Pentecost…",2020-03-30 18:46:39,"Proud husband, father of 6, 2 autistic daughters, cats, dogs, grand rats. 
#Dodgers
#apbabaseball2013
#apbabaseball1982
#proudautismdad.  Y'all means ALL!"
1244697322686218241,RT @DanceThumak: Your wish is our command! Thumak is now offering Virtual Bollywood Zumba sessions so you can workout from the comfort of y…,2020-03-30 18:45:41,Software Engineer by day and Zumba dance instructor by night @DanceThumak
1244697578492420097,"Colorado won't see gains from stay home order until April 7, @GovofCO says.",2020-03-30 18:46:42,"Kaiser Health News, Colorado Correspondent. If I'm not at my desk, I'm probably out climbing."
1244698622836584450,RT @ladijahb: You can be young with no pre-existing medical conditions and still die for COVID-19. Please stay home. You are not excluded.,2020-03-30 18:50:51,23 • 🌱❤️God • IG: Its_Tommii #GeorgiaStateAlumnae🎓
1244697855308320773,RT @RahulGandhi: Earlier today I wrote a letter to the PM on the Coronavirus crisis. While I’ve offered him my complete support in dealing…,2020-03-30 18:47:48,
1244697674651181057,RT @GreggBeratan: When Disabled NYers  fought GOP #Medicaid cuts in 2017 @NYGovCuomo said he supported us. Now its 2020 in a pandemic &amp; Cuo…,2020-03-30 18:47:05,"disability advocate, stomp out ableism, peer, caretaker, neuro divergent, autodidact,"
1244698589357580288,"RT @BrickzwithTipz: I still can’t believe they turned on that NHS Paramedic, on her way to work, during a pandemic because she was driving…",2020-03-30 18:50:43,i’m on a speedboat
1244697804800290816,"RT @AmandaPresto: Well, at least we're not releasing sex offenders into the neighborhood hotel during all these coronavirus hysteria.

Oh w…",2020-03-30 18:47:36,"Raiders, Dodgers, Kings fan looking for unconditional comedy."
1244697838447198215,"RT @TomthunkitsMind: THIS IS EFFING CRAZY. TRY TO TAKE MY MASK.

White people think blacks are all thieves. So they are aking only black pe…",2020-03-30 18:47:44,"Geriatrician, cat lover and bookworm. PSU alum. 🇰🇪Purveyor of painful truths and belly laughs"
1244698458923114503,RT @brithume: Example of this: the death rates among infected Covid 19 patients may not tell us which patients died WITH the disease and wh…,2020-03-30 18:50:12,"Text TRUMP to 88022 🇺🇸I believe in God, Freedom, and the USA. We are a Constitutional Republic and, by God, we are going to keep it that way! #MAGA"
1244698567979208706,RT @BlindPoetRP: Visually impaired poet Dave Steele AKA The Blind Poet reads poem about #COVID19 please share RT @JayRuderman @CraigLPotter…,2020-03-30 18:50:38,"Earth admirer🌱
Sustainable Peace is our Reality🌳"
1244698392300642305,"RT @VickyAgarwalaVA: Doesn't Anyone even understand the meaning of 3rd Stage Community Transmission of #CoronaVirus ?

Ans: This means, the…",2020-03-30 18:49:56,ॐ महालक्ष्मी च विद्महे विष्णु पत्नी च धीमहि तन्नो लक्ष्मी प्रचोदयात- Tweets in likes #WordsOfTinkerbell -My channel- https://t.co/0rhG6M1ZI2 ✨⚡️
1244697691612905474,"RT @JohnJHarwood: prime minister Trudeau, calling Canada better-situated on coronavirus than the US: 

“we’re not necessarily on the same t…",2020-03-30 18:47:09,"I'm passionate about...Customer Experience, Integrated Campaigns, eBusiness and User Centric Designs"
1244697636759687168,"Prohibit People From Spreading Coronavirus to Great Apes https://t.co/oRUYzayajh
SIGN &amp; SHARE!!!
#greatape #Covid19… https://t.co/fe9lGizhxB",2020-03-30 18:46:56,Tú eres x quien soy capaz d TODO... Hasta el fin del tiempo una y otra vez...
1244698127552184329,"RT @NoContextKai: Yesterday the Japanese voice actor for Master Nyaada, Ken Shimura, passed away from the virus. 
Please, everyone practice…",2020-03-30 18:48:53,"💮 @silkikomori 💮

FC: SW-4027-7956-5790

Profile pic by @eisorus"
1244697900984283142,"RT @jennymedina: So hard to be astonished at this point, but this is astonishing",2020-03-30 18:47:59,Brand Geek. Wife. Puppy Mom. Opinions my own. RTs not endorsements.
1244697926317813762,"@CyrilRamaphosa is also grateful to Mr. @JackMa, founder of Alibaba, who has donated vital medical supplies to Sout… https://t.co/NrpFw4ONA3",2020-03-30 18:48:05,"Sisekelo Sustainability Institute (Sisekelo) is a dynamic business consulting, training and research & development company."
1244697880335716359,Bruh what did he do to her? https://t.co/egpYiyYWqm,2020-03-30 18:47:54,"Grizzlies beat writer for @MemphisFlyer | Founding Editor of @AllHeartinHoopC | @DimeUPROXX | Host @TheShyShow4 #NABJ
Sharon@SharonShyBrown.com"
1244698035415900160,"RT @RonnieRadke: I spent 540 days of my sentence in solitary confinement from getting my knuckles tattooed in prison, the 30 day extension…",2020-03-30 18:48:31,
1244698090101145600,"RT @DARPA: What if any outbreak—anywhere, anytime—could be found and quashed BEFORE it could spread into a pandemic or even a regional epid…",2020-03-30 18:48:44,"Philosophy Prof, International Ethics Center Director, Author of Code of the Warrior. Badger and llama fan. Main field Military Ethics. Views mine; RTs not Es."
1244698534919561228,"RT @nickheathsport: Stop going out folks. TV, games consoles, YouTube, social media and there’s always PornHub. Plenty to do indoors. Be a…",2020-03-30 18:50:30,
1244697863788978184,"RT @dailyblastlive: New York City has turned over Central Park in the fight against the coronavirus. 

Over the weekend, crews started the…",2020-03-30 18:47:50,"Dedicated to Activism, the Support, Promotion and Celebration of Diversity and Inclusion in the Arts while covering and offering Industry news & resources"
1244698492901003264,"RT @stoppression: I am not defending them completely, but blaming them is also wrong. Was the govt sleeping when the foreign attendees ente…",2020-03-30 18:50:20,An analog guy
1244698047952506880,"RT @PJMedia_com: Bill de Blasio Threatens to 'Permanently' Close Churches, Synagogues if They Meet During Coronavirus https://t.co/B9ggVRlc…",2020-03-30 18:48:34,"Love Jesus, family & USA #SoliDeoGloria #Reformed #Redeemed #RetNavySubWife #ConstitutionalConservative #MontanaGirl #ProIsrael #UnbornLivesMatter #TRUMP2020"
1244697968483004416,RT @BeardedGenius: I think this takes the biscuit as the most dystopian response to the coronavirus pandemic I've seen. Incredible.,2020-03-30 18:48:15,Crazy cat lady who talks too much.
1244697943002710016,"RT @ogundamisi: Dear Governor Aminu Bello Masari of Katsina you have not established a #coronavirus isolation centre in your state, what I…",2020-03-30 18:48:09,"Telecom Consultant, a True Democrat and Nationalist, Social Media Enthusiast. Member of APC...CHANGE!!! #NextLevelNigeria"
1244698559716503552,"RT @HistoftheBatman: If you’re upset about another 30, from a Type 1 Diabetic who fears she’ll contract #COVID19 &amp; not recover, please thin…",2020-03-30 18:50:36,"Comic Book Enthusiast, Forensic Psychotherapist, LT COMMANDER-U.S. Public Health Service, Clinical Professor, Doctor of Clin Soc Work, Military Psychotherapist"
1244698446591713289,RT @SkyNewsBreak: Downing Street adviser Dominic Cummings is self-isolating after developing COVID-19 symptoms,2020-03-30 18:50:09,"""Don't be cheeky. I'll bind him to me with promises"". ""Anyone can wear the mask"". ""Okay kid, this is where it gets complicated"". Wear the bloody mask."
1244697883972165633,"While New York Libs release sex offenders during COVID-19 outbreak, Texas governor’s taking a different approach… https://t.co/x7Ml9J8Mmn",2020-03-30 18:47:55,Where media credibility has been reborn. #MAGA #TrumpIsOurPOTUS #AmericaFirstMedia
1244698421245685760,RT @MMayankmatru: @naukarshah @Akkisrr @drharshvardhan Don't expect spoon feeding always....Give effort to gain knowledge..here it is...Sea…,2020-03-30 18:50:03,human by race indian by birth punjabi at heart delhite by geography and most importantly fan of Indian army.
1244698064859824129,Dem talk sey Corona virus go Aso rock con take bribe 🤔,2020-03-30 18:48:38,For all that is good and just
1244698144274874369,Norman says until we do a population study we won't know how many people have the infection and just don't know it.… https://t.co/r2uTW1qT8f,2020-03-30 18:48:57,"Veteran Political, Education & Breaking News reporter who currently reports for @KAKENews and hosts #KansasWeek on @KPTS. Member @NAHJ @NPPA @NAJournalists"
1244697649678127115,"RT @politvidchannel: BREAKING: A Florida sheriff announced an arrest warrant for Rodney Howard-Browne, the Pentecostal pastor at the River…",2020-03-30 18:46:59,
1244698341629472770,@Mr_Ndash Covid babies on the way😂😂😂,2020-03-30 18:49:44,The darker the berry the sweeter the juice 👑
1244697691524907011,"RT @weedthotss: How to correctly practice social distancing:
https://t.co/nHIbiEc0sM",2020-03-30 18:47:09,uiuc ‘20(ish) | educator🍎 | c-5🦋
1244698379667427329,Ur Cook also so sweet 😍 https://t.co/hllC0YVw6K,2020-03-30 18:49:53,___________
1244698370809233409,"https://t.co/kRn301AVt6
Hey NYC! If you want Doctors and Nurses to come help we need places to stay not false promi… https://t.co/kJOANclhTr",2020-03-30 18:49:51,
1244697851017347072,"RT @stephenfry: The unspeakable wickedness of Lukashenko has long been ignored or sidelined by governments that should know better, but thi…",2020-03-30 18:47:47,Life is cool!)
1244698157067501569,"RT @DrPeckPNP: This is how far back we have to put the swab to test you for #COVID19. 

You might want to follow medical recommendations an…",2020-03-30 18:49:00,"Autistic artist/sewist. Will punch nazis/fascists/terfs. Some (re)tweets nsfw.
She/her/they/them.
In dire need of a blanket fort filled w/ kittens/puppies."
1244698031464656897,@UnSubtleDesi Unfortunately this is pattern across. Imams tell them whom to vote but wont teach how to conduct resp… https://t.co/rSxndExuhk,2020-03-30 18:48:30,"• Telco-Pro 🎓 5G 🔆Gáme Ōn
• Technology • Satire • Threader • SwachhCyberism •   Allergic to fugazi liberals 🐍
• Views personal • RTs ≠ endorsements"
1244697997629366275,"RT @USEmbassySA: We stand arm-in-arm with our South African brothers &amp; sisters in waging war against this invisible enemy, COVID19. — U.S.…",2020-03-30 18:48:22,The Struggle Continues...
1244698333106536449,"RT @JoyceWhiteVance: Virginia's Governor, Ralph Northam, is a pediatric neurologist. He was an officer in the U.S. Army Medical Corps from…",2020-03-30 18:49:42,"Accountant, dog lover, avid political interests,"
1244697758792962048,"RT @bopinion: Do social distancing rules go too far?

A Yes, they infringe on my rights
B Yes, it’s fairer to ask those at risk to make a s…",2020-03-30 18:47:25,I like to check things out ⚡️Army Veteran ⚡️Jury Duty Goer ⚡️Voter
1244698400542654464,"RT @W7VOA: ""Stay at home” order issued by @GovernorVA, ordering all in #Virginia to not go out except for obtaining food, supplies, medical…",2020-03-30 18:49:58,"#WWG1WGA, #MAGA
#SayHisName Cannon Hinnant💔

GOD BLESS THE U. S. A
https://t.co/L63gmzrOSV

""And ye shall know the truth, and the truth shall  make you free"""
1244697846814629891,RT @ANI: Two #Coronavirus patients discharged from isolation ward of government medical college in Kottayam. They were aged 91 and 88. It i…,2020-03-30 18:47:46,
1244698429718061058,This is good. https://t.co/0CaZJA2T6s,2020-03-30 18:50:05,Emotionally unavailable.
1244698228471128064,"RT @abhijitmajumder: Beyond the PM’s word, you need a fatwa to shut down mosques? Are we a Sharia state? #Nizamuddin",2020-03-30 18:49:17,
1244697976452366339,RT @MailOnline: French and Italian authorities evacuate coronavirus patients from worst-hit regions to GERMANY https://t.co/0cNmrD20KK,2020-03-30 18:48:17,Love is that condition in which the happiness of another person is essential to your own.
1244698043976421378,RT @Schuldensuehner: Just to put things into perspective: in 1918 pandemic flu the Dow dropped 33% w/muted rebound. In 1969 pandemic driven…,2020-03-30 18:48:33,"FREE day trading, technical analysis, or swing trading LESSONS | DM @cryptoapee will love to help! | #Cryptocurrency, #Bitcoin, #MonsterFam, #APECOIN"
1244698392166621185,"RT @pauldashworth: POLICE STATE: #coronavirus rules are 'hysterical slide into a police state', warns top judge. The former Supreme Court j…",2020-03-30 18:49:56,"Never say never, we are the many. God bless everyone. #LabourSocialist RTs not necessarily endorsements. #Starmerout"
1244698194576957441,RT @TomPats12: Coronavirus: Number of new cases in Italy continue to fall #Coronavirus https://t.co/3ak9FTnXXJ,2020-03-30 18:49:09,"Christian #CPA #Israel #conservative #Republican #POTUS #Patriot #MAGA #ProLife #2nd #NRA FB George Papadopoulos, AG Barr, Gen Flynn, Antonio Sabato, Scot Baio"
1244697842326949888,"This is putting the round peg in the round hole. The Vice President, Professor Yemi Osinbajo is a man known for alw… https://t.co/Wvz69gc2mZ",2020-03-30 18:47:45,"A political scientist, Administrator and above all, God fearing person. Am also an unrepentant supporter of truth. I support CHELSEA FC. Follow Back"
1244698358599561217,"RT @SheilaGunnReid: But if a mask protects asymptomatic or uninfected healthcare workers, why wouldn't it do the same for the public? 

She…",2020-03-30 18:49:48,"Not a rock star, nor an actor. Just a person who does what he says he will do. Passion, Integrity, Empathy, Loyalty, Drive. A construction leader at his best."
1244698291603795968,"RT @kassalv: Men are subjected to Domestic Violence #Lockdown #MakeHomeSafe4Men 
#Corona 

Make helpline for men @MoHFW_INDIA https://t.co/…",2020-03-30 18:49:32,"#SpeakUpMan #SaveOurBoys #PurushAayog
100% follow back"
1244698568151175168,"The hard fact and reality on CORONA VIRUS infection 
It is apparent that we do not have the set up in Africa 
60-70… https://t.co/4MGx8tu0yy",2020-03-30 18:50:38,"Geriatric Neurologist,  CEO and founder Brain Health Initiative Nigeria BHIN, Elderly and Dementia advocate. Wife, mother and lover of God"
1244697628543238144,A8: #Nurses are not just fighting for their own safety but for the safety of their patients and the public at large… https://t.co/UHvdlG9DSp,2020-03-30 18:46:54,"We are the national professional association advocating for registered nurses & the patients they serve. #EndNurseAbuse 

[RTs/Likes are not endorsements]"
1244698589420326912,"RT @ANI: Delhi Government to ask police to register FIR against Maulana of Markaz, Nizamuddin: Delhi Govt

Around 300-400 people had attend…",2020-03-30 18:50:43,"CA Finalist. Interest in Politics, Business, Technology & Finance."
1244698140495810561,RT @BrianKarem: When I asked him at one of his first COVID briefings he said we had 15 cases and miraculously it would go away. Now? @reald…,2020-03-30 18:48:56,"A fortunate member of one of the best bands around, The Imperial Rooster. All around good guy and poser banjo player. Husband to Mabel , we're stickey like that"
1244698639441825804,"RT @TJRicks_TSP: Wow 

Ok so apparently SARS remix has a chance of making men infertile 

I wonder why that hasn’t been publicized a lot 🤔…",2020-03-30 18:50:55,Entrepreneur||computer science Unilag|| Social and friendly
1244698681229672451,"RT @JoyceWhiteVance: Virginia's Governor, Ralph Northam, is a pediatric neurologist. He was an officer in the U.S. Army Medical Corps from…",2020-03-30 18:51:05,"""One's understanding of truth is inversely proportional to one's certainty of it.""
--Me
""What you're doing is drowning out what you're saying.""
--Grandma"
1244698664687112192,"RT @TheSquind: This Pujari salary is 7000 &amp; still helping people in distress amidst of Lockdown. providing them, food, clothes, mask regard…",2020-03-30 18:51:01,A Sanatani Rajput from the Guhil clan who talks about HINDUS amongst a cacophony of secular Dhimmised Islamist Views !
1244698656214638601,RT @Ohitsyvonnee: Want🥺,2020-03-30 18:50:59,"STOP LOOKING FOR LOVE, LEARN TO APPRECIATE"
1244698651907297280,"RT @Yamiche: .@NYGovCuomo says it is ""anti-American"" to get into political disputes amid the coronavirus outbreak in the U.S.

""There is no…",2020-03-30 18:50:58,Scholar/Practitioner of evidence-based management. Entrepreneur. Amateur cook and painter. This is my personal account.
1244698643539451906,RT @LivePDDave1: Do you think the coronavirus is a manufactured Chinese bioterror weapon deliberately released from a Wuhan lab?,2020-03-30 18:50:56,"#ChristFollower #Veteran #RuleOfLaw
#Texas professional truck driver; before we discuss rights be able to define; boots progressive schiff shovelers"
