id,tweet,time,description
1260485320652525569,RT @cbcpnews: ‘We heal as one’: Philippine bishops reconsecrate country to Mary https://t.co/CaKBZ4hs9r #coronavirus #Covid19 #pandemic,2020-05-13 08:21:33,“ To be  yourself in a world that is constantly trying to make you something else is the greatest accomplishment.”
1260491034661920769,Lessons on civic duty from Boris Johnson? No thank you | Marina Hyde https://t.co/CvQzTEKyOp,2020-05-13 08:44:16,"AKA kimmie. Wife/mum/writer/poet©. I have complex #mentalhealth issues, including #OCD. I love Christmas & Betty-Boop. I'm a bit random, so bear with me."
1260490359072788481,RT @ashoswai: 3 out of 4 doctors in India suffer verbal or physical workplace abuse. This must stop - Not only to cry hoarse when a Muslim…,2020-05-13 08:41:35,General Physician
1260490631169875970,"RT @thankyoudurex: Breaking News!!
#Lockdown4 #lockdown https://t.co/kLZhdkuWhy",2020-05-13 08:42:39,i like true beauty and cuteness
1260490598445985793,RT @wef: A science journalist explains how the Spanish flu changed the world https://t.co/Yg0q8TA6sR #SpanishFlu #Coronavirus @lfspinney ht…,2020-05-13 08:42:32,"Graduate student in Molecular Virology, Studying retroviral RNA packaging"
1260491114013999105,RT @Muktab_: I still can’t get over how Americans got tired of COVID and just decided it was over.,2020-05-13 08:44:35,making films 📷 and watching soccer ⚽️ Real Madrid 🇳🇬  #RIPRICKY
1260490459027320838,"@TallestTim @MeristemDesign @laura_laker @HounslowCycling @LikeEngineer ""Someone to ask re costings?""

You mean to… https://t.co/CENP9jJbRV",2020-05-13 08:41:58,Civil disobedience to protest inaction by government on the climate and ecological emergency!
1260490677349240832,But I thought Priti Patel was going to resign! https://t.co/WFU9eYWS7B,2020-05-13 08:42:50,
1260490875219718157,Na niccur https://t.co/8fZ02SZwm3,2020-05-13 08:43:38,Travel consultant @247travels.com 🚀 Recording Artiste 🎙And A 30BG Stan.
1260490610143899649,RT @bb_thorat: This shows the clear difference between the two states. While #Maharashtra set up relief camps which housed over 10 lakh mig…,2020-05-13 08:42:34,You don't need a new day to start over. You only need a new mindset.Student | nature love 💝| INC supporter🇮🇳.
1260491081185202178,Measures Relating To Main Residence Leases Adopted As A Consequence Of COVID-19 https://t.co/Zec7INMJpW,2020-05-13 08:44:27,Mondaq is an intelligent syndication platform providing world class content and insight from professional services firms.
1260491092744683522,RT @MaryTfan: @Im_Sanju_Ss Yes stay safe stay home my dear Sanjay my friend🙏😷🤗❤️Have a fantastic day/evening,2020-05-13 08:44:29,"This 📷 & 🎥 are not mine. Credit Always Goes to respective owner 💙
DM For Credit & Removal 🧡"
1260490965653041153,Coronavirus intensive care in an Edinburgh hospital – photo essay https://t.co/RyX6VHqncm,2020-05-13 08:43:59,"European of the Brit variety, out in the Middle East. Contrasting lives in UK & Oman. Watching how the world is reshaping with the Virus. Want to help 🌍"
1260490689923682310,"RT @LiveLawIndia: During a hearing in SC, Chief Justice SA Bobde hinted at dispensing with the Lawyers robes and gown “for the time being”…",2020-05-13 08:42:53,"President of The Advocates League
@Advocatesleague :

State Secretary General (Organization) of Virat Hindustan Sangam, Bihar @vhsbihar :

Pursuing B.A LL.B"
1260490504992698369,"RT @telebusiness: Tui is set to axe up to 8,000 jobs.

The travel business is seeking to reduce overall costs by 30% and offer more local h…",2020-05-13 08:42:09,@cnbcindonesia|@cnnindonesia|@KontanNews|@Bisniscom|@kumparan|@jawapos|@republikaonline|@kompascom|@screenrant|@gamerant|@CBR|@deadline|@Variety|@tvinsider
1260491151720800256,"RT @ClarkeMicah: Daily Coronavirus Worldometer check: Sweden (pop 10.2 m): https://t.co/Cz5AqDhs9x
 UK (pop 66.6m) :https://t.co/7YoKzFXAG7…",2020-05-13 08:44:44,"“The only way to deal with an unfree world is to become so absolutely free that your very existence is an act of rebellion.”

Be Socrates NOT Plato..."
1260491038193586178,RT @rushmeadvillas: Horrifying... https://t.co/9ps7LZXafZ,2020-05-13 08:44:16,"“I may not have gone where I intended to go, but I think I have ended up where I needed to be.”"
1260490480015552518,"Petition for @GovPakistan  @fawadchaudhry to disseminate daily figures on twitter, so people can make informed choi… https://t.co/alVkTNcLYZ",2020-05-13 08:42:03,"I am a simple guy. i see any post related to Chelsea, i press heart! ENFP. Unapologetically Feminist"
1260491143793557504,Hole Saw Kit is trending because the lockdown has put an enormous strain on the UK's once-proud glory hole industry.,2020-05-13 08:44:42,"Helen Love's synth player, Cuban Boys boffin, Rikki from Rikki&Daz, Eurovision songwriter, Hacker T. Dog's ''second favourite music producer from yesteryear''"
1260490891069964288,"@Liz_Cheney Dr. Fauci deserves to be judged based on his record as an expert.

This year, Dr. Fauci has told Americ… https://t.co/uZ8NW4OI46",2020-05-13 08:43:41,
1260490979913748482,RT @__yasminxo: Young adz in lockdown discovering foods other than pussy,2020-05-13 08:44:03,🅿️🚹Ⓜ️🅿️
1260490560223223810,RT @thistallawkgirl: People are high-fiving Liz Cheney because she said we should listen to a doctor during a pandemic. That’s where the ba…,2020-05-13 08:42:22,"old man yells @ cloud, in live role play, sometimes...  if my crazy offends, I'll pretend to be sorry, for social convention. In 2016 and 2020 #BernieWouldveWon"
1260490808609964032,Maybe send roses and Voltes V cake w/ his face next time. 🌹🎂 https://t.co/pfYPABtX7z,2020-05-13 08:43:22,Parallel synchronized randomness.
1260490530066137089,Nirmala Sitharaman To Share Details Of Rs. 20 Lakh Crore Package At 4 pm - NDTV https://t.co/WL6RPdhX8z,2020-05-13 08:42:15,
1260490468837724160,"@Mixboi9 @connorlowery9 the dudes 100% right. The entire point of the lock down, of ""flattening the curve"", was to… https://t.co/RMbtwT0pxu",2020-05-13 08:42:01,"jokes, memes, politics, shit stirring, and gaw rts. 

Dont follow if you expect more then that.

https://t.co/KTIteZzQOk"
1260490836372062208,11 things you are allowed to do from today as lockdown is eased- how many of these were you aware of?… https://t.co/rU3mh8PpnT,2020-05-13 08:43:28,News and Reviews for Families across the UK.
1260490894379278337,"RT @AlStewartOBE: #Covid19
The significance of @RishiSunak's extension of the furlough package, albeit amended, is not the fiscal shock but…",2020-05-13 08:43:42,
1260490992429522947,Care homes are private companies thick cunt. Not the government jobs to police an industry that has the funds and r… https://t.co/NoZ6n1FWCz,2020-05-13 08:44:06,22
1260490937328898052,"RT @RobertJenrick: Today I am announcing our comprehensive plan to restart, reopen and renew the #housingmarket - safely.

You are now free…",2020-05-13 08:43:52,"Conservative MP for Don Valley. I cannot handle casework on Twitter, so if you are a constituent please contact me via nick.fletcher.mp@parliament.uk"
1260490713810309122,"@philipbatmanca1 This is what we have...only thing I’ve bought since lockdown is the box, a skipping rope and the b… https://t.co/wnl73Pa062",2020-05-13 08:42:59,#wife #mum #skiing #running #weights #holidays #rugby #gin ⛷🏃🏼‍♀️🏋🏼‍♀️🏖🏉🍸
1260490599121248257,"This ramzan, this whole lockdown has been a sad affair all along..",2020-05-13 08:42:32,Alone in a world full of people
1260491038122270720,"RT @Arthur89367695: Covid 19 coronavirus: Duo who sued Jacinda Ardern claiming illegal lockdown 'detention' named, via @nzherald https://t.…",2020-05-13 08:44:16,WWG1WGA
1260491085014536193,"RT @DianaAtwine: Fellow Ugandans,
Please note that Hepatitis B testing and vaccination has not been affected by the ongoing lockdown. Servi…",2020-05-13 08:44:28,"Journalist. Writer. Fellowships: NRGI. Awards: Multimedia, Innovation & National News Reporting. Akiiki + Amooti = Abooki"
1260490652594380800,RT @RMTunion: Coronavirus: Don't work if you feel unsafe - RMT boss https://t.co/DTJiGoUZYd,2020-05-13 08:42:45,Bringing together workers fighting austerity.
1260490461397032962,"RT @derekjames150: Just remember, the people dealing with this #Covid19 pandemic who say their handling of it has been a huge success are t…",2020-05-13 08:41:59,"I Don't support conspiracies, religion, racism, xenophobia, sexism, Fascism, Authoritarians AGW denial or anti intellectualism. Trump & Johnson are utter morons"
1260491018207727616,"RT @premnsikka: UK govt considering 'Income tax hikes, public sector pay freeze &amp; scrapping triple lock on pensions' to foot ‘£300bn’ Covid…",2020-05-13 08:44:12,The search for the truth has actually resulted in me living a lie.
1260491087447293952,"RT @RonaldKlain: We literally left them a 69-page Pandemic Playbook.... that they ignored  

And an office called the Pandemic Preparedness…",2020-05-13 08:44:28,Annibyniaeth #FBPW 🏴󠁧󠁢󠁷󠁬󠁳󠁿
1260490577457577984,"Pence: At least 254K Americans tested for coronavirus, over 30K positive https://t.co/VPr6n23484",2020-05-13 08:42:27,https://t.co/berF5DybDh
1260490580620193795,"RT @CampusBiotech: Today, #Covid_19 mortality is truly the highest cause of death in the world, affirms @unige_en Prof. @FLAHAULT, based at…",2020-05-13 08:42:27,"This is the official Twitter Account of SIP-West 
#SwitzerlandInnovation #Innovation #disruptiveInnovation #Switzerland #EPFL"
1260491123048558595,"RT @hpcl_retail: While our emergency services are on the front lines in this #FightAgainstCorona, we are standing right by their side, fuel…",2020-05-13 08:44:37,
1260491050860322818,RT @RalliSolicitors: Do I have to wear a face mask on public transport and in crowded places? Here's what Boris Johnson has advised in his…,2020-05-13 08:44:19,"A registered charity supporting the work of intermediaries with vulnerable people in the criminal justice system of England, Wales and Northern Ireland."
1260490886238089228,RT @rapplerdotcom: ‘Law is law unless friends kayo.’ Filipinos online were quick to call out the administration’s double standards in imple…,2020-05-13 08:43:40,"michiko l 23 l she/her, they/them l ENG/FIL/日本語 (勉強しています)OK 🔞I RT LEWD i make art! and also i stream sometimes! COMMISSIONS OPEN check pinned icon by @tenkainu"
1260491083869556736,"Thanks for all the positive feedback on my newest book: 'Pandemic Joy'.
It's now available for #FREE on @Okadabooks… https://t.co/umYXwK4zJo",2020-05-13 08:44:27,"Author, Youth Mentor, Church Leader and Host, Alive Mentorship Group"
1260490747968737280,"RT @QIndians: As part of the ongoing Coronavirus COVID-19 testing for people undergoing home quarantine following return from travel, the M…",2020-05-13 08:43:07,Connecting Indians living in Qatar. For the Indians. By the Indians - https://t.co/LxHce3wyLe
1260490634915348481,RT @scroll_in: The Maharashtra government requests the Centre to send 20 companies of the Central Armed Police Forces to manage the situati…,2020-05-13 08:42:40,
1260491242569371649,"RT @SAgovnews: [Read the full Gazette] Trade, Industry and Competition Minister Ebrahim Patel has gazetted directions on the sale of winter…",2020-05-13 08:45:05,Hijo de Dios; embajador RD en Sudafrica; ex embajador en Corea del Sur y Colombia. Sociólogo. Mastria en  Relaciones Internacionales. Cuenta personal.
1260491347523403776,"RT @david_s_barker: This is gaslighting. 
You can’t blame people with no alternative mode of transport to not get a bus when the government…",2020-05-13 08:45:30,Treppenwitz der zukünftigen Geschichte. Mutra ma ande ćo vari.
1260491213985153026,RT @VerityHelen: Daughter just brought me this. She’s 14 and been lockdown painting.  I had no idea she could paint #NHSheroes https://t.co…,2020-05-13 08:44:58,I ❤️ @GaryBarlow he followed me 3/10/2014 7 DM's 35Twts 6RT's @HowardDonald 10Twts @OfficialMarkO 1Twt❤️@takethat 1Twt 85 likes 2Rwt ❤️@RobbieWilliams 1 Like
1260491230749827073,RT @SenTomCotton: China is profiteering off a pandemic of its own creation by shipping our brave doctors and nurses fake masks. China must…,2020-05-13 08:45:02,どの報道が真実か見極めることを日々心がけています。ワンコ、にゃんこ、豚骨ラーメン、福岡のうどん、ホークス、九州のこと、政治経済などなどをリツイートしてます。
1260491197363163136,"Updates on Covid-19 in #Pakistan 🇵🇰
https://t.co/TE5DAzPZhU
#COVIDー19",2020-05-13 08:44:54,"Chief Executive #SharifMedicalCity, Executive Director #SMRC, Director #TheHeartCentre | Physician PM #NawazSharif | #HealthEconomics #LSE #partofLSE | #WHO #UN"
1260491293437853696,"RT @MichaelM_ACT: Experts warn that the fossil fuel industry is exerting its influence on Australia's Covid-19 economic recovery, including…",2020-05-13 08:45:17,"Dedicated protectors of the reef and rainforest of Australia's wet tropics. Resisting fossil fuels and bringing climate justice.
Email stopadanicairns@gmail.com"
1260491205349122049,"RT @sagarikaghose: Missed the empathy in @PMOIndia address, for fellow citizens who lost lives in India’s killer #lockdown. Ravi Paswan and…",2020-05-13 08:44:56,
1260491326585475078,"@jackrussell1111 So you accept that social distancing is a farce within the Supermarket setting, between that and g… https://t.co/ogxe7CdtOr",2020-05-13 08:45:25,"as the song goes, I got knocked down, I got up again"
1260491296759824385,Presenting VISHAL KAPIL Live in a Face2Face session! Participate to know more on ‘How to build your e-commerce… https://t.co/uoMOrmAcJe,2020-05-13 08:45:18,"ICS is a focued event where internet commerce industry
gets together to learn, grow and define the ecosphere of the internet business #Retail #ecommerce"
1260491181684936705,"RT @aquapaopao: ""Law is Law""
*Mocha did not follow the ECQ rules.
*Koko wandering outside despite of having covid19
*PNP Birthday Gathering…",2020-05-13 08:44:51,Bayan muna bago pulitika
1260491318637322240,"RT @CABRAXAS10: Here's the banned YouTube ""Plandemic"" video. 
https://t.co/cCyKbnyYSu",2020-05-13 08:45:23,"#DigitalSoldier 👊⭐️⭐️⭐️@GenFlynn #Q #MAGA 🇺🇸 truther activist, conspiracy analyst ❤️animals, art/good designs, holistic care, natural foods. 🚫dating DM’s"
1260491289491124235,"RT @MilesBriggsMSP: Scotland has the highest death rates in Care Homes in the UK.

Why has Jeane Freeman still not published the Clinical G…",2020-05-13 08:45:16,Communications manager/Diehard Dundee fan/father/drummer/Conservative/Unionist
1260491336056279040,"Babies born to 6 women with #COVID19 in China had protective levels of IgG antibodies at birth, small sample but en… https://t.co/Szp2Tp75hE",2020-05-13 08:45:27,"UK General practitioner. NHS supporter. Professor General Practice, University of Nicosia. Father of two musicians: @ziazansong and @CevanneMusic"
1260491407254523909,"RT @mlcoolj2: Knowin there is a banana in my desk drawer in work, which has been there since a week before lockdown is makin me feel anxiou…",2020-05-13 08:45:44,boats are always safer in the harbor but that's not what boats are built for.⛵️
