id,tweet,time,description
1247505660826333184,"RT @left_voice: @left_voice member and socialist nurse @Tre_Kwon says to CBS evening news: ""Our CEOs and executives are extraneous. We can…",2020-04-07 12:45:01,"No sleep schedule angel
Anti-Colonial b4 anything
Artist trying not to be a propertarian
Stop retweeting the NYPost"
1247498743974428673,RT @narendramodi: Outstanding gesture by the @DalmiaBharat Group. Every contribution matters and will lead to a healthier India. #IndiaFigh…,2020-04-07 12:17:32,Civil Engineer .....  Creativity + Idea + Vision + imagine  + live ............
1247498883305017344,RT @OccupySchagen: France: Corona crisis an excuse not to report Islamist attack https://t.co/6Y8FvzWzOs,2020-04-07 12:18:05,"PVV🇳🇱   ANTI EU/VN. NEXIT. ANTI MASSA IMMIGRATIE. KNIELT VOOR NIEMAND... @KICKOUTRUTTE


LID v https://t.co/waBpKPfMth
ON27653    ook op https://t.co/3VqCjUEzhU"
1247498711149809666,RT @maddow: Senator Perdue's stock portfolio remained active during pandemic https://t.co/ARIRIGmSua,2020-04-07 12:17:24,US Politics World News Mother and Grandmother Dog Mother❤️🐾🐾RT's are not an endorsement. #RESIST🌊🌊🌊🌊🐶❤️🌷🌷Dump Trump 2020. #FreeRealityWinner 🆘 #SWAT
1247498724013756416,RT @TomCarrollMDPhD: ~93% of deaths in 60+ group. That's a large group of people in this country. Pray this curve flattens...AND... the are…,2020-04-07 12:17:27,"#Healthcareprofessionals integrating faith into the practice of #medicine, deepening a spirit of #service, working to restore Catholic principles in #healthcare"
1247505631805915137,"RT @Saqlain_Mushtaq: Stay safe, stay at home with your loved ones and enjoy our clip ❤️ https://t.co/iFPP7p6ce2",2020-04-07 12:44:54,‏‏‏‏‏‏نفرت سے نفرت| foodie|خدائی خدمتگار|کوئی دشمن نہیں خود کافی ہوں |رنگوں سے دوستی| موسیقی|شاعری| دوستی|ایک ہی نشہ محبت کا|.RTs doesn't mean endorsement
1247499092500131840,"RT @NadineDorries: I last spoke to Boris a few days ago and was in regular contact by phone. He’s a fighter and it’s fair to say, he was fr…",2020-04-07 12:18:55,https://t.co/vk7O55Ek6o
1247505627192209409,RT @maxbhill: The great big Yellow of the Daffodil 🌼 brings a smile 😊 to any garden #NHSthisflowerisforyou #stayhome #gardening #photograph…,2020-04-07 12:44:53,"Peaceful and positive as i create, live, and love the 'soundtrack of my life.'"
1247499121755389953,"To support #Florida's response to #COVID19, I have issued an emergency order providing extensions of annual report… https://t.co/prcJjWBdKW",2020-04-07 12:19:02,"Proudly serving as Florida’s Secretary of State. The FL Dept. of State manages Florida’s elections, corporations, historical & cultural resources and libraries."
1247498589271711744,RT @Kenyans: Health CS Mutahi Kagwe has gazetted some tough demands to landlords as Covid-19 pandemic continues to cause havoc countrywide.…,2020-04-07 12:16:55,simply facts
1247498542781829121,More Canadians afraid of becoming sick with COVID-19: poll - National #coronavirus #afraid #canada… https://t.co/M8xlfZhVft,2020-04-07 12:16:44,Latest Live News Related To The Corona Virus (COVID-19) Pandemic.
1247499130471174144,RT @gagamonster96: Catch up with @ladygaga as she talks #TogetherAtHome and her massive contributions to help people during #COVID19 in 3 n…,2020-04-07 12:19:04,#GAGA #AVAMAX 🥰❤️
1247499021146566656,"In all this madness, I either have days where I'm absolutely fine, or absolutely terrible. There's no real in-betwe… https://t.co/qQ4pjuuDMO",2020-04-07 12:18:38,"Editor-in-chief, @stellarmagazine & Managing Director, VIP Publishing Group. Co-host #TheGlowUp podcast ✨ Reality TV aficionado"
1247499033645637633,"1/2 As a proud member organisation of @TheatreForumIE since our formation, we stand in full solidarity with the who… https://t.co/Rsa0omDdJz",2020-04-07 12:18:41,Mothers Artists Makers (MAM) is a feminist movement created by mothers who are professional members of the creative industries
1247499042399141888,"RT @ShannonFreshour: The worst part of this decision is all 9 of them know exactly how dangerous public mixing is the COVID era..

THEY CLO…",2020-04-07 12:18:43,
1247498719425159169,"RT @Echinanews: An art teacher in Shanxi Province spent three months creating a chalk painting depicting the street scene from ""Along the R…",2020-04-07 12:17:26,Quality Art Lessons for all #drawandpaintanything #chester #chesterartschool #cheshireartschool #todochester #childrensclassescheshire #chesterart
1247498673103175682,RT @spectatorindex: JUST IN: Coronavirus death toll in Sweden rises to 591,2020-04-07 12:17:15,"I don't poke my nose into issues that don't bring food to my table •Journalist•Traveller•Farmer•
Fan @manunited•Proudly🇺🇬n• I mind keeping in my lane."
1247498865965764608,"The bodger and badger analogy in #ThisCountry 😂 

Boy I needed Kerry and Kurtan Mucklowe during this lockdown. Thank you!",2020-04-07 12:18:01,"Director represented by United Agents (UK) & CAA (US). Known for Des, Humans, Banana & Broadchurch."
1247505564378284033,RT @KananCoach: Day 22 of social distancing with my family: nominated by @capitalkidscric to do the nine ball pick up challenge! Got mine d…,2020-04-07 12:44:38,Official Twitter page of Barking Cricket Club made up of 4 adult teams and 2 colts teams. Follow us on Facebook: Barking Cricket club and Instagram: @barkingcc
1247499012762198023,RT @spectatorindex: JUST IN: Coronavirus death toll in Sweden rises to 591,2020-04-07 12:18:36,I miss the old days back in 1998 when I didn’t exist
1247499146912825345,RT @menzingubaneza: Good morning this beautiful #Tuesday sending a shoutout to this talented young man Musa Shakes  for honouring me in suc…,2020-04-07 12:19:08,"A Wits medical Student.
#LIVERPOOL #BARCELONA #KAIZERCHIEFS"
1247498921066270720,"RT @AriBerman: Poll worker shortage of 7,000

111 communities with no one to work polls 

Milwaukee reduces polling places from 180 to 5

2…",2020-04-07 12:18:14,
1247505606493249536,"RT @Limericksports: ❕Good News Alert ❕

We are delighted to launch the 🟢 Active Limerick Hub 🟢

This online platform is full of resources/i…",2020-04-07 12:44:48,Providing Specialised Training and Education Programmes to people who need extra support due to a disability or setback.
1247498744473493504,"RT @umar8528: As per Amber Shamsi Tableeghi Jamaat gathering on 11th March was also responsible for COVID-19 spread.

Are we sure Aurat Mar…",2020-04-07 12:17:32,"Businessmen , Contractor , Constructer"
1247498580937629696,"RT @UgwunnaEjikem: I just watched Pastor Chris say COVID-19 does not exist &amp; 5G is the issue &amp; I still can't believe my ears!

From doctors…",2020-04-07 12:16:53,Die hard FC Barcelona fan. Messi till the end
1247498530975072256,"RT @ChanelRion: At the White House, I asked about Chinese Propaganda peddled by press in the White House... 

WHCA members had a meltdown.…",2020-04-07 12:16:41,"I’m a conservative/Trumplican. I voted for President Trump, and at this point in time, I will vote for him again. Pronouns: Fuck/Off/Dumbass"
1247498861481951232,@nsitharaman madam  kya aap lockdown ke time par EDP (entrepreneurship development programme) training online free… https://t.co/kueV25QaYr,2020-04-07 12:18:00,
1247498845162012672,"RT @lilli_hopkins: Guys, apparently today starts the projected two week peak period of COVID-19. If not taken seriously, this can last thro…",2020-04-07 12:17:56,
1247498970462662656,That's a great statement just a lot of others you make. Just a pitty you never follow up and act on your statements… https://t.co/Piaal68l6s,2020-04-07 12:18:26,"When the opposition screams, let them. When ppl ask you sincere questions, guide them to the facts and not to theories. Truth and peace. 
I follow back Patriots"
1247498634951905285,@AMLSNNational @YmlsfNigeria @mlsnigeria You guys be sleeping on this. This is the time to front the medical labora… https://t.co/Bytg0UnwG0,2020-04-07 12:17:06,"Dote on Black || Blacknificent || Black Divine || Promote Black!


🖤Hug somebody today!🖤

💜I LOVE CRYPTOCOINS💜"
1247499075609604096,"RT @gatewaypundit: ""Well, I'm Upset"" - Dr. Oz Vents After NY Governor Cuomo Shuts Down His Study on Hydroxychloroquine for Early Treatment…",2020-04-07 12:18:51,"FALSUS IN UNUM, FALSUS IN OMNIBUS. Friendships Only. NRA Member Trump is my President."
1247498534481539072,Bill Gates is Now Building Factories to Produce 7 of the Most Promising COVID-19 Vaccines https://t.co/lPkjEZt3Ct,2020-04-07 12:16:42,
1247498555641810944,"RT @globalnews: Coronavirus: Finding social distancing loopholes not worth the risk, experts say https://t.co/igF2TmwdEL https://t.co/z4MvG…",2020-04-07 12:16:47,"follow your dreams, they will never let you down !"
1247505661010882560,"RT @eugenegu: Unlike other patients, Boris Johnson likely has the option to get convalescent plasma from a patient who recovered from the c…",2020-04-07 12:45:01,"Believes in honesty,truth,justice. Loves rock n roll & freedom#BLM Total book junkie. I'm a reasonable person. Photos are my own unless RT. I don't feed trolls."
1247499197718372352,"RT @dril: the bright side to all this, is that everyone's now forced to stay home and read my posts contemplating if america is ""Ready to L…",2020-04-07 12:19:20,
1247499092458160133,"RT @realDonaldTrump: For humanitarian reasons, the passengers from the two CoronaVirus stricken cruise ships have been given medical treatm…",2020-04-07 12:18:55,
1247499130395676672,@NiecyOKeeffe i’m guessing no one can go up till corona is done?!,2020-04-07 12:19:04,Boo!
1247498937180794880,With corona virus spreading and killing people the world is at stand still; people are doing research to get the… https://t.co/PDQQa9OtPd,2020-04-07 12:18:18,To make friends  with people around the world; share God's love.
1247505618975555584,"RT @fisayosoyombo: Funke Akindele organised a house party and was DESERVEDLY arrested, tried &amp; sentenced in court.

Unnecessary secrecy &amp; u…",2020-04-07 12:44:51,backup account of @olaoluwakintan_
1247498668778950656,"The #UDel research community is invited to attend a Virtual Town Hall today, April 7, from 1-2 p.m. Details below a… https://t.co/ccgsQAeZIQ",2020-04-07 12:17:14,Official Twitter account for the University of Delaware's Graduate College. #UDel #gradschool
1247499180416827392,"If you live in Greater New Bedford, MA &amp; have been impacted by #COVID19 , you may be eligible for cash assistance t… https://t.co/xDtQklwY2E",2020-04-07 12:19:16,We're a nonprofit that provides small loans & Financial Coaching for people who want to take control of their finances & their lives. Check out our website!
1247498715566419969,"RT @DGPurser: I'm sure there isn't an ounce of politics involved in this hate-fest from a NYC official and from @CNN 

Exactly how did @rea…",2020-04-07 12:17:25,
1247499025865195521,RT @MSNBC: Wisconsin’s primary election will go on as planned Tuesday despite the state’s stay-at-home order and a day after two courts rul…,2020-04-07 12:18:39,“Darkness cannot drive out darkness; only light can do that. Hate cannot drive out hate; only love can do that.” ~MLK
1247498551170605056,RT @nigeriantribune: COVID-19: Elumelu to distribute over N45m palliative items in Delta https://t.co/Aa8qDlBZYF https://t.co/ALtsX8MfG3,2020-04-07 12:16:46,Blogger
1247498924513951744,How Coronavirus Threatens the Seasonal Farmworkers at the Heart of the American Food Supply https://t.co/ZO4SNHwplc via @latinorebels,2020-04-07 12:18:15,"Sociologist, Demographer, Public Policy Commentator, Social Justice Advocate"
1247498761099771904,RT @BashirAhmaad: The Nigerian Customs now handed over the 150 truckloads to rice to the Federal Ministry of Humanitarian Affairs for distr…,2020-04-07 12:17:36,Litigation and transaction lawyer
1247499130206814208,"RT @HoodlumRIP: OAN *Reporter* “Mr. President, why isn’t the mainstream media asking what Obama has been doing to combat Coronavirus, for t…",2020-04-07 12:19:04,"#BlackLivesMatter #BidenHarris photography, art, poetry, jazz, history, progressive politics. Norwegian-American. Michigander. #BlueWave no DMs"
1247498836878209026,"RT @NYGovCuomo: Today I am increasing the maximum fine for violations of state-mandated social distancing rules from $500 to $1000.

This i…",2020-04-07 12:17:54,"Just me. Wife, mom to four kids. super creative. Love working with clay, fiber, and paint."
1247498966578724864,"RT @DefenceHQ: ""It feels good to get hands-on and do our part for the country."" 

Kingsman Hughes on being part of the #CovidSupportForce a…",2020-04-07 12:18:25,Former PPC WM & HR. Anti-EU Pro-UK. British Disabled #EDS/comorbidities #Army manui dat cognitio vires 4698 Quite Cynical wide awake not woke i dont endorse RTs
1247498739939446785,"RT @baltimoresun: Johns Hopkins Student Government Association asks for partial tuition refund as coronavirus forces classes to go online
h…",2020-04-07 12:17:31,MAGA KAG TRUMP 2020
1247498535077101568,RT @MollyJongFast: The Trump administration knew in January and did nothing.  https://t.co/P0PqAnEHTQ,2020-04-07 12:16:42,
1247499180756566019,"RT @CharlieDaniels: When this pandemic is over America and every nation on the planet must remember,China brought us this,their lies and ir…",2020-04-07 12:19:16,
1247498543549624321,@xsqoof Isn’t that bat what cause this corona bullshit😂idk I’m dumb asf,2020-04-07 12:16:44,Gamer and loyal
1247498681420480512,"RT @lilli_hopkins: Guys, apparently today starts the projected two week peak period of COVID-19. If not taken seriously, this can last thro…",2020-04-07 12:17:17,#BLACKLIVESMATTER
1247499248054046720,"24 new COVID-19 cases emerge in Rajasthan, state tally reaches 325 https://t.co/ydwGjmsfuB",2020-04-07 12:19:32,"पूर्व नौसेनिक
मुझे गर्व है अजाद हिंद फौज के सेनानी, भारतीय हॉकी के जनमदाता का पौत्र होने पर।
कड़वी पर सच्ची बात करने का दम रखता हूं।"
1247499335605993474,"RT @r_o_h_a_n_r: Nixon ordered Seventh Fleet into  Indian Ocean in a threatening gesture

China indulged in verbal threats

16th December 1…",2020-04-07 12:19:53,Support diverse Social and Political means to achieve freedom and equality. Practicing Financial Advisor.
1247499251732680705,RT @GC_Indivisible: They all knew. https://t.co/E4V2HEnXds,2020-04-07 12:19:33,"No label, no slogan, no party, no skin color, and no religion is more important than the human being. 
-James Baldwin"
1247499230622646273,"We are fighting two pandemic threats today, Coronavirus and stupidity, and stupidity will never go away.",2020-04-07 12:19:28,#Atheist #Sarcastic #TheResistance #Metalhead #BehemothFan #Liberal #Latino #FuckTrump #BlackLivesMatter
1247499859780763649,Specially Family Groups https://t.co/xLhSaXRCMa,2020-04-07 12:21:58,
1247499864386220037,"RT @RepEscobar: Nepotism is a bad way to handle the coronavirus pandemic. Jared Kushner, Trump’s unqualified son-in-law, has no business ru…",2020-04-07 12:21:59,full of life.
1247499591651647488,"RT @GOPLeader: China lied to the world.

If the Chinese Communist Party would have allowed our scientists, our researchers, and our doctors…",2020-04-07 12:20:54,"Hard working, Loves money, Always on time."
1247504272624738305,RT @sumanthraman: Another country that didn't lock down fully.,2020-04-07 12:39:30,live & let live
1247499264751734786,RT @learnmesummat: This article is so misleading. Says that closing schools has marginal impact but then suggests if schools reopen childre…,2020-04-07 12:19:36,"Married to my best friend. Mummy to 2 beautiful boys. Deputy Curriculum Leader, ITT Mentor & Literacy Coordinator. Passionate about pedagogy. T&L geek."
1247504285056843776,"RT @MyDoncaster: In November 1970, officials in Oregon, USA decided to blow up a rotting whale carcass. The whole thing went horribly wrong…",2020-04-07 12:39:33,Renowned gourmand of his own feet.
1247499641882583040,@realDonaldTrump @VP Urgent! Don't ignore. I have complete molecular evidence to disprove Evolution Theory and a pa… https://t.co/gEXAYQLUN8,2020-04-07 12:21:06,"I am a pharmacist with expertise in BIOMOLECULAR PRECURSORS (food nutrients, food factors, and food metabolites) as a potential cure for any disease."
1247499826733948928,RT @robert_spalding: NO! I work for CCP!,2020-04-07 12:21:50,晨阙墨蓝时， 孤灯暗淡凄。 微风捋沼气， 为客日之曦。
1247499901937889281,"RT @cjwerleman: In Bangalore, Indian Muslim humanitarian aid workers were attacked by Modi radicalized Hindutva thugs, who falsely accused…",2020-04-07 12:22:08,"Proud Pakistani, MY policy Respect & integrity. Like travelling."
1247499579324538886,"⁦@realDonaldTrump⁩
Dr.Anthony Fauci Plotted 'Global Vaccine Action Plan'w/Bill Gates Before Pushing COVID PANIC wit… https://t.co/wFgCLrfc5P",2020-04-07 12:20:51,"Catholic American love our imperfect USA.Racism,bigotry is ignorance & color blind. Immigrants have responsibility to Americans-assimilate & be productive.#MAGA"
1247504248134193153,RT @nalinisharma_: JUST IN: CJI while hearing a PIL seeking payment of minimum daily wages to migrant workers during #COVID19 says that the…,2020-04-07 12:39:24,"Thinker, Friend, Leader, Liberal + Centrist, Humanist, Traveller, Minimalist #MensRights #GenderEquality, #ExFeminist, #LJW"
1247499553844146176,RT @Fred_Delicious: It's me,2020-04-07 12:20:45,kakh nahi pata par meri phurtiyaaN tey vekh
1247499780370173954,"@_AJCousins @MelindaEdits Oh my goodness, they did swan the Tiger 

https://t.co/xjAaz9UmdO",2020-04-07 12:21:39,I write. I dream. I say inane things. Lover of kissing books. Otter aficionado. DC girl 4eva. Humble member of the Cult of 365 DNI. 🎧Host of @RomEverAfter
1247499671079190529,"RT @sarah_ebrahimi: How can companies support employees during the #Coronavirus pandemic?

🚼 Provide childcare services to essential worker…",2020-04-07 12:21:13,Disruptive Technology Lead @IFC_Org @WBG_Gender managing #Digital2Equal #GenderSmartBiz #DrivingEquality. All views my own.  She/Her.
1247499566678708225,"Lockdown immensely hurts orphanages https://t.co/yDycR8p5RR
#Lockdown #India #Hyderabad #orphanages",2020-04-07 12:20:48,"Breaking news from Hyderabad, India, Islamic World and around the World on Political, Current Affairs, Sports, Technology, Culture, Bollywood and Health."
1247499340194754560,RT @magdalini_s: “Herd Immunity” https://t.co/ldi9zIiQlk,2020-04-07 12:19:54,Never ride a burning camel. Old Arab proverb.
1247499956736397312,RT @eolander: Ghana's Finance Minister Ken Ofori-Atta is among the first high-ranking African officials to specifically call out China by n…,2020-04-07 12:22:21,Decoding #ChineseAid & international development work @UniHeidelberg 汉学系 and https://t.co/wE0oSxGmqV | intercultural facilitator | ex-aid worker | feminist |
1247499796929282048,RT @paulkrugman: Decades of anti-government ideology have left us unprepared to deal with national disaster https://t.co/dbPkfFYsrC,2020-04-07 12:21:43,"Professeur de Robotique et IA
NB : mes opinions sur ce compte Twitter sont strictement personnelles ; my professional posts are on LinkedIn or @FabienMoutarde"
1247499902680088576,"RT @AskAnshul: ISKCON UK reported 21 coronavirus cases &amp; 5 deaths.

Though, ISKCON had shut all its temples in UK on 16 March, a week befor…",2020-04-07 12:22:08,"zindagi badi honi chahiye dost ,lambi nhi"
1247499893951860738,RT @guardian: Coronavirus US live: Trump reportedly knew pandemic was likely in January https://t.co/BIGPCISpWv,2020-04-07 12:22:06,"Carpe Diem. Libre pensador, amante de la cultura y los libros."
1247499482322755584,RT @business: The number of new coronavirus cases in Indonesia surges by more than 200 for second consecutive day https://t.co/482HK2JttV,2020-04-07 12:20:28,"Latest news updates.... Indian Stock markets NSE, BSE and World Stock markets related news and more."
1247499633426907138,RT @AdvoBarryRoux: Deleted Instagram Pic of Mdu Manana and Stella Ndabeni-Abrams violating the lockdown rules. #LockdownMzansi #Day11ofLock…,2020-04-07 12:21:04,Secure the vibe at all times.🎈
1247499549733785600,"RT @jonshorman: Kansas Gov. Laura Kelly on Monday detailed the requests she's sent to FEMA that have gone unfulfilled &gt;&gt;&gt;

- 22.3 million g…",2020-04-07 12:20:44,Writer. Explorer. Kansan.
1247499537113067521,RT @OrleansPat: D.C. we gonna be on Lockdown🔒 4eva 😩 https://t.co/XijgjpJ6Sy,2020-04-07 12:20:41,Seat Pleasant for life 💯 D{〽️}V ✝️🅰️🅿️😈 #stayhumble #nevafold “my name k2 but I don’t smoke that shit”
1247499654226313216,RT @INCIndia: Congress President and CPP Chairperson Smt. Sonia Gandhi writes to PM Modi suggesting various measures to fight the COVID-19…,2020-04-07 12:21:09,"Madhay Pradesh State SM Coordinator @CongressSevadal| Content & Research Coordinator, @profcongress-Indore Chapter| Views are Personal|RT's aren't Endorsement"
1247499525029232641,"RT @Newzroom405: President Cyril Ramaphosa asks Communications Minister, Stella Ndabeni-Abrahams for a meeting to discuss her allegedly bre…",2020-04-07 12:20:38,Not your Mama
1247499851488772096,.@educationgovuk has published a list of online resources to help children learn at home. They've advised that they… https://t.co/1wES5rUrPQ,2020-04-07 12:21:56,"We Are Star.  Nurturing Today's Young People, Inspiring Tomorrow's Leaders."
1247499864109395974,"RT @TowerHousewares: *FLASH COMPETITION!!*
It's the last chance to enter our giveaway of an indoor/outdoor grill! The winner will be announ…",2020-04-07 12:21:59,"Proud to be a member of Unite Community.Lives with CIDP. Peacenik. Like anti-fascism,democracy,bees and humans.Hate mosquitos.#DontFrackNorfolkBroads"
1247499914751418368,RT @TKPvikings: How much more can we take of CCP attacking @realDonaldTrump The Greatest President in American History??,2020-04-07 12:22:11,45 years of customer service - brutally honest-sense of humor - “common sense”. #MAGA #KAG -ALL need to accept Donald J Trump as our president because ...he is!
1247499839098634241,"RT @jcpunongbayan: NOPE, YOU DON'T GET TO SAY THAT.

After the 1st confirmed case you were reluctant to impose travel restrictions, said yo…",2020-04-07 12:21:53,
1247499323429941248,"RT @MyDoncaster: In November 1970, officials in Oregon, USA decided to blow up a rotting whale carcass. The whole thing went horribly wrong…",2020-04-07 12:19:50,"Eh ayun. 

Easy to please, medyo hard to get.

Natural flirt. Oh ha."
1247499331969548288,"Gordon Brown 
calls for global government 
to tackle coronavirus

https://t.co/1g14IjpuhD",2020-04-07 12:19:52,#linux @eff #btc #musicproduction #vintagesynth #savethebees
1247499897726697472,Democrats struggle to keep up with Trump messaging on coronavirus https://t.co/rrPe95U7pU https://t.co/njW631mVth,2020-04-07 12:22:07,"The Hill is the premier source for policy and political news. Follow for tweets on what's happening in Washington, breaking news and retweets of our reporters."
1247504289112694785,RT @RaniaKhalek: Holy shit this is a disaster https://t.co/VWYEAimzoV,2020-04-07 12:39:34,I probably speak up far too often but I was silent for far too long. #BlackLivesMatter ❤️✊🏿❤️
1247504268279586816,Kimda like your dear old song bird dad https://t.co/QExINjBG1N,2020-04-07 12:39:29,#fishon
1247499591445929984,"RT @MayoClinic: To develop a treatment for patients with #COVID19, researchers around the world are steadfastly exploring numerous angles,…",2020-04-07 12:20:54,Student • Freedom - the opportunity to be what we never thought we would be • ❤️P Trump's stance #FakeNews. Hardcore supporter of RY ❤️🇨🇳
1247499402819694593,"RT @MoHFW_INDIA: #IndiaFightsCorona: 

Let's salute our medical and paramedical staff, who stay out of home so that we #StaySafe at home.…",2020-04-07 12:20:09,
1247499901899927552,"RT @dhruv_rathee: 🇳🇿 Health Minister of New Zealand broke lockdown rules. To punish him, the prime minister demoted him to bottommost rank…",2020-04-07 12:22:08,
1247499407265804288,"RT @ezralevant: Please join me in giving a hearty Justin Trudeau welcome to XiamenAir flight 805, en route from China to Vancouver! No feve…",2020-04-07 12:20:10,"United we are strong. Love God & each other. 
Globalism is EVIL.
Turn off MSM/HOLLYWOOD PROPAGANDA 
Turn on to non bias Independent Citizen Journalists. 🙏💕🙏"
1247499302253015042,"RT @HannahLebovits: Husband just told me, “watching the federal government deal with COVID-19 is like watching the Ministry of Magic deal w…",2020-04-07 12:19:45,
1247499541407883273,"1st COVID19 case in the PH (1/30/20) was the same time I developed sore throat, unproductive cough and fever. So PU… https://t.co/taz2geONuI",2020-04-07 12:20:42,AA 🟣 DLSU BIO 🟣 OLFU MED 🟣 PGI VMMC 🟣 Slide my CC for Questions #MedTwitterPH #PLE2020 BRB!!! ❤️
1247499385845538817,"RT @Weiss_Cordula: Easter triangle! 
#triangletuesday 
#Easter
#EasterHolidays 
#StayHome 
#workingfromhome 
#mathsathome
@mathsweek @RTEjr…",2020-04-07 12:20:05,We support the professional development needs of our local and regional educational communities. Director Lorraine O’Gorman. Registered Charity No. 20065232
1247504260247453703,"RT @CanadaOSC: This week’s OSC update on COVID-19 measures provides an overview of our new platform for virtual connectivity, information o…",2020-04-07 12:39:27,"We help organizations collect, organize, and apply data to drive growth, operate efficiently, and engage with customers.  #T4GLtd"
