id,tweet,time,description
1247505417179213824,RT @jonathanvswan: Navarro's Jan 29 memo — distributed around the White House and administration by the National Security Council — estimat…,2020-04-07 12:44:03,
1247505153651085312,The Journalists Changing Roles During the Coronavirus Outbreak https://t.co/x9gJUBp5Rq,2020-04-07 12:43:00,"Official Twitter account of the News Media Alliance, sharing news, trends & information from and about the  media industry."
1247505450968518656,RT @BenjaminPDixon: Imagine if the Democratic Establishment opposed Donald Trump’s mishandling of this pandemic with the same energy they o…,2020-04-07 12:44:11,The most on-message cynical political pessimist.
1247505530656034817,"This pandemic has messed up with my schedule. I used to be most productive in the afternoons, and little in the mor… https://t.co/3mdigs6fmb",2020-04-07 12:44:30,"Interests: trophic ecology, conservation, feline ecology, & more. | She/Her | Providing biology consulting for #ttrpgs & #videogames"
1247505186781663232,"That's 2.7%  , applying the same paradigm to only the population of #Delhi &amp; #Mumbai you get an estimated 1.62Mn… https://t.co/UMPf4BD0cE",2020-04-07 12:43:08,"#Indian National interest above religion, caste or creed ! #infrastructure ,#defence ,#renewables , #geopolitics #military 
blog at http://bengalraider.blogspot"
1247505291907923968,RT @RealMattCouch: BREAKING: A Potential Coronavirus Vaccine Funded by Bill Gates will begin testing on healthy people today in Kansas City…,2020-04-07 12:43:33,
1247505442818928647,RT @globalnews: A Winnipeg dad has taken Justin Trudeau’s message to kids about the COVID-19 pandemic and turned it into a Lego version for…,2020-04-07 12:44:09,"Human Being, Woman, Mother, Avid Reader, Practicing Writer, Film Buff, Homeschooled Pastry Chef, Associate Prof. Queen's Uni, AMS Phoenix Fellow, #CinnaQueen"
1247505128174780416,Just when you think they're going down... https://t.co/rXTiEcSlz8,2020-04-07 12:42:54,Be happy life is too short to be anything else.  Love the Greek Islands.  Cote de Pablo and Tiva from the golden days of #NCIS.  Big believer in destiny
1247505408828346368,"RT @brittniocean: From coin bag to weed bag and now, Corona mask: how the crown Royal bag has shaped the black community.",2020-04-07 12:44:01,"• me, all ways, always | جميلة • brow magician✨babe with the power •"
1247505539074011136,RT @DesignationSix: Fox News is officially being sued for peddling coronavirus misinformation https://t.co/1GXmCGn1jS,2020-04-07 12:44:32,Author of Time X 2. https://t.co/VHW54NLoBJ
