id,tweet,time,description
1251851161046593537,"RT @ANI: All the 186 COVID19 positive cases that were reported yesterday were asymptomatic, they didn’t know they had Coronavirus. This is…",2020-04-19 12:32:29,"Be positive about yourself......Die  Hard fan Hrx
❤️looking for opportunities ❤️"
1251856399316865026,"PM Modi says ""COVID-19 brought disruptions, home is new office, breaks with colleagues are history""… https://t.co/csFEb43JAE",2020-04-19 12:53:18,सर्वधर्म समभाव। वसुधैव कुटुम्बकम। अहिंसा परमोधर्मः।
1251856206672642050,"This is a tough read but a very important piece of journalism. Well done @Newsday 

I’m sure #GeorgeHarrson (RIP) a… https://t.co/ovU512G4Mt",2020-04-19 12:52:32,I'm the Consumer Investigations & Technology Reporter at News 12 Long Island. Don't forget to follow my tech report updates on @TheDownload.
1251856324620505088,"RT @gortok: Gotta say, I'm completely here for unfollowing people who want to undermine the seriousness of a pandemic.",2020-04-19 12:53:00,
1251856563498651648,"RT @BernieSanders: It's an outrage Trump blocked an agreement to save the Postal Service. If we can bail out large corporations, we can dam…",2020-04-19 12:53:57,"From Kathmandu To Chicago... 💉👨🏻‍⚕️🥼
learn to see life as it is No Right or Wrong neither Good Or Bad. Just look at it with awe there you'll find true Peace"
1251856739378462722,Plz stay home stay safe https://t.co/UIzSd0cruW,2020-04-19 12:54:39,"जय हरि ॐ 🚩 
selfish people stay away from me
वन्दे गौ मातरम्"
1251856450193960960,"COVID-19 LAGOS:
The use of Medical Ambulance in transporting electronics instead of medical concern to Saka Tinubu… https://t.co/j8n7JFiBQU",2020-04-19 12:53:30,"I am a UN Peace Ambassador, Journalist & Artiste who is passionate about World Peace, Collective Security System & Pacific Settlement of International Disputes"
1251856232115298304,"RT @babiegulf: there are two kinds of people:

1. mild who wears mask &amp; is practicing proper social distancing ☺️
2. mewgulf who share the…",2020-04-19 12:52:38,"EXO,Waanjai ,PrukSup ,BrightWin





TheElyxiondot :18/07/13


EXpℓOrationDot :19/12/29 19/12/30,19/12/31"
1251856530363858945,"RT @ladbible: ""Just because we're in a lockdown, doesn't mean you don't take care of yourself"" - this woman's makeup tutorial with her husb…",2020-04-19 12:53:49,"Kath. Theologin/Pastoralreferentin auf Schatzsuche in 💒, 🌳🌲🌳 und 🌍. Im 💕 für immer Urlauber- & Internetseelsorge. #TeamDrosten. No 💩fD!"
1251856744235532296,"@realDonaldTrump According to one study, the type of mask you wear can make a difference in how effective they are… https://t.co/NZdfkJHuIZ",2020-04-19 12:54:40,"In pursuit of truth, liberty, and justice!"
1251856114582466562,"RT @DrDenaGrayson: March 6: “Anybody that needs a test gets a test.” @realDonaldTrump 

April 16: only 3.4 million #coronavirus tests have…",2020-04-19 12:52:10,"Wife, mother, atty, nurse, Hillary voter. Distressed by Trump's belief that he's above the law & ethical bx doesn't apply to him. #TrumpisaWhiteSupremacist #BLM"
1251856710777462784,RT @ashoswai: Modi posts this message in LinkedIn while his health Ministry Continues to repeatedly blame #TableeghJamaat for the #CoronaVi…,2020-04-19 12:54:32,
1251856055417532419,RT @Meez_Tweets: Introverts after the lockdown,2020-04-19 12:51:56,
1251856479306625032,HER NAME IS ACTUALLY KAREN!!!!!! https://t.co/WVvCGxp8t5,2020-04-19 12:53:37,Catholic convert from Mormonism. Trad-Vat2er. Hoping someone lets me help draft the 'Penal Statutes of the Empire of Guadalupe.'
1251856651394732033,Religion has grown from people finding creative ways to practice their faith with others of similar belief. It woul… https://t.co/kOxMiR2kWc,2020-04-19 12:54:18,"Free spirit ,yellow dog Texas ex ."
1251856714225180672,"RT @RBReich: So let me get this straight: Jeff Bezos has grown his fortune by $24,000,000,000 during this pandemic, but he still can't affo…",2020-04-19 12:54:33,"Director of Laboratory Services, 
Society for Health Education"
1251856727206768646,RT @CooperativeBank: ⚠️ Fraudsters are using #coronavirus as a way of pretending to pose as genuine organisations that they know people loo…,2020-04-19 12:54:36,"Lay Canon, risk & fraud; charity trustee; ethics & equality; children’s work; cathedrals; choral music; countryside; food & wine; Cotswolds; liberal Anglican."
1251856614329585664,"Make i just meet @Mazigburugburu1 after this lockdown is part of my wish list 🙏 @bimbo_cash please, that's my request aunty mi.",2020-04-19 12:54:09,"I love Tech, Travel, Politics & Good Governance, FC Barcelona https://t.co/2VaztH8f69 😊 ifb"
1251856605617909760,RT @sanjayjavin: #BiharFightsCorona  second update of the day.2 more covid-19 positive cases in bihar taking the total to 89. 1-male 30 yea…,2020-04-19 12:54:07,
1251856744143179776,RT @Thomas1774Paine: A Montana based physician has blown the whistle on how the CDC is exaggerating the COVID-19 death toll by manipulating…,2020-04-19 12:54:40,.
1251856550500630528,RT @mattzarb: Going on about “herd immunity” being the “strategy” early on looks increasingly like it was an elaborate attempt to spin the…,2020-04-19 12:53:54,Welwyn & Hatfield Keep Our NHS Public Branch
1251856127295459328,"RT @soapachu: ""The curve is flattening; we can end lockdown now""

=

""This parachute has slowed my rate of descent; I can take it off now""",2020-04-19 12:52:13,20 | fake gamer + even faker twitch streamer | choc pretzel enthusiast | she/her
1251856332505993216,The latest Special K!! https://t.co/iUwO9jpFtz #covid19,2020-04-19 12:53:02,"Vice President, Customer Operations and Planning"
1251856668939321344,"RT @glennkirschner2: Trump is encouraging people to do things that will 1. put their health at risk, 2. put the health of others at risk an…",2020-04-19 12:54:22,"Writer, high-tech thrillers.  Political progressive. #MeTooSurvivor. Dog lover. Oregon Ducks fan."
1251856119460515840,"Lovely Designed picture of Jonson Clarke-Harris there in the Blue and White quarters of Bristol Rovers 🔵⚪️

One of… https://t.co/faCcfwqJXM",2020-04-19 12:52:11,"plays for Spartans FC 💛🖤
Pirate Pundit ☠️
Bristol Rovers 
#UTS
#SpartansFC 
#BRFC 
#UTG"
1251856131938488320,"RT @G_TheOriginal: Retweet if you believe Dems in state &amp; local government are using this 🦠 pandemic to increase their own power!

* I foll…",2020-04-19 12:52:14,
1251856127589068807,Stay ya dumb ass HOME https://t.co/Xc8947H16Y,2020-04-19 12:52:13,"Don’t wurr bout me, ima thug. hoes green like that Zoe"
1251856311983243266,Big yikes https://t.co/65Y3Zc5oWy,2020-04-19 12:52:57,"🐺
Actual Daddy"
1251856538869698560,RT @gmanews: Sotto wants names of COVID-19 cash grant beneficiaries published https://t.co/D5iCHesbz3,2020-04-19 12:53:51,The right to write..Exercising the right to express freedom....
1251856228525002752,"RT @Reuters: Irish unlikely to see packed pubs, big gatherings soon: minister https://t.co/jy988X2ity https://t.co/fZH9za4b0w",2020-04-19 12:52:37,
1251856186015711232,RT @maya206: Important advice that should have come much earlier. Propagandist foot soldiers of the PM’s own party and in the broadcast med…,2020-04-19 12:52:27,Is this where you escape reality?
1251856345244065793,"RT @HackneyCit: Please donate to East London local organisations who are directly helping those who are elderly/vulnerable, have lost their…",2020-04-19 12:53:05,"Alliance of local Community Organising groups in Tower Hamlets, Developing Leaders, Building Power, Changing Neighbourhoods. #THCitizens #PeoplePowerPolitics"
1251856597279801345,"RT @tedcruz: Clearly, the greatest public- heath threat imaginable...a kid on a skateboard.  Young people, remember, this is what Big-gover…",2020-04-19 12:54:05,I'm only here to show my support to US President Donald Trump #ChildTrafficking #SethRich #Flynn #DrainTheSwamp💥TRUMP 2020💥 🇳🇴🇺🇸 fb patriots
1251856261588582401,RT @GerardBattenUK: Yup! We are all in lockdown but that mustn’t interfere with open borders &amp; the importation of cheap labour. As usual th…,2020-04-19 12:52:45,Love my country.
1251856185701081094,"RT @LotusOak2: Dr. Stephen Smith, an infectious disease specialist, on using hydroxychloroquine/azithromycin combo to treat #COVID19 patien…",2020-04-19 12:52:27,"Christian. Conservative. Freedom-lover. #MAGA, pro Trump, Texan (upside down flag signals distress)"
1251856122958557185,RT @VirginiaBloom9: Important read and ad https://t.co/AKLbOw1TTC,2020-04-19 12:52:12,"Political junkie. Writer. Dancer. CEO of LLC, ‘Journey into Wholeness’. Offering Core Self Attunement sessions. https://t.co/do2gFIQrTp. #BidenHarris2020"
1251856362231005185,"RT @ConnieSchultz: Sure. These protesters just want to go back to work.

This thread.",2020-04-19 12:53:09,
1251856253002883073,I miss going to places! I want to go to the zoo! #IsolationLife #APRIL #coronavirus #lockdown https://t.co/qny8DWnNfo,2020-04-19 12:52:43,Amazon bestselling author. Author of ‘The Lost Magdalene Girl’ ‘Titanic 2’ and ‘Magdalene survivor’  Check out my books here. https://t.co/AwFzDx4ICJ
1251856563171733504,"RT @genaLthomas: If you've got kids between 3 and 10, looking for resources on how to talk to them about #COVID19 check out my children's b…",2020-04-19 12:53:57,"I write children’s books that adults need too. #ColorFull #ThoughtFull #GraceFull. Wife @gdk_Chris, mom x4. First Lady @StrongTowerBC. Agent: @DavidMSchroeder"
1251856656020852742,"RT @Timcast: Interesting view of how government should act in the replies here

Should people be forced to stay home

Or should you choose…",2020-04-19 12:54:19,"Teardrop traveler, filmmaker, forester, husband and vizsla dad."
1251856416350109697,"RT @LOLGOP: In addition to showing polls that show that the vast majority of Americans think stay-at-home measures are very good, please sh…",2020-04-19 12:53:22,"Pizza Expert, Software Developer"
1251856517210550275,RT @AlexandraChalup: Who is funding all of the “operation gridlock” protests that started in Michigan and “spread like fire” to other state…,2020-04-19 12:53:46,
1251856538198855682,"RT @ANI: #COVID19 does not see race, religion, colour, caste, creed, language or borders before striking. Our response and conduct thereaft…",2020-04-19 12:53:51,
1251856089957625857,"RT @bennyjohnson: California is filling their skate parks with sand to make them unusable amid mandated lockdown.

There is no scientific o…",2020-04-19 12:52:04,
1251856168697413633,"RT @wesstreeting: I can’t think of a single Prime Minister, Labour or Conservative, who would show the same lack of commitment to the job a…",2020-04-19 12:52:23,"One of the good guys just want to help the world.

Oh and just love Jamaica."
