id,tweet,time,description
1286156376746553345,"RT @UNICEF: COVID-19 has profoundly impacted young people around the world. Despite the challenges, they are determined to create lasting c…",2020-07-23 04:29:10,"𝓦𝓱𝓮𝓽𝓱𝓮𝓻 𝔂𝓸𝓾 𝔀𝓪𝓷𝓽 𝓲𝓽 𝓸𝓻 𝓷𝓸𝓽, 𝓘’𝓶 𝓰𝓸𝓲𝓷𝓰 𝓽𝓸 𝓱𝓸𝓵𝓭 𝓸𝓷𝓽𝓸 𝔂𝓸𝓾.                              


- 𝓞𝓷𝓵𝔂 𝓽𝓱𝓮𝓷"
1286156754049552384,"RT @afneil: Subs revenue is steady, strong and surging. It now accounts for over 75% of total revenues, soon to be over 80%. The lockdown c…",2020-07-23 04:30:40,
1286156259092074496,"RT @jakpost: Disrupted, anxious, worried: Indonesian children speak up about their pandemic experience #jakpost https://t.co/7eEyMyhIPm",2020-07-23 04:28:42,"Astrid. 38. She/her.

Fangirling Sociologist."
1286156457403187200,RT @0xAFAEBABE: can’t wait to read this headline like it’s brand new every month for the next two years,2020-07-23 04:29:29,brain go
1286156800136548354,@ndtv This is what peak boredom looks like. Corona made people both jobless and senseless.,2020-07-23 04:30:51,"Doing what social media was meant for. Gaining information and ranting non sense. If wondering about my political alignment, then you should find a real job!"
1286156202846519296,RT @AmberlyJAustin: My Mom is in the hospital with difficulty breathing low heart rate and low blood pressure... she will be 80 this week.…,2020-07-23 04:28:29,"Retired grandma, cancer survivor!
 No DM's l, unless you want to be ignored."
1286156862468042754,"Donald J. Trump: Coronavirus hospital data should be reported to the CDC, not the Trump administration - Sign the P… https://t.co/q8hdfNdMey",2020-07-23 04:31:06,
1286156411609604096,RT @axios: The net approval rating for Texas Gov. Greg Abbott has dropped 21 points since early June. https://t.co/ngMoolgvw4,2020-07-23 04:29:18,#TheResistance Progressive. Democrat. Retired. I tweet sports @LionTigerPiston
1286156709971533830,"RT @DavidBroderDO: Cabbage could help fight coronavirus, study finds. Nutrition may play a role in the immune defense against COVID-19.

Pe…",2020-07-23 04:30:29,I'm interested in wellness and healthy living!  I enjoy discussing with people about the many different ways they can live healthier lives.
1286156361101844480,RT @inquisitiveSile: Maybe that wood will help the funeral pyre of the government hidden corona deaths!,2020-07-23 04:29:06,
1286156789914820609,What movie were you guys hoping to see in theaters this year before COVID became rampant?,2020-07-23 04:30:49,"I’m Leo, welcome! | 16 | Male | Guitarist in the works | My acc is mostly just thoughts I have atm."
1286156641755308033,"RT @ManishTewari: 1. Why did Chinese invade India?

2. Why is disengagement now stalled ?

Is it some personal ‘commitments’ made to China…",2020-07-23 04:30:13,Student 👨‍🎓
1286156521257172992,"RT @Smackenziekerr: - BIGPHARMA IS HOLDING THE WORLD AT RANSOM

https://t.co/7O8tmf22BN",2020-07-23 04:29:44,
1286156198014865408,RT @BrettMau5_: It’s disgusting that these teens don’t care that there’s a PANDEMIC going on and they’re having a pool party!! https://t.co…,2020-07-23 04:28:27,Slight NSFW | kpop | mxtx | zhenhun | good omens
1286156494015102976,"RT @existentialcoms: This is one of the most bizarre, dystopia articles I've seen, as Bloomberg cartoonishly tries to paint Chinese hackers…",2020-07-23 04:29:38,"he/him
drop all nazis in the sea
usernames with more than 4 numbers at the end will be blocked as a matter of course"
1286156543680028672,RT @brandonkscott: Dusty Baker said Astros head athletic trainer Jeremiah Randall checked to see if players were in close contact with Roya…,2020-07-23 04:29:50,Has covered the NFL for the Houston Chronicle for 45 years. Can be heard on Sports Radio 610 in Houston and 104.5 The Zone in Nashville.
1286156664886792195,"RT @barkhad: Man sells cow, his only source of income, to raise Rs. 6000 needed to buy a smartphone for his children to continue studying…",2020-07-23 04:30:19,
1286156191123542016,Welcome all to Morning Devotion Program with Host Rev Esther Kennedy and Bishop Kennedy Nyarieko every Tuesday to F… https://t.co/x9VWV4gwZl,2020-07-23 04:28:26,"Bishop Esther Kennedy serves the LORD as the co-Pastor of Deliverance Church Int'l Kisii, ordained minister, psychology Counselor and married to Bsp Kennedy."
1286156839571185667,RT @Back_dafucup: Remember when a bunch of rednecks stormed government buildings with AR-15s and other tiny penis compensators over reopeni…,2020-07-23 04:31:00,"Veronica Mars movie got me on here finally. Music is my life, other than Star Trek and football and chocolate and kitties and..."
1286156244538003456,"@VictorBeQueen @ItsASheThIngTV I’m so excited! Between this and P-Valley, at least there is something new to watch during this pandemic",2020-07-23 04:28:38,"| Mary J. Petty | 1/3 of the Petty, Shady & Messy crew| Fried Chicken Expert"
1286156648579399682,RT @glugler: Lock down kuth 💪🏿🍆🍑😍👌🏿 Follow me for more https://t.co/HFpunKKCjX,2020-07-23 04:30:15,
1286156757329416194,"@WideEye_Will @farhanmohamed now now,... THIS IS a mindfuck.

https://t.co/b3oQOHTceF https://t.co/PZSXMDH2tH",2020-07-23 04:30:41,Songwriter SOCAN MEMBER 	1030237
1286156351400484866,"RT @MSNBC: Rep. Waters on Pres. Trump's coronavirus response: ""It's absolutely unbelievable that the president in face of the facts that ar…",2020-07-23 04:29:04,
1286156278130237440,RT @gwallamagic: God please be with them boys .,2020-07-23 04:28:46,
1286156099234791424,RT @gwallamagic: God please be with them boys .,2020-07-23 04:28:04,
1286156899214336000,"RT @SantaInc: Trump: [cures breast cancer by banning mammograms]
#COVIDIOT",2020-07-23 04:31:15,Patois Extraordinaire. River Worshipper. Roti Rebel. Sweet Smile Supplier. PWIW (Proud West Indian Woman). Believer in Dreams.  CashApp: $Ysy876
1286156585958436864,"A massive 60-foot robot ""Gundam"" continues construction in Japan, despite the COVID-19 crisis. 😄
https://t.co/dzoOqNW4EK",2020-07-23 04:30:00,"Interesting Engineering is a cutting edge, leading community designed for all lovers of #engineering, #technology and #science"
1286156148371066881,RT @jsolomonReports: Hypocrisy? D.C. mayor exempts many city and federal government workers from strict new mask order on citizens | Just T…,2020-07-23 04:28:16,"Conservative Republican, Retired Texas Police Officer of 34 years, NRA Endowment Life Member, Pro Gun & Pro 2a
oppose decriminalization of controlled substances"
1286157708199174145,RT @lunch_enjoyer: every time I see his pig face I imagine launching a roman candle at it until he looks like skeletor. it is not illegal t…,2020-07-23 04:34:27,"they/them, left politics and gender stuff, occasional nsfw favs/rts so 🔞"
1286157796682027008,@KapilSharmaK9 kapil we miss u badly... we need to increase  our immunity power to fight  against  corona.. you kno… https://t.co/KPOr31gxBH,2020-07-23 04:34:49,"I shall pass through the world, but once. If therefore, there be any kindness I can show or any good thing I can do ,let me do it now; let me not defer or negle"
1286157549323071489,"RT @SteveRustad1: Trump's thugs aren't legitimate law enforcement.

They're not soldiers defending America.

They're fascist secret police…",2020-07-23 04:33:50,"UJED FECA Graduate. Toronto Raptors, Leafs and TFC Fan, SF 49ers, Boston Red Sox fan. Songwriter, Soccer and Basketball player 🙊"
1286157489776590848,"RT @KonathamDileep: Rarely do we see leaders with knowledge, compassion, &amp; humility like @KTRTRS. Amid pandemic, his relentless work touche…",2020-07-23 04:33:35,President TRS Switzerland / NGO / Social Service /(Views personal & RTs no endorsement). Director - GS-Software Solutions
1286157221806477313,RT @KevinPoe11: the US is facing a homelessness crisis in the middle of a pandemic and the richest man in the world just made enough money…,2020-07-23 04:32:31,i’m stoked
1286157374231846912,Clubs visitor tests positive for COVID; South Coast hospitals restrict patient visitation https://t.co/75294ZQaJp,2020-07-23 04:33:08,Welcome to the official Twitter account of the Bega District News! Informing the community since 1864.
1286157410441269248,RT @kevincorke: #NEW Sources say #Commerce Secretary #WilburRoss was hospitalized Friday night. Sources say he was not feeling well. Source…,2020-07-23 04:33:16,
1286157687441563648,@Seser_yyc's account is temporarily unavailable because it violates the Twitter Media Policy. Learn more.,2020-07-23 04:34:22,@Seser_yyc's account is temporarily unavailable because it violates the Twitter Media Policy. Learn more.
1286157545418104832,"RT @middleageriot: At a press conference Donald Trump sent well wishes to jailed child trafficker Ghislaine Maxwell, which is more than he…",2020-07-23 04:33:49,💙💙💙💙💙🐶
1286156931145465856,“The case numbers are going to get to a point where our ability to reduce them is totally compromised. And there wi… https://t.co/UwtGuF97O6,2020-07-23 04:31:22,"U.S. President Joe B I D E N
BANNON/TRUMP/KOCH broke government.
Trump Insurrection(s) 
Impeached for inciting an insurrection.


US Congress 202-224-3121"
1286157563105431552,RT @azjd: Quote all the statistics you want about the #COVID19 death rate. The only one that matters is that 100% of those lost are loved.…,2020-07-23 04:33:53,"Mom, musician, life-long learner, gifted advocate. So little time, too many things to discover."
1286157592230793217,RT @DanRather: I desperately hope we get a vaccine. I desperately hope we get better therapeutics. But all you have to do is look around at…,2020-07-23 04:34:00,@CTXMBBALL 6’8” forward 🇨🇴🇨🇷
1286157436425056264,I am HYPED!!! I am now represented in my district by two black socialist reps at Senate AND Assembly level - one a… https://t.co/RIKg7eHySs,2020-07-23 04:33:23,"Green New Deal, renewable energy, indigenous peoples rights, cooperative economy, UK Labour Party, DSA, Co-Chair of Momentum NCG"
1286157057788383237,"Please COVID go away.... I wanna meet my online friends :((

SB19 RTStreamParty
@SB19Official
#SB191stAlbumD8",2020-07-23 04:31:52,"Together, WE GO UP! 
FAN ACCOUNT for (OT5) @SB19Official | @imszmc's hotdog | Always do you, you are what you think, so think, believe. | 1/5"
1286157469157294081,RT @CoreyRForrester: That was my publicist in England. She also taught me how to Twitter. What is this?,2020-07-23 04:33:30,"#ZeroCovid ↘
ı ɹǝsdǝɔʇ ǝʌǝɹʎqopʎ ǝxɔǝdʇ ʇɥǝʎ ɐɟɟǝɔʇ ʇɥǝ ɟɹǝǝpoɯ oɟ oʇɥǝɹs

#UniversalBasicIncome #GlobalDebtRelief 🌍 #1World1Love

ⒸⓇⒺⒶⓉⒺ ⒶⓃ ⒶⒸⒸⓄⓊⓃⓉ ⒾⓃ ⓂⓎ ⒼⒶⓂⒺ"
1286157740876926976,"RT @ttommyunger: Florida Cooked The COVID-19 Books, Now State Is Up In Flames https://t.co/ufyMl6x8QB",2020-07-23 04:34:35,🥶The Return of Big Non-Chalant🥶
1286157337657511943,RT @BrettMau5_: It’s disgusting that these teens don’t care that there’s a PANDEMIC going on and they’re having a pool party!! https://t.co…,2020-07-23 04:32:59,"todo tiene su tiempo, y todo lo que se quiere debajo del cielo tiene se hora"
1286157023281782788,"@Bishalsha49q @ANI Right...and Social distancing, Precaution are also in Govt control...chutiyo ki trh bina Mask ke… https://t.co/Gm8LSeSsF2",2020-07-23 04:31:44,
1286157181109317633,RT @stilllinIove: i wish we could go back to 2012 when the only pandemic we had was one direction infection,2020-07-23 04:32:22,soi un poko d todo pero nosoi parte dw nada
1286157003853684737,BBC News - India coronavirus: Online classes expose extent of digital divide https://t.co/yQ5zipbdYf,2020-07-23 04:31:40,
1286157595766554624,RT @atrupar: This is the key statistic https://t.co/qL3StxlVnQ,2020-07-23 04:34:01,
1286157706185695235,"@KapilSharmaK9 MR KS, WE DON'T KNO WHEN VACCINE FOR COVID19 WILL COME, BUT INDIA NEED UR SHOW BADLY, UR ALSO ONE TY… https://t.co/Vi9EYZjiyL",2020-07-23 04:34:27,fear god  nd lov his creation.
1286157107990007809,"RT @NYDailyNews: Only 10% of Americans want schools to reopen without restrictions, according to a poll. 

https://t.co/hRFyDzzcBT",2020-07-23 04:32:04,"Ex-Navy, love Women and my Country. 6'1 205 pounds,Exotic Hispanic-mixed, BIG Dimples,  in Manhattan, NYC!...AMOR."
1286157397711450114,RT @BrettMau5_: It’s disgusting that these teens don’t care that there’s a PANDEMIC going on and they’re having a pool party!! https://t.co…,2020-07-23 04:33:13,"Hiii, I'm Cherry :) I do art things. I do fitness things. I do Twitch things. ALL THE THINGSSSS. ALL OF EM! ✨🚨COMMISSIONS ARE CURRENTLY OPEN! DM for Info. 🚨✨"
1286157499230560257,RT @kxtysboy_: Katy Perry serving visuals during a pandemic (Chapter 9173947) https://t.co/Mhxvxul4cT,2020-07-23 04:33:38,01/06/18 @katyperry gave me her hand 👁️ You don't have to feel like a waste of space you're original cannot be replaced 🎆 'cause baby you're a firework
1286157172385218561,RT @realDailyWire: ‘Hell No!’: Ted Cruz Holds Firm Against Senate GOP Leadership Over $1 Trillion Coronavirus Relief Package https://t.co/1…,2020-07-23 04:32:20,“A wise man can learn more from a foolish question than a fool can lean from a wise answer”
1286157486249123841,"RT @YooMiley: “I’ll wear a mask in the store, but I’m not following them arrows” 💀",2020-07-23 04:33:35,"#CaminoGang El Camino Media Group Artist, CMO, ""Checc Up"" & “Marathon” streaming on all major platforms now. #FreeLunchFridays on YouTube. Pinned tweet below."
1286157096258600967,"RT @WHRapidResponse: Redfield: “It’s not public health vs. opening the schools or the economy, it’s public health vs. public health. I thin…",2020-07-23 04:32:02,"Support 1A and 2A. Will continue to call out the MSM which has lost all pretense of objectivity and fairness. Attorney (conservative), dog lover + CFB"
1286157557229400064,RT @axios: The net approval rating for Texas Gov. Greg Abbott has dropped 21 points since early June. https://t.co/ngMoolgvw4,2020-07-23 04:33:51,Today I will work from early in the morning until late in the evening. I will make many calls and have many meetings.
1286156932961591296,RT @OpIndia_com: Uttar Pradesh: 30-year-old doctor Tufail Ahmed arrested for attempting to rape a coronavirus positive girl in Aligarh http…,2020-07-23 04:31:23,
1286157238017515520,RT @idontgivafahk: Bonding with friends after pandemic is a must.,2020-07-23 04:32:35,"@kidnxt01
wsg bbg ."
1286157195982274561,White House executive office cafeteria closed after positive coronavirus test - NBC News https://t.co/m1M1O6fPmN via @GoogleNews,2020-07-23 04:32:25,A normal guy in a abnormal world
1286157691451310080,RT @markie_kmarky8: @JohnFugelsang America only western country without national health care system and a plan to handle this coronavirus e…,2020-07-23 04:34:23,World's Greatest University at Buffalo Supporter. UB HOF 2008 Read Through a Bull's Eye  All opinions are mine & do not reflect the opinions of any others.
1286156984279072768,"WHO launches Covid-19 law lab for implementing legal frameworks to manage pandemic
1) The covid-19 Law Lab is a dat… https://t.co/KpkuFgskH2",2020-07-23 04:31:35,Content Editor | Music Enthusiast | Market Research
1286157751681298432,@cadria04 When the pandemic started the gov said related costs could reach $5 billion then it was revised to 2.9 bi… https://t.co/7oyVlqawx5,2020-07-23 04:34:38,
1286157436508934146,RT @bocxtop: the person to blame for you working an $11/hr job during a pandemic with no hazard pay isn’t the mother of three getting $600…,2020-07-23 04:33:23,you should check out @riiceboy | Posadist & Christopher Dornerist | He/Him
1286157575663345666,RT @HuXijin_GT: The US has made some preparations for withdrawal from Consulate General in Wuhan. Washington must hope that China will reta…,2020-07-23 04:33:56,"where there's USA where there's a war, where there's a war where there's USA evil hand in background"
1286157368473071617,RT @joshdcaplan: FOX NEWS: Sen. Rand Paul calls for Gov. Andrew Cuomo to be impeached over New York's coronavirus response,2020-07-23 04:33:06,"1st Generation born in Xios,🇬🇷, naturalized citizen. America First! I believe in the Bill of Rights and Constitution. Measly Bachelors in Mathematics."
1286157833755648001,"RT @ben_rosen: ""the government has no business making me wear a mask"" i say before i buckle my seatbelt, drive the speed limit to a restaur…",2020-07-23 04:34:57,"Hi, I'm Shouting Bear! | He/Him/They/Them | 26 | Pan

I'm Turkish & Native American, and my dream is to be an author! I like ffxiv & zeds!

Icon by: @Jinglestan"
1286157276802236416,For a second i thought concepcion was a covid-free place😥😭,2020-07-23 04:32:45,크리스천💫⭐️
1286157075811368962,RT @Yamiche: President Trump again is speaking without health officials and has taken to the podium to brief the country on the coronavirus…,2020-07-23 04:31:57,"Geology, science, perspective, curiosity, integrity, & rigor."
1286157298344189954,"RT @CraigRSawyer: I haven’t vetted this. Does anyone hete have specific knowledge on this on the CDC? If it’s true, which I expect, I want…",2020-07-23 04:32:50,"God, Country, Corps, 17 yr L.E.O, single father of 5 (No lists)#MAGA # BACK THE BLUE # VETS
Followed by Gen Flynn & Fellow Americans"
1286157815128690690,This is badass 😎 I didn’t even know DMX was out of prison #verzuzbattle https://t.co/fmtTdgXsp3,2020-07-23 04:34:53,"American feminist who tells it like it is 😉
Christ above everything! 🙏🏽"
1286157083939766274,Rick Wilson: Trump’s COVID-19 briefing was a ‘success’ only because he ‘didn’t poop his diaper’ - https://t.co/EF90HrdBf7,2020-07-23 04:31:59,
1286157754911133701,RT @ProjectLincoln: How is the follow up question not simply: “what??”,2020-07-23 04:34:39,"Writer of things. Lover of romance. “A gentleman is someone who can play the accordion, but doesn’t."" ~Tom Waits"
1286157657603059712,RT @smitaprakash: There is no success model in the Covid fight. The famed Kerala model has also crumbled. While its prompt response in Apri…,2020-07-23 04:34:15,"fan of Prime Minister modi.. Love him, love him and Love him.."
1286156959356538880,RT @Covir_io: Thanks to Emmanuel Badmus for creating a fantastic video about one articles on Cointelegraph. The article is a result of a co…,2020-07-23 04:31:29,"Compte relais de @bot_africana
""Je comprends maintenant que ce qui nous oppose n’est pas un désaccord d’opinions, mais un désaccord de principes et de valeurs."""
1286156913433075712,"RT @sangerkatz: Since Covid arrived, 179,000 more Americans have died than would in a normal year. https://t.co/el2F4irjhD @DeniseDSLu @jsh…",2020-07-23 04:31:18,Catholic. English teacher. Trying to find his place in His place
1286157176868761600,"RT @atrupar: Trump on lessons he's learned from coronavirus: ""It's highly political, and the Democrats are using it for political reasons .…",2020-07-23 04:32:21,BYEDON🖕🖕🖕🖕My 🧡 Belongs to Brooklyn 💜💜 Radical Liberal Love 🐶 Wear Your Mask ‼️🌵🏜💙💙💙♈️ 😚💨💨
1286157165086928896,"But for real, even the cleanest restaurants are not clean enough for a global pandemic",2020-07-23 04:32:18,2/10 would not recommend (she/her)
1286156954713260033,RT @OpIndia_com: Uttar Pradesh: 30-year-old doctor Tufail Ahmed arrested for attempting to rape a coronavirus positive girl in Aligarh http…,2020-07-23 04:31:28,Chasing away the demons of Hypocrisy...
1286157725856985088,"RT @UNICEF: COVID-19 has profoundly impacted young people around the world. Despite the challenges, they are determined to create lasting c…",2020-07-23 04:34:32,I can be your genie
1286157419421118464,"RT @PostTruthIndia: @Gss_Views @MrRreboot Arey bhai ♥️😇
Thank you everyone!

Mere paas lockdown ki wajah se free time hai warna mai nhi sha…",2020-07-23 04:33:19,"सही दिशा में क़दम, छोटे ही सही पर बदलाव ज़रूर लायेंगे👍
#AAPRevolution  #ArvindKejriwal"
1286157074615939072,"RT @samstein: Trump's election argument appears that despite being president, he bears no responsibility for any racial unrest or covid rel…",2020-07-23 04:31:56,"Eccentric, Eclectic, Writer, USArmy Veteran.  A bit of this and that too.  PLEASE NO LISTS"
1286157592910331904,RT @gwallamagic: God please be with them boys .,2020-07-23 04:34:00,Bella ame’
1286157189233557507,"RT @YaddyMania: E.Ramya Radhika is suffering from Corona in Hyderabad, she is pregnant and her child can only be saved by plasma therapy, a…",2020-07-23 04:32:24,
1286158561572081669,RT @tonyposnanski: Joe Biden could say “Tony Posnanski’s art sucks and he’s a fucking piece of shit.” and I would still walk barefoot throu…,2020-07-23 04:37:51,"Mom, Grandma, animal lover, public servant, democrat, people not corps.Maiden Mother Crone:  been her, being that, am that 🌊🌊🌊  VOTE Blue:  Mother Earth"
1286158085787197441,"RT @DrMercyKorir: #COVID19 no known cure. Don’t expect miracles in hospitals. The best they can do is give oxygen, paracetamol if necessary…",2020-07-23 04:35:57,"Communicator, Sister, Friend and Daughter."
1286157839111774208,RT @benshapiro: There is little to no evidence schools are serious vectors of covid transmission; children are at extraordinarily low risk…,2020-07-23 04:34:59,#NoMask Pro Israel #MAGA Don’t follow stupid rules  6% FFS
1286158662168227845,"RT @unemployaction: #Virginia 
Hundreds of thousands of Virginians have lost jobs because of COVID, and 106,549 more will over the next yea…",2020-07-23 04:38:15,
1286158233724309507,"RT @soefira: First it's CoVid, now it's NoVid",2020-07-23 04:36:33,Seorang pesakit di alam manusia
1286158329811787777,RT @dominicscxtt: no way this was one of my favorite venues 😕,2020-07-23 04:36:56,photographer + artist. 💛 ⠀⠀⠀ ⠀⠀ ⠀⠀⠀ ⠀⠀ ⠀
1286158338380558336,RT @bocxtop: the person to blame for you working an $11/hr job during a pandemic with no hazard pay isn’t the mother of three getting $600…,2020-07-23 04:36:58,Working on it
1286158367090782209,RT @bocxtop: the person to blame for you working an $11/hr job during a pandemic with no hazard pay isn’t the mother of three getting $600…,2020-07-23 04:37:05,
1286158336254074880,"Now, all the staff members of the Chinese Consulate in Houston must be happy: they don't have to worry about living… https://t.co/TDu0BGEErv",2020-07-23 04:36:57,野生大国师
1286158202443366401,"RT @PodSaveAmerica: Person, Woman, Man, Camera, TV, 70,000 COVID Cases Today. https://t.co/74O87vajOd",2020-07-23 04:36:25,"Mom, wife, rage baker, crafter, political junkie-turned-activist ... Native Clevelander trapped in Kansas against my will."
1286158140304576513,"RT @RBReich: The coronavirus stimulus package carved out $135,000,000,000 in tax breaks for millionaires.

That's *three times* as much mon…",2020-07-23 04:36:10,Commenting on B.C. public affairs at https://t.co/j7aSNMoZfA since 2009.
1286158389836275712,"RT @pchemstud: Coughing over trays of liquid nitrogen with and without N95 mask, face shield, and surgical mask. https://t.co/x3Th6kzed2",2020-07-23 04:37:10,
1286158363701714945,RT @AdoptLexiMama: Meet Sweet P who came to my shelter in ‘16 after being dumped. Her body evidenced being used as ‘bait’ for dog fighters.…,2020-07-23 04:37:04,"Polite old school Buddhist fan girl who loves cats, art, music, film, dance, and good tv shows- especially Buffy and The Walking Dead. RT lots of animal posts."
1286158581201375235,RT @Yamiche: President Trump again is speaking without health officials and has taken to the podium to brief the country on the coronavirus…,2020-07-23 04:37:56,I'm here to learn about #smartcontracts and #blockchain.
1286158151843303424,this is heartbreaking 😓 https://t.co/UA9Ro7L3Ki,2020-07-23 04:36:13,I did it my way
1286158564365611008,@thehill @tedcruz I lost money. I was doing better before Trump's refusal to address covid. I was about to be promo… https://t.co/XilYL92iFH,2020-07-23 04:37:52,I ALREADY TOLD YOU! DAMMIT! I'M NOT DEVIN NUNES!!!
1286158028698460163,RT @tedlieu: Dear @KellyannePolls: A reminder that @realDonaldTrump explicitly told governors to open up at a time when no state had met th…,2020-07-23 04:35:44,Not a damn thing makes me special
1286158403451019265,"RT @Sarahjstoll: Rand Paul demanding that Andrew Cuomo be fucking impeached over his handling of covid, is the most absurd and laughable th…",2020-07-23 04:37:13,"Obsessed #Seahawks fan. Pro-Choice, Proud Feminist, #gunsense, #TheResistance, #NeverAgain, #ERANow #CampaignFinanceReform, #TimesUp"
1286157948599717890,RT @_melxc: me once this pandemic is over in 2022 https://t.co/CS0cxRT3b0,2020-07-23 04:35:25,mommy 💖
1286158437735374848,RT @SaraCarterDC: A message approved by the #ChineseCommunistParty,2020-07-23 04:37:21,Director of stop the coup you democommie jackasses🖕
1286158198878208003,"RT @GovSisolak: I wanted to take a moment to remind Nevadans that #COVID19 is still spreading rapidly in our communities, &amp; we must continu…",2020-07-23 04:36:24,"I'm all in 4 🇺🇸, life, liberty, equality, prosperity, security, justice, truth, 💙💜❤, happiness 4🌈ALL🌎.
🔬from1999.
☯️#Vote4Democrats🦋
#Biden2020 #TeamJoe"
1286158409734201344,Very useful set of recommendations https://t.co/nVgxFl0iIc,2020-07-23 04:37:15,Professor of Political Science and Women's and Gender Studies at Rutgers University-Newark. Author of Rethinking Sexual Citizenship
1286158550293716992,"RT @rdsathene: A system where California AG #KamalaHarris helped Steve Mnuchin ""avoid prison time"" for predatory loans and illegal foreclos…",2020-07-23 04:37:48,"'Tis Time my fellow workers,for The General Strike"
