id,tweet,time,description
1282759088430968832,"RT @K_JeanPierre: We are in the middle of a global pandemic. More than 135,000 people in the U.S. have died of #COVID19. Instead of being a…",2020-07-13 19:29:33,
1282758769135374336,"RT @ChrisMurphyCT: Don’t let this feel normal. 

It’s nuclear grade bananas to have White House staff sending reporters opposition research…",2020-07-13 19:28:17,I think I'm pretty great. So. That's it.
1282759083448315911,RT @Lonnie30johnson: All season if I have to wear this @HoustonTexans ‼️ https://t.co/e0YHAPU98i,2020-07-13 19:29:32,Genuine.
1282758836043087872,"RT @bontlenew: today, part of our house burnt down and my dad's car burnt to smithereens 
my mom tested positive for covid-19 and the rest…",2020-07-13 19:28:33,IG _shoki 🏳️‍🌈
1282758707814838273,RT @SteveSchmidtSES: The CEO of American Airlines should ban Ted Cruz from the airline today.  Senators are not above the law or airline po…,2020-07-13 19:28:03,"""When both feet planted firmly..nothing can shake you"""
1282758803742654464,"RT @Renetta_Tull: During the Q&amp;A portion of the ceremony, there was a spirited discussion on the difference between a mentor and a champion…",2020-07-13 19:28:25,he/him. distinguished professor. vice-chair. neuropharmacologist. person who does stuff. dad. goatherd. PEANUT BUTTER. amygdala GRC chair 2021
1282758849892691976,"RT @aroseblush: 🌴  Florida COVID Crisis 🌴

🦠 If you thought yesterday positive new cases was horrific, today Florida is reporting 12,634 ne…",2020-07-13 19:28:36,#PRESIDENTBIDEN #VICEPRESIDENTHARRIS  #ANTITRUMP #HUMANRIGHTS #BLACKLIVESMATTER #WOMENSRIGHTS  #IMPEACHEDTWICE #breathewithme https://t.co/XsZcXjNHqX
1282758651711807496,"RT @Robin_Blue19: Japan has had less than 1000 Covid deaths. It is 12 times more densely populated than the US, and they have more elderly…",2020-07-13 19:27:49,UPRM. Just keep me where the light is.
1282758983829389314,"RT @JoaquinCastrotx: .@SenTedCruz, my dad just tested positive again for COVID after his wife, my stepmom, died last Friday from it.

As yo…",2020-07-13 19:29:08,"Living the good life. Love my family, love animals and want the best for all people and creatures of this world."
1282758848890183682,"RT @JaniceDean: Competent government (!!) after 30,000 deaths in New York State and over 6,000 thousand seniors dead in nursing homes thank…",2020-07-13 19:28:36,Entertainment
1282759091924934656,"RT @CNBCnow: BREAKING: California to close indoor restaurants, movie theaters and bars statewide as coronavirus cases rise
https://t.co/qHU…",2020-07-13 19:29:34,"Tickets | Luxury Suites | Fan Gear | NFL MLB NBA NHL MLS College Football, Basketball | Concerts | Events  #WorkingClass | Tweets are not Buy/Sell Advice"
1282759566267211782,"RT @ShimonPro: During a webinar with Stanford School of Medicine on Monday, Fauci said coronavirus is “clearly the most challenging” public…",2020-07-13 19:31:27,"Wife, mother and fan of sci-fi and fantasy. Lover of diversity, respectful atheist, and human scum. Sender of mail and failure of art. Gen X"
1282760031570587649,RT @joshtpm: there it is. second lockdown. https://t.co/k5sMP0ftsf,2020-07-13 19:33:18,
1282759943209340940,"RT @StevePeers: Brexity folks 2019: bring on no deal, I'll eat grass and karate chop customs forms, kids today have no Blitz spirit

Brexit…",2020-07-13 19:32:57,"#fbpe. Artist - UAL Wimbledon MFA alumnus. Interests - the urban: sculpture, photography. Making the place. Never stop asking WHY? Never stop learning HOW?"
1282759994488881154,"RT @maas_global: Why can you pay for a SUP board with exercise benefits but not a bike? It’s not enough to just talk the talk, we need soci…",2020-07-13 19:33:09,"The leading international Mobility as a Service community | Building an open market in seamless, demand-based travel #MobilityasaService #MaaS"
1282760107210813442,RT @MeghanMcCain: I care very much about preserving and protecting our inalienable rights. Being asked to wear a mask inside a private busi…,2020-07-13 19:33:36,"Eclectic, Complex. Empath with a touch of Psychic ability. Amateur #Artist Novice #Writer #Peace #Animal Activist #Equalityforall #Love @BoyGeorge follows me."
1282759382967685130,"RT @bontlenew: today, part of our house burnt down and my dad's car burnt to smithereens 
my mom tested positive for covid-19 and the rest…",2020-07-13 19:30:44,"You Have My Support ❤️ //
I don't eat cereal. // IG: @/be.kki"
1282759978202341382,"RT @catturd2: I see liberals new thing is to compare cancer and AIDS, etc to the coronavirus. LOL! 

If you compare cancer to a flu-like vi…",2020-07-13 19:33:05,Christian | Conservative | Mom | 🇺🇸 President Trump 🇺🇸 | ❤️ Troops & First Responders | 2A | Grateful for God's abundant blessings! 🙏 | Parler @GwenAnnLane
1282759314629951500,"RT @RebelNewsOnline: #Amazon banned @EzraLevant's new book “China Virus” — so we're printing it ourselves, AND offering an e-book version y…",2020-07-13 19:30:27,
1282759923257036801,"RT @mmpadellan: New York City reported ZERO deaths from COVID-19 in a 24 hour period. 

I'm so proud of my city.",2020-07-13 19:32:52,my wife
1282759893007687681,GREAT https://t.co/pY1YC4LWCW,2020-07-13 19:32:45,
1282759675067404293,"RT @BernieSanders: Trump is finally wearing a mask. Too little too late. 

His refusal to develop national pandemic policy based on science…",2020-07-13 19:31:53,
1282759696940625921,"RT @LiberalFury: THIS IS YOUR DAILY REMINDER THAT GHISLAINE MAXWELL BETTER NOT DIE FROM SUICIDE, COVID, OR ANYTHING ELSE. @FBI",2020-07-13 19:31:58,Sales and investor.
1282759483526127619,"RT @hossehenad: Captured today at 10:45am — @TedCruz on a commercial flight, refusing to wear a mask. https://t.co/h8DM7J4CMi",2020-07-13 19:31:08,🇨🇲
1282759943372845057,"@davidjthunder @micheal_olainn @MaryKenny4 Oh come on ! 

You are choosing to ignore the deaths and many complicati… https://t.co/eGD6JggHr2",2020-07-13 19:32:57,🇮🇪
1282759738258644992,@WalkerBragman And his surrogates and fanboys attacked the Bernie Campaign members for saying that going out to vot… https://t.co/RnJtP5iV7v,2020-07-13 19:32:08,"I do not claim to be objective, subjective, obsessive, abstractive, Coherent, belligerent, Malevolent Nor Benevolent. I merely Am."
1282759351829032965,Brodie!!! #WearAMask https://t.co/v1rEo1N77V,2020-07-13 19:30:36,"Hyperborean King ❄️👑 | Not @jessetyler, despite what your mom thinks | @lin_manuel played a more famous version of me in @HamiltonMusical | #GoCubsGo"
1282759839572275201,@BorisJohnson @AndrzejDuda You look a total prick when you wear a mask Boris!,2020-07-13 19:32:32,
1282759348557684736,"RT @jaydeemorgan: Spoke to @GavLevey, a player and a parent about @AberdeenFC academy's two-pronged education programme during lockdown. Al…",2020-07-13 19:30:35,Married to Lori with 2 Gorgeous Boys Liam&Luke. Work in Ninewells Hospital. Manchester United Fan 🇾🇪❤️ Lead Scout In Dundee/Perthshire for @AberdeenFCYouth
1282759604070428674,"RT @profwolff: Wuhan, China, successfully locked down, reopened. With new infections, locked down again, tested all 11 million residents in…",2020-07-13 19:31:36,Retired former Clinical Psychologist. Always had a consuming interest in understanding human behaviour.
1282759814045630472,What an enticing environment..... not. Got to be mad if you want to be eating in plastic cubicles and served by a l… https://t.co/4k9nAI86Dh,2020-07-13 19:32:26,Evertonian
1282759655098212353,"RT @LAist: All California counties have been ordered to close indoor operations at restaurants, not just those on the state’s monitoring li…",2020-07-13 19:31:48,I speak my mind whether you like it or not.
1282760086167924736,RT @Liezl_vdMerwe: Lessons learned from Parliament during Covid-19: we don’t have to spend gazillions flying MPs to CT weekly. Virtual sitt…,2020-07-13 19:33:31,Pikitup supports health employees-when you wake up work on yourself before working for someone else
1282759454019084290,RT @ABC7: #BREAKING LAUSD superintendent says school year won't start with students in person amid #coronavirus pandemic. WATCH #LIVE https…,2020-07-13 19:31:01,
1282759571111645184,RT @tribelaw: Totally insane. A conspiracy of doctors to exaggerate the pandemic to hurt Trump’s re-election prospects? Talk about paranoid…,2020-07-13 19:31:28,
1282760069151629312,RT @clarencehilljr: Imagine putting kids first,2020-07-13 19:33:27,♊️ | FSU➶
1282759285890592769,RT @BarackObama: Voting by mail shouldn't be a partisan issue––especially during a pandemic. Everybody should be able to request an absente…,2020-07-13 19:30:20,/G\ #PHA #SunbeamLodge#46 #DCB4L #UNC4L
1282759775831416838,"RT @GavinNewsom: NEW: As #COVID19 cases and hospitalizations continue to rise, 30 counties will now be required to CLOSE INDOOR OPERATIONS…",2020-07-13 19:32:17,"Loves humanity, friends n family, animals, nature, music, science, fresh air, sunlight - the simple things in life! #Democrat🙂"
1282759675184734208,"RT @GavinNewsom: NEW: #COVID19 cases continue to spread at alarming rates.
 
CA is now closing indoor operations STATEWIDE for:

-Restauran…",2020-07-13 19:31:53,He/Him | ACAB |Julian Diaz
1282759438802116608,"RT @tedlieu: Over 137,000 Americans have died from #COVID19 in less than five months. Many are seriously ill with debilitating long-term co…",2020-07-13 19:30:57,"Ph.D. in Special Education.  Teacher, educator and teacher educator.  Democrat.  Californian."
1282759649641598979,RT @tribelaw: Yet another great ad from @ProjectLincoln 👇🏼,2020-07-13 19:31:47,
1282759251937517568,"RT @AlexBerenson: Total reported #covid deaths in AZ/FL/TX (60 million people) yesterday: 123. I know, it’s a Sunday, reporting lags. But d…",2020-07-13 19:30:12,"Born in Italy, lived in the USA. Wants death to find him alive."
1282759939635765249,RT @lesleyabravanel: We have no state level leadership. #Florida is fucked. #DeSantisResignNow,2020-07-13 19:32:56,Architect. Genius. Nerd. Mastermind. Producer.
1282759414928285703,there it is. second lockdown. https://t.co/k5sMP0ftsf,2020-07-13 19:30:51,Founder and reigning monarch at TPM. Lapsed historian. Polk Award winner. ✡️
1282759553713496064,"RT @GavinNewsom: NEW: As #COVID19 cases and hospitalizations continue to rise, 30 counties will now be required to CLOSE INDOOR OPERATIONS…",2020-07-13 19:31:24,boo
1282759322976555009,"RT @AlinejadMasih: URGENT: Narges Mohammadi, one of Iran’s tireless human rights activists, is serving a 16-year sentence in Iran’s Zanjan…",2020-07-13 19:30:29,victime #affaireapollonia
1282759972586172416,@Bret_Sears yup the only pandemic is the one they show you on your tv screen,2020-07-13 19:33:04,Seeker of truth
1282759532226076672,"RT @JoshuaPotash: Teachers are expected to handle active shooters, a pandemic, and solve inequality, but we’ll cut their salaries before we…",2020-07-13 19:31:19,
1282759889064914944,.....we knew these would have to close back down. Sigh. We knew. https://t.co/q2v4z3lnGL,2020-07-13 19:32:44,
1282759805816496130,"RT @morethanmySLE: Trump is trying to discredit Dr. Fauci. All Dr. Fauci has done for America is to HELP us during #COVID19 

Raise your ha…",2020-07-13 19:32:24,"Together we can do this #WearAMask few more mo 

Biden & Harris 1/20/22 
Woo hoo ♥
Got rid of Trump!!!


#TrigeminalNeuralgia
#TBI
#PTSD
#BurnSurvivor"
1282760061350285315,RT @Shelltop8: Three workers escape Herefordshire farm at centre of coronavirus outbreak https://t.co/Cg216SEdno,2020-07-13 19:33:25,
1282759998485827584,dummy @gavinnewsom https://t.co/VYtiwyjrwq,2020-07-13 19:33:10,now she in distress
1282760069315207170,The cute doctor who took my blood pressure at the covid testing site today said I had the best blood pressure he sa… https://t.co/wXm6tv4YKN,2020-07-13 19:33:27,"i needed an ""outlet"" she/her"
1282759860787052546,RT @nisegrimm93: This is not OK! We know The Left is coming after our Churches. They say we can’t worship due to COVID yet protesting is al…,2020-07-13 19:32:37,
1282759508813635584,"RT @chuckwoolery: The most outrageous lies are the ones about Covid 19. Everyone is lying. The CDC, Media, Democrats, our Doctors, not all…",2020-07-13 19:31:14,"Husband,father, for life. Evertonian #COYB, NASCAR #TMDNASCAR,Iggles , 420 UA Steamfitter, QM Non sibi sed patriae"
1282759943821680646,"RT @latimes: With the coronavirus death toll in California jumping past 7,000 and cases continuing to surge, more parts of the state are ro…",2020-07-13 19:32:57,
1282759625415233540,Ghana look at your mates https://t.co/YWm16h3bvC,2020-07-13 19:31:41,finder of silver linings | former latchkey kid | moscatopapi | cacti slayer | big enabler
1282759197067706368,Really rather glad you didn't disappear @MichaelRosenYes https://t.co/0vIssiwdmE,2020-07-13 19:29:59,Photography. History. Vegan. Countryside. Green Lefty. BDS. Zero Tolerance of mental health stigma BS. Have some pics https://t.co/pAXpfKsOoa
1282759801685118977,@annaeck73 @JamesKoziar @BonnieGlushon @Intelligene1 @AmoneyResists @w_terrence @realDonaldTrump Simple im not wear… https://t.co/bqc4JfDOQh,2020-07-13 19:32:23,"Knowledge is information that leads to truth!My daddy served in Vietnam,died January 2018 from ALS.Only here for Trump not Humps!
 Trump2020 🇺🇸💪🇺🇸💯 MAGA"
1282759214478364679,RT @brikeilarcnn: The president again saying that more testing equals more cases. He does not understand how testing works. Coronavirus tes…,2020-07-13 19:30:03,"Georgian • State Representative (D-81) • Veteran • Ally for survivors • Help People, Solve Problems, Keep Going • (personal account)"
1282759893871624199,RT @KILLBILLEVOL1: Please watch this!!!! Especially if you’ve tested positive for COVID 19 and have recovered!!!!!! https://t.co/tQ5e19YcDg,2020-07-13 19:32:45,Lyco ‘21 🏀 BLACK LIVES MATTER
1282759183251705857,"@NYGovCuomo Here's some ""science"" for you, Il Duce: if you put 4,600 people with COVID in nursing homes with those… https://t.co/Al2egorlQP",2020-07-13 19:29:56,"#DAYS Fan since Day 1, Love the Braves #ChopOn & KSU Owls #MAGA #FourMoreYears"
1282760003091300354,RT @ScottMStedman: California is shutting down again as cases continue to skyrocket and hospital beds quickly fill up.,2020-07-13 19:33:11,
1282759256052293633,RT @BigChopstick: UMichigan kids fighting off corona like https://t.co/Wvt6ebUHnG,2020-07-13 19:30:13,biggest personality flaw is loving It's a Small World too much • @47 enthusiast • usf '21🤘🏽• she/her
1282759492229189635,"RT @DrEricDing: Best interview all day. If our leadership screwed up PPE so badly, what makes you think they will roll out the vaccine well…",2020-07-13 19:31:10,"When I'm bound for Hell, I'll bring an escort. (Quoted from Stonekettle).  I do denounce white supremacy, and white supremacists. She/her."
1282759717157105664,"RT @CNBC: California to close indoor restaurants, movie theaters and bars statewide as coronavirus cases rise https://t.co/4sSOBaYfp4",2020-07-13 19:32:03,"intersectional artist & activist • brain health coach • photographer • creating, educating, advocating, curating, connecting • my @tickbootcamp episode⤵️"
1282759268962373632,@potus @realdonaldtrump  You are an idiot.  I wish a kiss from a COVID carrier for you.  LOL. https://t.co/X5hJullk8H,2020-07-13 19:30:16,
1282759608423952384,Trump identifies another hoax: The coronavirus https://t.co/OZvvMfWrd1,2020-07-13 19:31:37,"daughter, sister, aunt, brain aneurism survivor, animal & environmental lover, no tolerance for ""idiots"" or ""stupid"" people."
1282759298028916745,"RT @SportsCenter: Russell Westbrook announced on Instagram that he has tested positive for COVID-19.

He says he is feeling well and will j…",2020-07-13 19:30:23,Houston doesn't need TX to be The Gr8t H but TX needs Houston to be a gr8t state! SHSU Rockets Astros Texans Dynamo UH/Rice/TSU/UST NHLHou SaberCats Roughnecks
1282760002625835009,And here is the full commutation order showing *all* elements of Stone's sentence were commuted at Trump's directio… https://t.co/fKqVQcXezU,2020-07-13 19:33:11,"Reporter for @TheNLJ, covering DC courts and the legal side of politics | Formerly @thehill, @gwhatchet | jathomsen@alm.com, DM for Signal"
1282761047208865792,This man is a whole six months preggo and not wearing a mask to protect  that baby?? Smh https://t.co/ghADWXDrWV,2020-07-13 19:37:20,🌺Chi hoot and other such things • former troller
1282760724851261440,"RT @GavinNewsom: NEW: As #COVID19 cases and hospitalizations continue to rise, 30 counties will now be required to CLOSE INDOOR OPERATIONS…",2020-07-13 19:36:04,"I am a diehard resister.  I  aborantly despise Trump.   He is a Nazi of our Country.  I was nice before,  but he is evil and there is no other word for him."
1282760926345781249,"RT @Robin_Blue19: Japan has had less than 1000 Covid deaths. It is 12 times more densely populated than the US, and they have more elderly…",2020-07-13 19:36:52,Antifacist. Abolish the police. Black lives matter. (They/Them)
1282760422123286528,How Trump Is Helping Tycoons Exploit the Pandemic https://t.co/6I4WOcqXHr via @NewYorker,2020-07-13 19:34:51,
1282760455203753984,"RT @duty2warn: Please read and rt this important interview with our founder, Dr. John Gartner: “He's not just delusional. He is not just na…",2020-07-13 19:34:59,"Pro/am dog wrangler, cheese gourmand, grammar grizzly"
1282760426913099776,"RT @rajeshtope11: The current count of COVID19 patients in the state of Maharashtra is 260924. Today,newly 6497 patients have been identifi…",2020-07-13 19:34:52,On twitter only for Shah Rukh Khan Met Shah Rukh Khan on 02-11-2019 woh sirf STAR⭐️nahi Duniya🌎hai meri🥰
1282760874906845191,RT @EndGameWW3: Rolling it back....,2020-07-13 19:36:39,Questioning questionable political and geopolitical events from around the world. OSINT. Moderate & unaffiliated politically. Real time fact checker.
1282761130339794944,"RT @JoshuaPotash: Teachers are expected to handle active shooters, a pandemic, and solve inequality, but we’ll cut their salaries before we…",2020-07-13 19:37:40,MiiMii & Rellii 💍🖤
1282760909300080640,"RT @GeorgeTakei: New rule: If you don’t have a national plan for dealing with Covid-19, you don’t get to weigh in on what local schools sho…",2020-07-13 19:36:47,"Sessile, Filter feeder. Hashtags. #resist, geeky.
#HandMarkedPaperBallots
#VotingistheVaccine
#voteblue #TrumpOwnsEveryDeath
#Warren2020 /draggers blocked"
1282760962747928577,"RT @babimarcolini: Over the past four months, the U.S. has deported almost 40,000 immigrants. Hundreds had Covid-19. @emilykassie and I rep…",2020-07-13 19:37:00,Now @kuow + @reveal investigative fellow. Before @NWPBroadcasting. Rosa Diaz in the streets/Amy Santiago in the tweets. esmy@kuow.org 📩 msg for 📞
1282760732883464199,"RT @RealSteveDorman: My opinion: opening schools in Mobile ALABAMA  ,They say the children won't spead the virus 🐃💩 ,our schools are built…",2020-07-13 19:36:05,https://t.co/GoJgBLqA5j The Single Most Important Thing You Can Do https://t.co/80fONJ2qdk #RollTide🐘 #FinsUp #Titans Gold⭐️Wife #BLM #BVM
1282760623638540289,"RT @RegerResearch: @maggieNYT I’ve had candidates ask me to do some questionable oppo, including a governor who asked me to do oppo on a ju…",2020-07-13 19:35:39,Inside the Dark Art of American Politics -- new podcast about the history and practice of opposition research. Listen and subscribe at Apple Podcasts.
1282760955198427137,RT @JohnMTalmadgeMD: #Presidementia #TrumpDementiaSyndrome #TDS #TrumpKillsUs — Trump is mentally impaired &amp; has lost the ability to reason…,2020-07-13 19:36:58,"MS Psychology, Wife, Goldstar Mother⚓, 
Yoga Enthusiasts, 🌼   mindfulness 🌼, Hillary Clinton✌ #imstillwithher #Resistance 🌊#StrongerTogether -No DM- 🌍 🌻🐞"
1282760795516858369,"RT @JoshuaPotash: Teachers are expected to handle active shooters, a pandemic, and solve inequality, but we’ll cut their salaries before we…",2020-07-13 19:36:20,
1282761060089380864,"Classism is going to play a very major role in whether or not we beat COVID any time soon, &amp; (being political here)… https://t.co/4tsDeCUXgV",2020-07-13 19:37:23,"I watch as if I can't speak & listen as if I can't see. Music lover, piano player, & avid Family Guy fan. Lover of flowers & candles. Army Vet."
1282760439420641280,"California to close indoor restaurants, movie theaters and bars statewide as #coronavirus cases rise… https://t.co/lsZ8P3xjhn",2020-07-13 19:34:55,Receive research report and trading updates by subscribing to our free newsletter https://t.co/fFI7SGSevH
1282760313436332033,"RT @sarahschauer: if you can’t breathe in your mask, like you claim to have a medical condition that compromises your lungs, you shouldn’t…",2020-07-13 19:34:25,✨froshie✨ at drake
1282760786469847041,"RT @JoeBiden: In January, I sounded the alarm regarding COVID-19. 

Over five months later, President Trump still hasn't taken the action n…",2020-07-13 19:36:18,"I am who I am. I like what I like. I love who I love. I do what I want. Get off my back and deal with it. It's my life, not yours."
1282760258197364737,RT @QueeenAve: COVID-19 testing (2020) https://t.co/rLPKqI4Elo,2020-07-13 19:34:12,"Flawed and still worthy 🌺 Lash tech, HMU for specials 💁🏻‍♀️"
1282761058969620481,"RT @bontlenew: today, part of our house burnt down and my dad's car burnt to smithereens 
my mom tested positive for covid-19 and the rest…",2020-07-13 19:37:23,‘Be the reason someone thanks God for you today’. IG: https://t.co/VK2y2aAIaf
1282760430872649729,"RT @NumbersMuncher: Gallup: 72% of adults wear a mask 'always' or 'very often' when outside of the home.

Breakdown by party ID:
Democrats…",2020-07-13 19:34:53,
1282761051671584768,"RT @Freeyourmindkid: Well this is frightening

https://t.co/ZPcqSukgZT",2020-07-13 19:37:21,"I Am Also a We 

He/They"
1282761059095511040,RT @amywestervelt: The most applicable climate change lesson for COVID is that if the obvious solutions threaten capitalism the powers that…,2020-07-13 19:37:23,"Evolutionary Judgment & Decision Making researcher, Father, and Husband. Mainly retweets about data, logic, rationality, & theory. Opinions are my own."
1282761029886242821,"RT @SenSchumer: I’m standing with @SenWarren and @RepPressley.

Because President Trump using a pandemic to throw out international student…",2020-07-13 19:37:16,"Retired school principal, classroom teacher, K-12 school counselor, “Win The Era” supporter."
1282761030146207744,"@SidShirole @navalMH 
Sir the businesses have been badly affected already in the past 3 months , no guidelines on r… https://t.co/yRRfIOXITO",2020-07-13 19:37:16,
1282760456495562759,RT @clarencehilljr: Imagine putting kids first,2020-07-13 19:35:00,Masters holder PhD round the corner
1282760778399936513,"California, we are back to lockdown phase 1! There is so much anger and frustration that I'm feeling right now. Fuc… https://t.co/q6dqggRtX4",2020-07-13 19:36:16,
1282760262127362051,RT @KrisT_Mak: I too would be lucky if I made $7.5 million this year.,2020-07-13 19:34:13,Fucc a bio
1282760824289812485,RT @clairecmc: Hot doggin’ in the face of a pandemic is never a good idea.,2020-07-13 19:36:27,"🆘🇺🇸BLACK LIVES MATTER, Human, veteran, animal lover, empath, Buddhist, vegan, reader, writer, Star Trek fan, INTP🖖🏼🎶🕊✌🏼💖🧜🧢🎓🗽NASTY,  “unlikeable”"
1282760518193885184,RT @KamalaHarris: There are more than 35M people living with a disability who are eligible to vote. But too often voting is inaccessible. T…,2020-07-13 19:35:14,All I care about is good people and great music. #benstrong  she/her
1282760211799977989,RT @14News: Ohio Co. long-term care facility reports 32 positive cases. &gt;&gt;&gt; https://t.co/OA6iGPktB1,2020-07-13 19:34:01,@14news Anchor + Reporter | Proud @ballstatefb Alumna #GoCards | Indiana Native probably watching @ESPN 📲 STORY IDEA? Email me at Samantha.Johnson@14news.com!
1282760401583833093,"RT @HuwSayer: ""According to reports, the Prime Minister and Chancellor Rishi Sunak were “aghast” at the impact the “stay-at-home” message h…",2020-07-13 19:34:46,"Award winning harpist singer, writer, theatre maker, creative arts & music education, participatory projects, SoundSense Board, FRSA, MU Exec Committee"
1282760787354886149,RT @SteveSchmidtSES: The CEO of American Airlines should ban Ted Cruz from the airline today.  Senators are not above the law or airline po…,2020-07-13 19:36:18,I'm a widow and I like to read a lot and like meeting people. I am honest and I also like people to be honest with me. I got 2 kids
1282760439949135874,"RT @NHSMillion: Be afraid. Be very afraid.

After the appalling way he’s handled Coronavirus, we definitely don’t want Boris Johnson to hav…",2020-07-13 19:34:56,"Digital strategist, business owner, proud uncle. COO - Optimal, #WebPerformance & #AppPerformance partner @ https://t.co/mAS6rKmYUt"
1282761135217876994,"RT @MSNBC: BREAKING: California's two largest school districts, Los Angeles and San Diego, have announced all classes will begin online onl…",2020-07-13 19:37:41,"Mask up! 😷👨‍👩‍👧‍👦
#FBR #FreeTheChildren
#LGTBQ #BLM #Resist 
 I don't reply to DM's, send out a tweet an I will reply :)"
1282760220540833803,RT @deadeyebrakeman: why I won’t wear a mask https://t.co/CyiKIgWuwF,2020-07-13 19:34:03,the one & only | 🇩🇴
