id,tweet,time,description
1281697966764564482,"If you look in the top right corner, there’s an article about how we aren’t ready for a pandemic, from two years ag… https://t.co/ggAuuEVrHl",2020-07-10 21:13:02,Dialectics god
1281697439368568834,"RT @drjoshuawolrich: We know full well that they won’t entirely prevent COVID-19 transmission, but they will reduce it. We have good eviden…",2020-07-10 21:10:56,"Wife, mum, daughter, friend. Depression survivor. Raising money with @League_Charities
Botschafter"
1281697808001662977,"Male-dominated commissions = male-focused research, policies &amp; programmes. We 👏🏻 can 👏🏻 do 👏🏻better👏🏻… https://t.co/ZTfCOLZL6A",2020-07-10 21:12:24,Global Project Director #COVID5050 @womeningh | Co-Founder @WghFinland | Menstrual Rights Advocate| MSc @LSHTM & PhD @UCL |Health & Social Innovation|Glasgow💙
1281698933635518465,"RT @LtGovGilchrist: Wear a mask. 
Wear a homemade mask. 
Wear a mask with a pattern. 
Wear a mask that says “masks suck.”
Wear a mask with…",2020-07-10 21:16:53,
1281698655758508032,"RT @rosoulra: schools can’t even control lice, but think they can control COVID-19 lol",2020-07-10 21:15:46,"lots of opinions on the warriors franchise, dm for details"
1281698618789879808,"@marcorubio Yeah, people still get heart attacks and appendicitis even during as pandemic.

That's not ""good news""… https://t.co/ozzwBcp5cN",2020-07-10 21:15:38,"American cruising the world under sail. 
Fiction & freelance writer and blogger. Liberal atheist loudmouth. He/Him.
#writing #writingcommunity"
1281698776449789952,"@RobertDeNiroUS Mr De Niro, enounced covid-19 cerfew was just inducement for protests. Main reason for protests is… https://t.co/36OIBQGZ9e",2020-07-10 21:16:15,In the Land of Mordor where the Shadows lie
1281698714080419840,RT @gavinesler: Is everyone ok with this? Revealed: Key Cummings and Gove ally given COVID-19 contract without open tender | openDemocracy…,2020-07-10 21:16:00,ok I believe ya !
1281698168208609283,"RT @FinancialTimes: As the US public health expert who called for more Covid-19 testing &amp; warned Trump of avoidable deaths, Anthony Fauci h…",2020-07-10 21:13:50,
1281698872482553857,"RT @drdavidsamadi: Mayor DeBlasio, the coronavirus cannot distinguish between a parade and a protest just so you are aware.",2020-07-10 21:16:38,"I'm a Christian, Patriot, Hospice RN, married 21 yrs, make jewelry, live on a Texas ranch."
1281698659470651392,"RT @PeterPrickett: It would seem that we are not far from the return of full football training, until anything is confirmed, stick with the…",2020-07-10 21:15:47,Board Director of Lancashire FA         Freelance writer for Manchester's top advertising & event agencies.
1281698877155028995,"RT @donwinslow: Dr. Deborah Brix let this happen.

She could have told America the truth months ago.

Instead she went on TV and praised Do…",2020-07-10 21:16:39,Lover of Science in all it's glorious forms. Independent Voter. #SaveThePlanet
1281698382873014272,"RT @cathybbyxd: If ever there was a time for public school teachers to strike, it is now. Refuse to go. It’s not like they’re funding your…",2020-07-10 21:14:41,I only like tequila & my Albanian lover.
1281698943680892928,@uplandcress @mandy_mclaren @oliviakrauth It was great if your school had a corp of stay at home parents to help th… https://t.co/o5RPsUZdsV,2020-07-10 21:16:55,"Honorable Kentucky Colonel 🐎
Can't knit, but can hate the 1%🖤
Don't screw with my students🍎"
1281698302065618949,RT @SethAbramson: BREAKING: Houston is now a COVID-19 war zone. Hospital ICUs are full; desperately sick patients are being treated in ERs.…,2020-07-10 21:14:22,Everything Sports related and Loving the Outdoors #UVA #Wahoowa #Biden2020 #VoteBlue #TrumpVirusMustGo #BLMatter #GOTV2020 #NativeAmerican #BidenHarris2020
1281698570857590784,Mortgage Rates Hit New Record Due to Coronavirus Pandemic https://t.co/3GZ0wTFO0N,2020-07-10 21:15:26,"About https://t.co/evFOSu5SPB
ExBulletin is a Free News Media Website, Which delivers its user free verified news from verified sources worldwide."
1281698781986267138,Should lock it down now https://t.co/DVBbDXLNq3,2020-07-10 21:16:17,"Ex-pat Chicagoan living in MA.  Hard worker, voracious reader, and huge nerd. White Sox, Bears, Celtics, NIU, BVB, Saints FC.  All opinions are my own."
1281698532823633920,"RT @stphnfwlr: NEW: Atlanta Mayor @KeishaBottoms is set to roll the city's reopening plan back to Phase 1, which is detailed below. Comes a…",2020-07-10 21:15:17,Angry leftist 👨🏻‍💻 he/him
1281698274202791938,"BJP Blocks Parliament Panel Review Of PM CARES Fund, Coronavirus Response https://t.co/CjPuUJ49FU",2020-07-10 21:14:16,"Hello 
I am harsh tripathi
https://t.co/rwpjRz45xa"
1281698954191745024,"Let me add, students must be tested before coming to Bloomington. So whether that’s to move in or to go to class, y… https://t.co/VRy7wLc0Z8",2020-07-10 21:16:58,@indystar correspondent covering IU athletics • LG Twins Superfan • IU ‘21 stefkraj@iu.edu
1281698278216613888,"RT @catturd2: How many times do I have to say it? You’re being lied to. 

WOW! NBC Guest Doctor Who Was Suffering from Coronavirus in Hospi…",2020-07-10 21:14:16,Working all the Time..
1281698383196037121,"RT @AntonyLoveless: @CrimeGirI Didnt we have something like 55,000 in 2014? I don’t recall the government trying to use that as an excuse t…",2020-07-10 21:14:42,💙 NHS    Peace and Justice
1281698759735468034,"RT @charlesornstein: A status report prepared Wednesday by the council that coordinates the Houston region’s emergency medical response, sh…",2020-07-10 21:16:11,RT ≠ endorsements.
1281698119600574465,"RT @RonnyJackson4TX: The radical left wants to keep our entire country shutdown, and that includes our schools. We HAVE TO get back to work…",2020-07-10 21:13:39,"Retired Navy Chief, now a  Data Center Facilities Manager
Yes, it's me on the horse in the profile pic."
1281698679687086086,RT @maggieNYT: Yes the weather is bad but “people familiar with the sign-ups said the interest in the rally was significantly lower than fo…,2020-07-10 21:15:52,"representation: Art Gallery of Guelph / current: Barber Glass Gallery 1885 / upcoming: Capistrano Bistro, Miijidaa, Sugo on Surrey, Platforms: Athens, Greece"
1281698554352984064,RT @DancesWithTamis: Im at a loss for words. My best friend who has no insurance woke up unable to breathe this morning. Like fully choking…,2020-07-10 21:15:22,"Louisiana incarnate, I have sworn a blood oath in front of the Huey statue to destroy the duopoly and liberate America. Proud People’s Party Member, fuck corps"
1281698201574141953,"RT @mhdksafa: Schools can't even control lice, you think they can control Covid-19.",2020-07-10 21:13:58,you can love a thot but a thot can't love you. ~Brandon
1281698878257983489,RT @johnmcquaid: Basically the few active Covid-19 prevention measures the Trump campaign staff is taking are the *opposite* of what you're…,2020-07-10 21:16:40,Formerly: reporter/tv critic and member of Television Critics Assoc. Now: tenant organizer in the Outer Sunset. Proud Iowa native.
1281698211258933249,Will wearing a face mask protect you from COVID-19? It’s complicated. Here are the 5 biggest mask myths https://t.co/F4MGUkm1mg,2020-07-10 21:14:01,"She/Her, MSW, 
Blogger *Burgh Verified* Cat Lady * Queer * Disabled * Family Tree Explorer * 
2019 #GLAADawards Outstanding Blog"
1281698437155753991,RT @hottestsingles: Gorgeous,2020-07-10 21:14:54,I have a tiger kitten on my head; your argument is invalid.
1281698222667374594,"RT @atensnut: Doncha just love it..... DeNiro running out of dinero.  

Robert De Niro says coronavirus decimated his finances https://t.co…",2020-07-10 21:14:03,
1281698290560532480,"""GNYHA was responsible for millions to Cuomo’s 2018 reelection campaign, but its support did not stop w/politics on… https://t.co/irPn0yJdAr",2020-07-10 21:14:19,Nonprofit organization dedicated to Preserving Our Brooklyn Neighborhoods! #preserveourbrooklynneighborhoods
1281698878073577474,RT @jaicabajar: The ABS-CBN shutdown and the Terror Law will not distract us from the fact that you have failed in handling this pandemic.,2020-07-10 21:16:40,
1281698592827142145,"RT @TanaHargest: Mpls has $165M shortfall due to COVID. Frey is proposing $93M in cuts from affordable housing, cooperative worker ownershi…",2020-07-10 21:15:31,LOW STAKES TEPID TAKES (they/them)
1281698076487561216,RT @jimsciutto: “You cannot fight the pandemic with lies and disinformation any more than you can fight it with hate or incitement to hatre…,2020-07-10 21:13:28,Clinical Psychology Fellow|Mom of 4|Abuelita of 1| I will always stand up and speak up for the rights of all|She-Her|All comments are my own
1281698543330361359,"RT @TomHall: 🐨

This Koala and I have

the same haircut...

🐨

#QuarantineLife #FridayFeeling 
via @Australia pls follow

https://t.co/24ti…",2020-07-10 21:15:20,"PDI : Parole/Pronos/Propos Direct et/ou Indirect   
Observateur du monde   
Multiples passions
Nouveau compte twitter de PDIofficiel après oubli du mot de passe"
1281698320394616834,"RT @H_MitchellPhoto: Florida has emerged as the world’s new epicenter for the coronavirus, and Trump has decided to spend the weekend golfi…",2020-07-10 21:14:27,"Wild-N-Responsible-SPORTSLOVERMJ23RULES,  builder-service Veteran USN BLM"
1281698650587115520,RT @ThatTimWalker: This stinks. https://t.co/XtzrmFLbCf,2020-07-10 21:15:45,"Emeritus Professor of Clinical Neurology, UCL Queen Square  Institute of Neurology, London"
1281698734040993793,"RT @CAJUArizona: So, #COVID19 cases are skyrocketing in #Arizona, but @UArizonaPres is excited to welcome you back to campus? (via @washing…",2020-07-10 21:16:05,Still working on my dissertation; I will conquer you yet! 🤪🤣. INFP. Love creative arts and arts & crafts. Uniquely me. She/Her.
1281698667280252929,"RT @chesleydohl: HEADLINE: California Gov. Gavin Newsom Announces he will Release 8,000 Prisoners in Hopes of Easing Coronavirus Crisis.🧐 R…",2020-07-10 21:15:49,"Novelist, Screen Writer - “The further a society drifts from the truth, the more it will hate those that speak it.” ― George Orwell"
1281698386664660994,Science illiterate @GovRonDeSantis cares more about appeasing @realDonaldTrump than our lives/is willing to sacrifi… https://t.co/73LbnQxZMv,2020-07-10 21:14:42,"Author/Artist/Business Owner/Mixology Hobbyist who values knowledge, education, & science/believes in acceptance, respect, & diversity. We're in this TOGETHER!"
1281698834775777281,@agencia_andina Your Tweet was quoted in an article by @Agencia_Andina  https://t.co/q9XEm0e9Z1,2020-07-10 21:16:29,I was a bot that let you know when your tweets were quoted by major news websites. Unfortunately Twitter has suspended me from automatically posting :(
1281698449281486852,@Lin_Manuel We also learned to entertain ourselves during the Pandemic. Bye Broadway Stay Dark Forever,2020-07-10 21:14:57,Average Person. No more No less.
1281698071907201024,"RT @AnnaApp91838450: Morning America 🇺🇸 MAGA
BadazzPatriots, Military, Blue,ICE
Never Stop Sharing ⏬ We Will
Never Forget BENGHAZI 🙏
11Time…",2020-07-10 21:13:27,GOD BLESS AMERICA #SUPPORTOURMILITARY U.S. MARINE MoM🇺🇸 #CONSERVATIVE #Trump2020Pence #2A #BENGHAZI #RecallGavinNewsom #Latins4Trump
1281698717876269057,RT @benpershing: Japan’s theme parks have banned screaming on roller coasters because it spreads coronavirus. “Please scream inside your he…,2020-07-10 21:16:01,
1281698088558587904,"@GOP @realDonaldTrump Fantasy, lies and bullshit. How about talking about Covid, Tax Returns, Russian Bounties, etc etc etc.",2020-07-10 21:13:31,
1281698596254081030,RT @carobee: Always heartened to read about the good #homelesshealth partnerships to come out of #COVID19 it will be key as we move into th…,2020-07-10 21:15:32,
1281698597885612033,"RT @HeavenSentMel: Due to Covid-19 I will not shake hands or hug anymore, You may either Kneel or Bow to me",2020-07-10 21:15:33,mischief managed..
1281698189888888832,"RT @HitherMann: So your behaviour towards your finances needs a serious look at.

I created the CORONAVIRUS CRISIS CAMP for this exact reas…",2020-07-10 21:13:55,CEO Fortune Academy| Awarded Entrepreneur Of The Year 2019 by UK  House of Lords🇬🇧
1281698554407526400,RT @K_JeanPierre: WEAR A MASK. ❤️ https://t.co/T39NNoWX4G,2020-07-10 21:15:22,"A Feminist and Liberal lesbian who happily resides in the Republic of Gay Marriage and Socialized Medicine - Massachusetts, USA, bitches!"
1281698832271716356,Being able to use “I just really don’t think coming is a good idea for me” as an excuse to not go to every single t… https://t.co/gYnjqwUaqQ,2020-07-10 21:16:29,@okstate alum - Go Pokes. Meat Science PhD Candidate in the Lorenzen Lab @mizzou. US Meat Animal Research Center based. Lincoln’s dog mom. Views are mine.
1281698286357958658,RT @BillyCorben: Hey @MayorGimenez: why didn't you report this violation of your COVID-19 emergency order today? That guy right in front of…,2020-07-10 21:14:18,Official twitter account for the @Cleveland19News Sports Department. Sports Report @ 6:20/11:20 on WOIO. #19Cavs #19Browns #19Tribe #19Sports
1281698810390106112,RT @SafetyPinDaily: Severe brain damage possible even with mild coronavirus symptoms || Via Deutsche Welle https://t.co/vxLhxXqOnM,2020-07-10 21:16:23,
1281698232150528002,RT @techreview: The US has largely been working off the same science policy playbook since WWII. The pandemic was a wake-up call: the US ne…,2020-07-10 21:14:06,"Success is not final, failure is not fatal: it is the courage to continue that counts. Winston S. Churchill"
1281698169148104704,RT @EdConwaySky: If you do have time this weekend please do check out my and @rowlsmanthorpe's long-read on what's been going on behind the…,2020-07-10 21:13:50,Looking for Arunachala
1281698121861361664,RT @jimsciutto: “You cannot fight the pandemic with lies and disinformation any more than you can fight it with hate or incitement to hatre…,2020-07-10 21:13:39,"Paying attention, daily; disappointed voter; X-Files fan;"
1281698155541565441,@CPAC @GOPLeader This might give you a clue-the INCOMPETENCE of @realDonaldTrump &amp; the GOP sycophants that are doin… https://t.co/qmqWjgA7EH,2020-07-10 21:13:47,"""But here, right is supposed to matter. It's what made us the greatest nation on earth.  No constitution can protect us if right doesn't matter anymore"""
1281698418176516097,"RT @madelynglitters: Can we talk about how, out of EVERYTHING going on rn, our government chooses to spend time, energy and money taking do…",2020-07-10 21:14:50,#YOONGI: WRITE BOPS ! INVENT RAP ! BE GAY ! REPEAT ! || fan account || 19 || she / her
1281698286701879298,"@ipu_jl @JustinTrudeau @fordnation @TorontoStar Try this. I will put in Canadian for you.
The potatoes were $5.49 a… https://t.co/3TkHhkllxu",2020-07-10 21:14:19,"Retired Banker, Unclaimed Treasure, On a Pilgrim Journey, RC, Community Volunteer, Primary Caregiver, MPHS, Canuck/Famine Irish. Lover of dry humour."
1281698303877492736,RT @ABC: JUST IN: Georgia reports new daily record of coronavirus cases. https://t.co/MvG7e9alDu,2020-07-10 21:14:23,
1281699401514102784,"@johnhawkinsrwn To be fair, we shouldnt' be doing much, if anything indoors (outdoor protesting is fine with masks)… https://t.co/vjknIyz3C8",2020-07-10 21:18:44,"Resplendent, and mostly functional. 

Normalish."
1281699045937827840,How do 33% still think the bum is handling the virus. Did they misunderstand the question because they are his poor… https://t.co/aOj05oAYEQ,2020-07-10 21:17:20,"I am interested in politics, law and music"
1281699034185506819,"RT @MikeBloomberg: Pres. Trump's decision to order foreign college students to leave the U.S. isn't only cruel, it's nonsensical. The world…",2020-07-10 21:17:17,NFL Gov Officials & Agencies Fitness & Wellness Country Politics
1281699589658234889,"Only $7.5 Million! Someone start a GoFundMe for this poor soul, so he can take that money and shove it up his ass. https://t.co/LfPRlMUuRb",2020-07-10 21:19:29,helo i like football
1281699301228294144,"RT @edannunziata: Now I’m a lot more afraid of this alien virus:

Coronavirus hijacks cells, forces them to grow tentacles, then invades ot…",2020-07-10 21:18:20,"Producer of ""Slave Girls from Beyond the Galaxy"" and other Pulp/Grindhouse inspired erotic fictions for fun diversion and amusement."
1281699436213661696,"RT @RexChapman: They’ve been married for 58-years but were separated for four months due to the coronavirus pandemic. Until now. 

I’m here…",2020-07-10 21:18:53,Let's get this cleanup started. I've got silly things to do and this treasoning is cramping my style. Please clean these traitor turds out of my litter box.
1281698974039248897,RT @mark_ambrogi: A refreshing break from all these selfish sorts throwing tantrums about wearing a mask to shop for 15-20 minutes.,2020-07-10 21:17:02,"Humanitarian, proud Mom and Gigi. Caring for all of society is strength , cruelty is weakness ."
1281699476823052288,"RT @CNBC: If everyone wears a mask, 58% of Covid-19 deaths could be prevented by fall, study says (via @CNBCMakeIt) https://t.co/BExj3Flrck",2020-07-10 21:19:02,"Stem/Steam, love tech, close the digital divide, education, social entrepreneur, geek, gamer, podcast, streaming, father, husband, social justice and mentor."
1281699414168473600,"RT @mhdksafa: Schools can't even control lice, you think they can control Covid-19.",2020-07-10 21:18:47,🇸🇻🇸🇻
1281699075377762306,"RT @rosoulra: schools can’t even control lice, but think they can control COVID-19 lol",2020-07-10 21:17:27,✌🏼
1281699654493548546,In the program we say half measures avail us nothing. That applies to COVID-19 too. We need to shut down and now an… https://t.co/hg0MnfEiAZ,2020-07-10 21:19:45,I got suspended because some troll reported copyright infringement on the same video 22 times😳 Lifelong Dem & Trump hater. Dad to Twin College GRADS ❤️
1281699536155619330,"@MayorGimenez Miami-Dade county has a mandatory law to wear masks, or people get fined, and I applaud  it! You need… https://t.co/TOIareYAtX",2020-07-10 21:19:16,
1281699040099434498,"RT @Jennyjen010: Earlier in the year the CDC was telling the medical field workers to include flu deaths, heart attacks, strokes, car death…",2020-07-10 21:17:18,American Patriot
1281699382300221440,"RT @tedlieu: Dear @VP Pence: The American people are not stupid. Please stop treating us as if we are stupid. We can read, and we have eyes…",2020-07-10 21:18:40,"“There are but two parties now: traitors and patriots. And I want hereafter to be ranked with the latter and, I trust, the stronger party."" U.S. Grant, 1861"
1281699025167810561,"RT @JOYNEWSONTV: COVID-19 PANDEMIC: @stonebwoyb launches entrepreneurship skills training workshop for youth

#TheJoyBallotBox https://t.co…",2020-07-10 21:17:15,"Islam/Muslim/Nabi/Stonebwoy/Chelsea
0555685361
Follow for Follow Back"
1281699515624554498,RT @JeffreyGuterman: Dozens of Mississippi lawmakers have coronavirus after weeks of refusing to wear masks https://t.co/xBcVLXWV8e,2020-07-10 21:19:12,"🔥😼😾🔥🙀😸😽 retired old cat lady, mom to 4 MaineCoons and 1 grumpy Siamese... ex-teamster steward WDW can’t wait for #tRumpster to go to jail ! #Resist"
1281699569215176710,"RT @jwoodgett: Jeez, how incredibly selfish it is for poorer neighbourhoods, temporary foreign workers and the homeless to be holding up re…",2020-07-10 21:19:24,"Cancer biologist: metastasis, plasticity, NETs, miRNAs/Bio-miRTa https://t.co/OFgUNh7Vs1 |@Sunnybrook|🇨🇾🇨🇦"
1281699289417252865,"RT @MattWolking: This is wild.

An NBC contributor ""appeared on NBC and MSNBC almost a dozen times to discuss his recovery from"" coronaviru…",2020-07-10 21:18:18,"Married Catholic/Christian, Irish America, Conservative, Realtor-Businesswomen. favorite name is Nana."
1281699633379639296,"You can find the new guidance for theory tests in England here:
https://t.co/skxTeBJmML",2020-07-10 21:19:40,"I'm a fully qualified female Government Approved Driving Instructor (ADI).
My lessons are conducted in a calm, friendly & relaxed manner to build confidence."
1281699197427777543,"RT @DeborahMeaden: Warning!!! Please remain surprised, let down angry. Do not let this be the new normal. Thank you.",2020-07-10 21:17:56,"UK, Rejoin the EU!
Policy wonk, political campaigns.
National & international economics & politics.😷😷😷"
1281699532946931712,@OwenJones84 @NosheenIqbal Before Covid everyone was saying we need more police . Mothers of knife crime victims we… https://t.co/NdWA8JPdMd,2020-07-10 21:19:16,
1281699528475901954,"@AlsupCarla @SandDollar04 @Southcom @POTUS @realDonaldTrump Well...according to the CDC it is 0.0886502454.

https://t.co/llAW8UKoBR",2020-07-10 21:19:15,"🇺🇸🇺🇸🇺🇸🇺🇸🇺🇸
Lifetime Republican, Hispanic, Christian, and staunch #2A."
1281699071498113025,Insight from @BidmcCvi @duanepinto on #heartdisease + diabetes &amp; their impact on #COVID19 complications.  https://t.co/1EwFV6CwtO,2020-07-10 21:17:26,"The CardioVascular Institute at BIDMC includes specialists in Cardiovascular Medicine, Cardiac Surgery, Vascular & Endovascular Surgery. RTs ≠ Endorsements"
1281699200221065221,"RT @HNTurtledove: Where was @GovAbbott a month ago?

""Oh, hey, everything looks fine! It must BE fine, yup yup yup!""

How many people are s…",2020-07-10 21:17:56,"Yes, I am anti-fascist. All Americans are. 
Also Navy vet, and now Commodore of the AntiFascist Submarine Force.
Did I mention trump is a traitor?"
1281699535190994949,"RT @lyta_gold: not to get all Marxist on main, but “cancel culture” and other immaterial chattering-class bullshit is a deliberate distract…",2020-07-10 21:19:16,she/they. artist. marxist. slavic. smrt fašizmu ☭
1281698986714378245,"RT @renoomokri: Today, over 10 million Nigerians attended jumat at mosques, over 10 million visited a bank, and over 20 million shopped at…",2020-07-10 21:17:05,I'm a great guy with an open mind on realities of life and a voice for the TRUTH!
1281699661359841288,RT @LVozzella: Covid cases up in Virginia Beach while steady elsewhere in the state. https://t.co/ZQEeZ9xvGi,2020-07-10 21:19:46,She/her
1281699050698440704,RT @DrKyleAbernathy: Regardless of what school may look like during #COVID__19 @CaveSpringElem we are digging it!Can you dig it? We are exc…,2020-07-10 21:17:21,"Author More Than a Test Score, Educator 30+ years, Plexus Ambassador, FCS Board member, Board member, Wife, Mother, and passionate about empowering students."
1281699087654326272,RT @GavinNewsom: WEAR. A. MASK.,2020-07-10 21:17:29,
1281699678686347265,"RT @JuddLegum: There are 11,433 NEW CONFIRMED CASES of coronavirus in Florida today and 93 DEATHS. 

And they are opening up Disney World.",2020-07-10 21:19:50,
1281699045635956738,"RT @DeborahMeaden: Warning!!! Please remain surprised, let down angry. Do not let this be the new normal. Thank you.",2020-07-10 21:17:19,"The first 5 days after the weekend are always the hardest!... Love; Family, Liverpool FC, Football, Food, Films & Laughing!

#BlackLivesMatter"
1281699457382449155,RT @moses1david: Wrapping up @AIDS_Conference Remind everyone #GreedyGilead priced #COVID19 treatment #Remdesivir at 200/300X cost of manuf…,2020-07-10 21:18:58,
1281699666745348098,RT @freddiesayers: Since everyone is such an expert on Covid-19 in Sweden we thought we'd talk to a doctor working at Sweden's top hospital…,2020-07-10 21:19:48,Turkish/Austrian/British. I science for a living and fight for fun.
1281699230336385026,RT @conquerorshe: It is time to hold @GileadSciences accountable for #PandemicProfiteering. Pricing #Remdesivir at 200-300X cost is unconsc…,2020-07-10 21:18:03,
1281699200334532609,"60,000+ dead and many of them due to late lockdown, dithering by floating 'Herd Immunity', failure to test &amp; trace… https://t.co/FAlK09yMmk",2020-07-10 21:17:56,"Sussex, England, UK, Europe
Retired, Charlton Athletic, Grandad...
Retweets not necessarily my opinion"
1281699423572172800,RT @Misokeys: I really can’t stop watching this over and over again. They really gave her room to vent and just flow thru her emotions and…,2020-07-10 21:18:50,I’m just here for the vibes tbh
1281699591390400514,"RT @NSPCC: We know that with rules and advice changing throughout the pandemic, some parents might feel anxious. We want to remind you that…",2020-07-10 21:19:30,Thornton Primary School
1281699530912784385,So proud of this @TheBMA . ALs to be carried over/ paid at the end of rotation. Huge implications for junior doctor… https://t.co/ehsq4JD2NT,2020-07-10 21:19:15,#Junior Doctor NHS and #travel enthusiast (not sure what I love more than the other). Also like to live life the most. (New to Twitter world)
1281699645266305024,definitely got the lockdown badges on hall of fame😭 https://t.co/iyjiDGCesf,2020-07-10 21:19:42,"one of none. 75 📥DM to book a photoshoot, be prepared to deposit"
1281699625045549059,"RT @evanasmith: NEW from @AlexSamuelsx5: @GovAbbott warns if spread of #coronavirus doesn’t slow, “the next step would have to be a lockdow…",2020-07-10 21:19:38,SUPERMAN
1281699384191836160,"RT @CardiacTeam: Despite restrictions with rooms and social distancing etc, this team have taught 75 staff across Bedford Hospital this wee…",2020-07-10 21:18:40,"Interventional Cardiologist, Founder of MedShr - medical network for doctors to share knowledge & save lives! Join over 1,500,000 doctors in 190 countries!"
1281699482770354177,"RT @oxipetals: My mom is selling masks because the COVID hurt her housekeeping business. She was like “Dile a tus amigos” 
..Pero no tengo…",2020-07-10 21:19:04,echándole ganas. Z💍
