id,tweet,time,description
1282754655450279937,RT @aravosis: Ted Cruz flew on an @AmericanAir commercial flight yesterday and refused to wear a mask. And American Airlines let him violat…,2020-07-13 19:11:56,Travel Consultant with Love of the Magic Vacations!  Travel tweets @jenpikelotmv!  @websteru grad!
1282754386742120448,RT @AdamSchefter: Russell Westbrook tested positive for COVID-19. https://t.co/bog9z7eH7l,2020-07-13 19:10:52,free da guys 🦍#LG4L 💉 336 💪🏾 @giants @lakers #GloGang LLZ 👼🏾❤️
1282754654548492291,"RT @Apex_WW: #BREAKING: #California Governor is directing all counties in the state to close bars and indoor operations restaurant, winerie…",2020-07-13 19:11:56,I hate terrorism and tyrants both foreign and domestic. #GOLDCORP
1282754181263237121,"RT @edyong209: ""How did the interview go?""
""Well, I made Christiane Amanpour sad, how's your day going?"" 

https://t.co/Xl3MZ0rdU8",2020-07-13 19:10:03,Former Labour Councillor 2014-2018.(Lewisham). Human Rights 1st/Strategy/Public Relations. Judiciary. School Guv. (🌍)
1282754266004955136,RT @kenjeong: #DarkestTimeline COVID Correspondent @BrentTerhune https://t.co/GzSt3tEPeq,2020-07-13 19:10:24,Philly ➡️ East Bay / UBI • M4A • GND • Anti-War
1282754776380342272,"RT @techhousehoe: in a bad place rn... not mentally, just living in the covid epicenter of the ENTIRE WORLD",2020-07-13 19:12:25,"@Tecate • No soy un ángel soy, El mismo diablo."
1282754310330183680,I hate rebulicans https://t.co/hnmok5bTFu,2020-07-13 19:10:34,Model and licensed esthetician | 🇰🇷🇮🇹🇯🇵
1282754634524823556,@ultrachildish They have mint sets Covid tests now!’,2020-07-13 19:11:51,"Fighting games. Comics. PSN: ArisueSei00, XBL: brybrydesu, Twitch: bryan_desu. Opinions are my own. Fan account. He/him. avi cr.: dcarveledits @ tumblr"
1282755116949557253,RT @FloSimpsonn: Got a 1st in my dissertation 🤪,2020-07-13 19:13:46,
1282755091510865920,RT @mistachrish: I can’t afford health insurance,2020-07-13 19:13:40,Not the Boy-Wonder
1282754558582755328,RT @ReallyAmerican1: Retweet if you agree American Airlines needs to #BanTed after he showed such a disdain for other people’s safety.,2020-07-13 19:11:33,likes cycling hates stupid people
1282754436666986498,#StayAtHome with #QuarantineMusic on Kanzen Records Radio i love it  #FreshFridays #NewReleases #DeepHouse… https://t.co/SM0ua5sVtx,2020-07-13 19:11:04,Kanzen Records Radio now streams live 24/7 via cross platforms online with the options to stream via our app and other partners are also available.
1282754935742885890,Good. He shouldn’t give into stupid fucking protesters this time. This is the response we’ve collectively earned. https://t.co/lSpbIT8FKp,2020-07-13 19:13:03,"Californian farmer. Auto enthusiast, eco nerd. Coal is stupid; sustainability isn’t. Profanity Connoisseur. Justice is on the ballot."
1282754931670360070,"RT @hossehenad: Captured today at 10:45am — @TedCruz on a commercial flight, refusing to wear a mask. https://t.co/h8DM7J4CMi",2020-07-13 19:13:02,"Biologe, P4F, Umweltschützer, christlicher Buddhist, HP.
Das kleine Senfkorn Hoffnung...."
1282754399543025665,RT @JaniceDean: I wrote this as a tribute to my husband’s parents.They are not just statistics on a “curve.” I believe ⁦@NYGovCuomo⁩’s poli…,2020-07-13 19:10:55,Not a bot. One grumpy dude. Ask me for money or gift cards and Block. Loves all politics. #MAGA #KAG # ABSOLUTELY NO DM’s... sending one gets you blocked #Chump
1282754255879901192,I like Louisiana's plan. The non-contact sports can start practicing with precautions in Phase 2 but for the full c… https://t.co/P2Q4SXUmNs,2020-07-13 19:10:21,Former MMJ with an MBA & camera. AP stringer. Working at a CC. Uses BLOCK button frequently. I HAVE OPINIONS Help pay my student loans. https://t.co/Tqkn8UUP1Z
1282754390827442182,RT @chelseahandler: Hey Republicans: are you tired of winning yet? Per today’s NYT-Diamond Offshore Drilling secured a 9.7 million tax refu…,2020-07-13 19:10:53,"An ancient soul, travelling through time; just stopped by to tweet."
1282754642624028678,"RT @CyrusToulabi: For all those on the right who blamed the outbreaks in their states on the BLM protests...

Note: There were protests in…",2020-07-13 19:11:53,"obviously a secret agent, hemptress, cosmic interpreter, general counterpoint, your average juxtaposition theorist"
1282754315078295557,"RT @ClarkeMicah: In the name of Covid, the state has come between spouses at the point of death, practically abolished weddings and funeral…",2020-07-13 19:10:35,
1282754190184345600,"RT @GavinNewsom: NEW: #COVID19 cases continue to spread at alarming rates.
 
CA is now closing indoor operations STATEWIDE for:

-Restauran…",2020-07-13 19:10:06,"Mad Housewife tired of the lawlessness, cruelty and stupidity that is this president and everyone around him."
1282754340487196673,"RT @DEADLINE: California Coronavirus Update: Governor Gavin Newsom Closes All Restaurants, Movie Theaters In State https://t.co/0GYI1S1InN…",2020-07-13 19:10:41,"Past life Goodwill, now off to see the world & smell perfumes."
1282754524722102279,"RT @JoshuaPotash: Teachers are expected to handle active shooters, a pandemic, and solve inequality, but we’ll cut their salaries before we…",2020-07-13 19:11:25,https://t.co/UzRc8FDbtf
1282754752128917507,"TED CRUZ SHOULD BE BANNED, HE IS NO DIFFERENT THAN ANY OTHER CITIZEN. Or is he, @AmericanAir ??? No excuse.… https://t.co/5DiiaauNqY",2020-07-13 19:12:19,"Proud to live in one of most beautiful towns in America. Lean left, but normal. Bring  it to the middle, folks. but look forward, push forward, no going back..."
1282754340416032768,"RT @Robin_Blue19: Japan has had less than 1000 Covid deaths. It is 12 times more densely populated than the US, and they have more elderly…",2020-07-13 19:10:41,water my creations | big fine
1282754503511543809,"RT @OFFICIALWMAS: As a parent, you always worry about your kids, especially when they're just 21, still at uni and volunteer to help battle…",2020-07-13 19:11:20,"Health care support worker,runner and now trying a bit of weight training 🏋️‍♂️🏃‍♀️ https://t.co/bwgIPozh3h"
1282754546595516417,"RT @AmeliaJRobinson: ""Fighters Positive About the Covid Card in Las Vegas"" by The Associated Press via NYT https://t.co/U3VscvGf84",2020-07-13 19:11:30,
1282754861407363072,RT @roxanaortega: Me through this whole pandemic. #frida #casagrandes @FPofCasagrandes @NickAnimation @FanpageOfTLH #mondaythoughts https:/…,2020-07-13 19:12:46,"Team Mystic, Pokémon Go, Harry Potter WU, O state ‘22🐉, Gamer"
1282754276880678912,@CharleyWatson24 They started making one but it stopped due to Covid-19,2020-07-13 19:10:26,"Tinnitus sufferer, trekkie, pin badge collector & ‘expert’, football lover, Carlisle United obsessed, eats & drinks too much... man behind @Cumbcupzone"
1282754273797902337,"RT @GavinNewsom: NEW: #COVID19 cases continue to spread at alarming rates.
 
CA is now closing indoor operations STATEWIDE for:

-Restauran…",2020-07-13 19:10:25,
1282754287798550528,I guess so! He's certainly hiding from the covid 19 crises and the complexity of reopening schools. But as Larry Ku… https://t.co/ekTAWRYU29,2020-07-13 19:10:29,Who enjoys writing? Who enjoys editing? Who enjoys presentations? Am I nuts? I enjoy them all and much more. Find out why and what!
1282755691472723971,RT @bluestein: New York’s gov offers Atlanta coronavirus help: ‘Whatever you need.’ #gapol https://t.co/R1X7PWi2ve,2020-07-13 19:16:03,$atlanticvamp
1282755137920958467,RT @brikeilarcnn: The president again saying that more testing equals more cases. He does not understand how testing works. Coronavirus tes…,2020-07-13 19:13:51,*Masters Degree-Rank1 in Education-Surviving BreastCancer 2010- Fight for what I Believe In- 💙KY Wildcats-💙Football/Basketball-The Blue Wave- NO DM
1282755817800978434,RT @StuartAllenFCMI: What’s your post COVID B2B sales strategy? Clients won’t want your sales teams on their sites! Need help to reengineer…,2020-07-13 19:16:34,"City Signs are Worcester's leading sign company, providing high quality signage around Worcester and the Midlands. Est.1960 #worcestershirehour partner"
1282755233916104704,RT @TimminsToday: More Timmins businesses can re-open Friday https://t.co/KKVeL1W28t https://t.co/8MVQQGvPHu,2020-07-13 19:14:14,"Chamber Executive, Teacher, Community supporter, Mother, Friend, Life Partner, Diva (to 3 rad girls) https://t.co/G7wYyv3vNc"
1282755825531072514,@FrankiesTooLoud Lol mid game mid season of last year vs post pandemic pre delayed season pic. Interesting.,2020-07-13 19:16:35,"Mets Giants Knicks 
I’m the greatest Twitter GM  
Thank you Eli 🙏🏼
Thank you David Wright 🙏🏼
Argue with me"
1282755824780218369,RT @graceblakeley: This is shocking. A manager at a cleaning company is caught on tape sayiing she'll only give outsourced cleaners PPE and…,2020-07-13 19:16:35,"Want a society with a fair chance & decent quality life for all, support cruelty free products & alternatives to animal testing #ForTheMany #WeAreAllDanielBlake"
1282755326316437504,"RT @aliamjadrizvi: Excellent annotated graph of coronavirus cases in the US

#CoronaDon https://t.co/bXbxFZOnZD",2020-07-13 19:14:36,The exact opposite of Tucker Carlson.
1282755237397356544,RT @ChuckRossDC: I guess Cuomo's graphics team couldn't find clipart of grandma dying in a nursing home. https://t.co/pftoM1vYTz,2020-07-13 19:14:15,"Mother, Mathematician, Educator, Marine Brat, Patriot and Concerned Citizen. Love God, my Family, Friends and Country!"
1282755564427255809,"@lozhbd @ltzig @MichaelRosenYes Some shops (like bus drivers) have screens, and therefore dont need to wear a mask.… https://t.co/au8ixRcDJH",2020-07-13 19:15:33,
1282755335216914433,"RT @MichaelRosenYes: If you are thinking of tweeting on my timeline that Covid-19 is harmless, or it’s a hoax or that it’s all a trick, ple…",2020-07-13 19:14:39,"Left Wing History and Politics Student, Northern, 22."
1282755212554502148,"RT @JoaquinCastrotx: .@SenTedCruz, my dad just tested positive again for COVID after his wife, my stepmom, died last Friday from it.

As yo…",2020-07-13 19:14:09,"#Resist. #BLM #NativeLivesMatter #WearAMask😷🌊🌊🌊🌊🌊 No MAGAs. No DM's, please."
1282755615740362752,"RT @aintacrow: The longest strike in US History is struggling to survive coronavirus (from May, 2020) -- on the #SpectrumStrike https://t.c…",2020-07-13 19:15:45,zach * 28 * fem * he/him * white * frequently nsfw * 🔞
1282755204652453892,RT @thedesirina: Match your “wear a damn mask” energy with “pay people to stay home” energy and “cancel rent” energy,2020-07-13 19:14:07,"I rebuke colonizers in the name of Black Jesus
//Black, Trans, NB Woman, Angry, & Wholesome. She/them
$Melanatednblessed
ACAB"
1282755820158177280,RT @aaronpcalvin: Here’s where asking Iowans to “step up and be responsible” has gotten us so far. https://t.co/q56Patpi38,2020-07-13 19:16:34,RT's with some opinions thrown in. self employed. rts and likes=interesting. opinions mine not employers
1282755258209402880,"Yeah, that's true Corona virus is up. And for those who didn't wear mask, you're the cause. And now the healthcare… https://t.co/RudXsddnf8",2020-07-13 19:14:20,"I'm JC 1996-97 June/June JC announces he's running for president 2016 Aired New Year's Eve 2015 done in May97 Be4 Trump July bid 2016. ""NO HOAX"" Tks4fwMeSn2fwU"
1282755612078747654,"RT @msf_yemen: On June 24, 60-year-old Ghanem Qaid Nasser from Al-Sayani district in #Ibb governorate, was admitted in serious conditions t…",2020-07-13 19:15:45,#BlueForSudan كُلُّ مَنْ عَلَيْهَا فَانٍ
1282755837941870592,Another Covid-19 observation:  More demand for moving goods. Less demand for moving people.  Transportation and del… https://t.co/au8djzcyDU,2020-07-13 19:16:38,"Designing a better future.

Experience focused systems thinker ||  Orthodoxy disruptor || Change Instigator || SoCal Sports || Emerging Tech || TEDx Speaker"
1282755322168381441,RT @KILLBILLEVOL1: Please watch this!!!! Especially if you’ve tested positive for COVID 19 and have recovered!!!!!! https://t.co/tQ5e19YcDg,2020-07-13 19:14:35,big dumb stupid fuck face 🖤
1282755254329589760,Hope everyone is having a CDC-approved #NationalFrenchFryDay! https://t.co/GtBkiHObJK,2020-07-13 19:14:19,everybody was jealous of them french fries
1282755511041929216,"RT @Alythuh: PSA 

I am a Las Vegas resident. Tourists: please stay the fuck out of Vegas. Dont come here to party or club. A lot of barten…",2020-07-13 19:15:20,"indescribable • /ˌindəˈskrībəb(ə)l/ • adjective • too unusual, extreme, or indefinite to be adequately described. 👽🌹"
1282755136658513920,"RT @NC5PhilWilliams: THIS IS HUGE!!! Tennessee sets an astounding one-day record of 3,314 new #COVID19 cases. Detailed analysis to follow.…",2020-07-13 19:13:51,"Tennessee, Predators, Braves, Titans, Music City, USA, deep thinker, Science nerd, Avid Poet, Artist, Progressing this nation in a positive direction. He/Him"
1282755695515971584,"If he was asked to put on a mask and refused, he should have been physically stopped from boarding. If the attendan… https://t.co/3kgAcijaHs",2020-07-13 19:16:04,
1282755816819265538,RT @_brii95: Just a preview of what’ll happen in every school in the fall,2020-07-13 19:16:33,"•The best palm tree™

•Film and television geek

•Too invested in politics

•Paddington, Veep, and Spider-Man stan"
1282755410609360897,RT @ManMundra: Why don’t you just resign and get lost! @WHO,2020-07-13 19:14:56,"कट्टर हिन्दुत्ववादी, भाजपा समर्थक"
1282755681850974208,RT @_kate_the_grate: y’all some hating ass hoes on this app,2020-07-13 19:16:01,direct messages are on behalf of @theSBLB ——— remember. you don’t know me in real life. + iongiveafuckboutnunnadatshit.
1282755133391036416,"RT @camanpour: .@edyong209: “A country that, 7 months into a pandemic, still cannot ensure that its healthcare workers have enough gowns an…",2020-07-13 19:13:50,"Just a wife, mom & caregiver trying to not lose my mind.  Proud Karuk tribal member."
1282755619410280451,"RT @foodformzansi: TODAY IN AGRICULTURE: Alcohol industry back under lockdown, economists expect pineapple sales to skyrocket this week and…",2020-07-13 19:15:46,itsAGRI is an Urban farming & Controlled Environment Agricultural Enterprise. |Aquaculture | Vertical Farming | Precision Farming | Lucerne |
1282755380569939968,"Does this A-hole @realDonaldTrump really believe that testing causes Covid-19? The ""cases"" would still be there wit… https://t.co/Pz5kLPowXG",2020-07-13 19:14:49,Grandma in Florida #Twin  #NotMyPresident  #LoveTrumpsHate  #Resist  #Vote
1282755704114368512,RT @WestergrenJon: @fras99 No in fact I would inform the Trump supporter that Trump's lie about the severity of the coronavirus cost more A…,2020-07-13 19:16:06,
1282755821080915969,"RT @jimsciutto: “I know it isn’t popular to talk about in some Republican circles, but we still have a testing problem in this country. My…",2020-07-13 19:16:34,Facts matter. Science matters. America matters. The campaign to cut the cancer of anti-democratic actors and misinformation profiteers has begun. Vaccinate!
1282755322294173696,RT @brikeilarcnn: The president again saying that more testing equals more cases. He does not understand how testing works. Coronavirus tes…,2020-07-13 19:14:35,
1282755573109358595,"RT @DrRosena: Shame on the Government. 

Their new 'Health and Care Visa' excludes social care workers. 

After months of publicly clapping…",2020-07-13 19:15:35,"Professor of Health Economics, Department of Health Policy, London School of Economics and Political Science"
1282755150369763330,RT @RexChapman: When New York hit 10K of Coronavirus cases Cuomo shut it down...when Florida hit 10K DeSantis allowed ‘em to open Disney Wo…,2020-07-13 19:13:54,"Mom, Industrial Engineer/Computer Science, civil rights and environmental activist, love nature, all animals, proud liberal, RESIST☮️🇺🇸"
1282755490489892864,RT @bugwannostra: I think understanding Australias #coronavirus response comes from understanding who has our politicians ears. Just about…,2020-07-13 19:15:16,
1282755678835216386,RT @AmoneyResists: @marklevinshow At first I thought you were just racist but you’re also genuinely profoundly stupid. Obama took this for…,2020-07-13 19:16:00,"USAF vet, mother, cancer survivor, civil rights supporter. #BLM. I enjoy a good hoisted petard."
1282755807805878273,"RT @StefSimanowitz: This interview was 3 months ago.

It should have put an end to the absurd ""face mask debate"".

Instead, @MattHancock, @…",2020-07-13 19:16:31,"""DRINK COFFEE, PUT ON SOME PUNK ROCK AND HANDLE IT."" (PuNkandStuff - yay)"
1282755392875843584,https://t.co/O2tfqj9eH9 we love 2 see it,2020-07-13 19:14:52,lil leo energy
1282755820682436619,RT @BarackObama: Voting by mail shouldn't be a partisan issue––especially during a pandemic. Everybody should be able to request an absente…,2020-07-13 19:16:34,we stand with you she/her
1282755565224165376,"RT @mowermanjimmy: The randomly selected photograph and therefore this weeks winner of the #patchoftheday competition is @dlcarty
Congratul…",2020-07-13 19:15:33,"Full Time Broadcast Engineer, Hubby, Daddy, Labrador Owner.
Occasional Sound Engineer, Cyclist, Runner.
Obsessed with cutting the grass!"
1282755527915835392,"RT @Gill__13: the mandate. Her home country is on lockdown because President Bolsonaro is treating the pandemic like a hoax, and their deat…",2020-07-13 19:15:24,Salvi Girl 🇸🇻
1282755821097463808,"RT @K_JeanPierre: We are in the middle of a global pandemic. More than 135,000 people in the U.S. have died of #COVID19. Instead of being a…",2020-07-13 19:16:34,"Tech PM, Software Dev Mgr, scrum master, promoter of new technologies and ideas to save companies money on IT"
1282755498224218112,"RT @Larry_Svenson: A request for proposals is now open to review of all aspects of the Alberta pandemic response, including:
health system…",2020-07-13 19:15:17,Assistant Professor @UAlbertaSPH. Public health; health services and systems; substance use; drug policy. She/her.
1282755167452934144,RT @TeamPelosi: Opening our schools without the necessary planning and investment of resources to achieve a threshold of safety for our chi…,2020-07-13 19:13:59,"Unapologetic leftist, atheist, and feminist. This battle is won, but not the war. Fascism still lurks. Rejoice, then roll your sleeves up #TwistedResisters"
1282755141511323649,RT @RexChapman: When New York hit 10K of Coronavirus cases Cuomo shut it down...when Florida hit 10K DeSantis allowed ‘em to open Disney Wo…,2020-07-13 19:13:52,
1282755820501991425,Bruh if all sports get cancelled this year due to covid 2020 will officially be the worst year of humankind,2020-07-13 19:16:34,NEW TWITTER DRON FERRARI
1282755481103204355,"RT @GavinNewsom: NEW: As #COVID19 cases and hospitalizations continue to rise, 30 counties will now be required to CLOSE INDOOR OPERATIONS…",2020-07-13 19:15:13,Justice will always prevail. Joe Biden is America’s president. @fbi
1282755355773218820,RT @_brii95: Just a preview of what’ll happen in every school in the fall,2020-07-13 19:14:43,"hi it's Ellen, ur friendly neighborhood bisexual and her multi-fandom mess of a Twitter. mostly superheroes, Star Wars, & TV shows."
1282755417894944769,RT @Lulu4Ukon: My mother passed away this morning from a heart attack related to COVID-19.,2020-07-13 19:14:58,"Progressively political social activist, MU J-school grad, WashU law student"
1282755511301988354,RT @SteveSchmidtSES: The CEO of American Airlines should ban Ted Cruz from the airline today.  Senators are not above the law or airline po…,2020-07-13 19:15:20,"Vietnam Vet USMC, Strong Supporter of Celebrity News and SAGA"
1282755778533711872,"RT @Nomad_Urbanista: #Delhitweeps pls RT #Urgent need of plasma with #bloodgroups O+, A+, B+, AB+ for patient in critical state due to #Cor…",2020-07-13 19:16:24,"निशान चूक माफ है, नहीं माफ तो नीचा निशान
RTS Not Endorsement"
1282755184326656000,RT @EricssonDigital: Is edge computing the key to building enterprise business in the wake of COVID-19? Hear from our experts - register fo…,2020-07-13 19:14:03,We are a global social-networking and consulting platform aiming at educating small businesses and large corporations on cloud computing. Do you think you know.
1282755712205107200,RT @deadeyebrakeman: why I won’t wear a mask https://t.co/CyiKIgWuwF,2020-07-13 19:16:08,♋︎ ☉ ♐︎ ☾ ♎︎ ↑
1282755292812292097,"RT @GavinNewsom: NEW: As #COVID19 cases and hospitalizations continue to rise, 30 counties will now be required to CLOSE INDOOR OPERATIONS…",2020-07-13 19:14:28,IG: Viarabarajass 🌙
1282755539441606658,Not russ https://t.co/LJRJvUTCAB,2020-07-13 19:15:27,lord is my savior
1282756483113984006,RT @KeeangaYamahtta: And it begins...,2020-07-13 19:19:12,she/her/sometimes they. Learning much/much to learn. Smash the Patriarchy! Resist! #BlackLivesMatter
1282756228041650177,“Swept Away”: Amitabh Bachchan Writes To Fans From Hospital’s COVID Ward https://t.co/mqD9T9knyn,2020-07-13 19:18:11,World Newj is a web news blog. Here you can get latest news around ourselves.
1282756210412806145,"RT @Robin_Blue19: Japan has had less than 1000 Covid deaths. It is 12 times more densely populated than the US, and they have more elderly…",2020-07-13 19:18:07,Aspiring SSBU and RoA player. Used to play lots of Melee and PM. Big Smash bros/platform fighter fan in general. Fan of game preservation.
1282756500574830594,RT @AngrierWHStaff: The President and his allies are now accusing doctors and nurses who are treating COVID — and watching their patients s…,2020-07-13 19:19:16,"Dem activist, atheist, & vet. Trump is a lying, racist, traitorous, grifter asshole. If u hate Trump then I like you. Fuck that guy!! #Resist #FBR #BLM #Racism"
1282755891951923201,"California is going wayyyyy back with #COVID19 closures. 

No more bars dine-in restaurants and many entertainment… https://t.co/IAW7qdmvFj",2020-07-13 19:16:51,Evening Anchor at @kion546 in Salinas/Monterey/Santa Cruz. Come for local news. Scroll through Miami/Terps sports tweets. @merrillcollege grad. Tweets are mine
1282756647656407041,My aunt genice went into the hospital last Monday for COVID symptoms and 7 days laters we learned she passed away .… https://t.co/oHHKICxacO,2020-07-13 19:19:51,"aloha 🤙🏾🌺 who cares about my credits and where I currently “work” . just paint , connect and have fun ."
1282756148521820161,RT @MarkJacob16: Lying about a pandemic is one of the most reprehensible things a president has ever done.,2020-07-13 19:17:52,Fighting for freedom & rights of all the living. Can be vexing. Boomer Sooner. PJ & DMB. Dogs rule  🏊‍♀️🚴‍♀️🇨🇮🌊 JRL🖤BLM 💙 I Dissent ✌
1282756588483366912,"RT @camanpour: .@edyong209: “A country that, 7 months into a pandemic, still cannot ensure that its healthcare workers have enough gowns an…",2020-07-13 19:19:37,Friend. Librarian. Teacher. Artist. Patron. Ally. Advocate. Activist. Listener. Human. And SO much more. My personal account--my thoughts are my own. she/they
1282756055793950720,"@himantabiswa And some are trying hard to say Corona is a Hoax... Shame on them, without 🔐, cases would have been a… https://t.co/0dxNDtT43R",2020-07-13 19:17:30,#ProudNationalist 🙏 Make this World a Better Place for Future Generations! Good Politics is the only way to change the Life of society! RT's r personal views.
1282756479196381184,RT @jenhab: My story: Hundreds of millions of syringes will be needed for a COVID vaccine next year. The Trump administration is relying la…,2020-07-13 19:19:11,"Deep breath...we fight on.
I will not respond to ""raise your hand"" tweets."
1282756134953029632,It's habit of BJP @republic #AmitShah #4200Gujrat #Bengal https://t.co/DgEi719dyq,2020-07-13 19:17:49,
1282756307162763264,RT @JoyAnnReid: Instead of CONFRONTING THE PANDEMIC!,2020-07-13 19:18:30,What makes me special? Nothing. Absolutely nothing. I’m a dime a dozen. I am Spartacus. And you can too.
1282756541742022660,"RT @Scaramucci: He is the biggest super spreader in history. There was a Typhoid Mary, now we have a Corona Don.",2020-07-13 19:19:26,"Breast Ca. Survivor,pediatric nurse, married to a wonderful man,we as a great country must help the disabled, poor, & old! #standindivisible. #theresistance"
1282756668586102784,RT @Mr_BQC: Just cancel it. Please @NBA,2020-07-13 19:19:56,Straight like that huh?.. R.I.P. Cherish K. 🕊🔑 Roll the dice & take a chance. 🎲 R.I.P. Travon 🕊🙏🏾 #TMC
1282755938198290432,"RT @GavinNewsom: NEW: As #COVID19 cases and hospitalizations continue to rise, 30 counties will now be required to CLOSE INDOOR OPERATIONS…",2020-07-13 19:17:02,♉️ 🌞 ♓️ 🌙 🌈 🎼 🥮 IG: @bornacorgi
1282755950244499457,"RT @hossehenad: Captured today at 10:45am — @TedCruz on a commercial flight, refusing to wear a mask. https://t.co/h8DM7J4CMi",2020-07-13 19:17:05,"We only have one planet, it’s time we started taking care of it. ☮️🤝🌎 Peace and love to all."
1282756480312184833,BREAKING NEWS!!! FG to pay salaries to private school teachers due to lockdown https://t.co/wdi9fzN8dg,2020-07-13 19:19:12,"read all today’s breaking news headlines; world, politics, sports, entertainment, daily devotionals, cryptocurrency, technology, music, and more in one place"
